date,username,to,replies,retweets,favorites,text,geo,mentions,hashtags,id,permalink
2020-03-12 15:19:19,Jcgambini,adolfobolivar4,1,0,4,"Además del covid-19 habrá una epidemia de virus estomacal? Parece que todo el mundo está con una brava!!!",,,,1238122404926361601,https://twitter.com/Jcgambini/status/1238122404926361601
2020-03-12 15:15:57,RLBevilacqua,,0,4,0,"¿Dónde están los medios que no joden a los pituquitos que compran impulsivamente por miedo al #Covid_19 para que les metan el micrófono a la cara y los increpen?, ¿o solo eso hacen con la gente marrón en épocas de huayco?",,,#Covid_19,1238121559711199238,https://twitter.com/RLBevilacqua/status/1238121559711199238
2020-03-12 15:09:27,machiseminario,drhuerta,0,0,0,"Lo que necesita la población es vacunarse contra la ignorancia. #Covid_19 #Coronavirus #Pandemia",,,#Covid_19 #Coronavirus #Pandemia,1238119921722241026,https://twitter.com/machiseminario/status/1238119921722241026
2020-03-12 14:21:57,jjaime,AlonsoMujica1,0,0,1,"Nunca van a cambiar porque la ignorancia es mas resistente que el Covid-19",,,,1238107969516122113,https://twitter.com/jjaime/status/1238107969516122113
2020-03-12 14:13:28,pilarpuente1,arianalirad,0,0,0,"Ojo @Minsa_Peru @SuSaludPeru debe monitorear calidad de información de línea 113 #COVID19 #coronavirusperu",,@Minsa_Peru @SuSaludPeru,#COVID19 #coronavirusperu,1238105835945033728,https://twitter.com/pilarpuente1/status/1238105835945033728
2020-03-12 14:12:19,peruhacking,,0,0,0,"Medidas a adoptar por emergencia sanitaria en Peru por COVID-19 [coronavirus] ",,,,1238105544348622851,https://twitter.com/peruhacking/status/1238105544348622851
2020-03-12 14:02:01,CCriolloHuaman,,1,0,2,"#PreguntaDelDía En países desarrollados se limpia a diario los buses usados para el transporte público como prevención al Covid-19. ¿Sudamérica tiene la capacidad para ello?",,,#PreguntaDelD,1238102952742715393,https://twitter.com/CCriolloHuaman/status/1238102952742715393
2020-03-12 13:59:52,jorgeperezdr,,1,0,0,"CORONAVIRUS (COVID-19) Los números no mienten. Debemos priorizar el cuidado de nuestros adultos mayores. Vacuna contra neumococo e influenza ya!!! ",,,,1238102412474363905,https://twitter.com/jorgeperezdr/status/1238102412474363905
2020-03-12 13:49:03,pamelacarrdi1,Sr_Quest,0,0,0,"El Covid 19 es selectivo. No ataca a brutos.",,,,1238099690748600321,https://twitter.com/pamelacarrdi1/status/1238099690748600321
2020-03-12 13:40:50,KimSora1803,,0,0,3,"Me comentan que en la minera china Shouxin hay un par de casos de unos chinos infectados con el CoVid19. La gente ya está entrando en pánico por allá. Inician a fumigar recién. Me jode que no haya habido prevención. Enciérrense si vienen de viaje. CSM.",,,,1238097620381437952,https://twitter.com/KimSora1803/status/1238097620381437952
2020-03-12 13:35:28,jorgeachata,yavecesnieso,0,0,0,"Gracias a tu papá y a toda tu familia. De todo corazón. Y a tí por compartir. #aguayjabón #COVID19",,,#aguayjab #COVID19,1238096272734801922,https://twitter.com/jorgeachata/status/1238096272734801922
2020-03-12 13:32:25,urodasm71,,0,0,0,"Lo que dijo el Dr. Solari el Presidente de la República debe tomar el liderazgo y llamar a los cancilleres de América Latina y tomar un acuerdo para que las aerolíneas solo transporten personas que presenten su certificado de que no está infectado de covid19",,,,1238095504497672192,https://twitter.com/urodasm71/status/1238095504497672192
2020-03-12 13:29:33,awallaced,elpanfletope,1,0,0,"-oe y en tu pais estan tomando medidas contra el #Covid_19? -pues... ",,,#Covid_19,1238094782121025536,https://twitter.com/awallaced/status/1238094782121025536
2020-03-12 13:23:56,primerafuente1,,0,0,5,"#Covid_19 #COVID19 La mejor medida que puede tomar el gobierno peruano es lo que, ya tarde, impuso Italia: que salga la menor cantidad de gente a la calle. Si el virus esta en superficies diferentes ¿te vas a poner mascarilla, guantes?",,,#Covid_19 #COVID19,1238093368976080897,https://twitter.com/primerafuente1/status/1238093368976080897
2020-03-12 13:15:57,f_bardales,,0,1,1,"Salió DS.008-2020-SA, suspensión clases, en foto resumo lo q hace mi familia, no ir al colegio, NO SEAS FOCO D PROPAGACIÓN del COVID19. El concepto más importante durante una epidemia. Tu comportamiento no sólo tiene consecuencias sobre tu salud, sino sobre la salud de los demás ",,,,1238091360172941319,https://twitter.com/f_bardales/status/1238091360172941319
2020-03-12 12:58:40,juanksurf,,0,1,2,"#covid19 #ecuador llego a peru y confirman 17 en una semana casos y en ecuador siguen en 17 hac jaajaja algo no me cuadra",,,#covid19 #ecuador,1238087011858370566,https://twitter.com/juanksurf/status/1238087011858370566
2020-03-12 12:50:06,jvgallegos,,0,0,5,"Esto le pasó a una amiga española ayer. Se está revelando lo peor de la sociedad peruana, gracias al Covid-19 y la migración venezolana. Ya la migración del mundo rural al urbano destapaba lo malo del Perú - su clasismo y discriminación. La pus no termina de aflorar. ",,,,1238084854408835072,https://twitter.com/jvgallegos/status/1238084854408835072
2020-03-12 12:49:41,orangelvalero,,1,0,1,"#AEstaHora @CONMEBOL suspende hasta nuevo aviso las Eliminatorias Mundialistas a Qatar #COVID19 ",,@CONMEBOL,#AEstaHora #COVID19,1238084750507675651,https://twitter.com/orangelvalero/status/1238084750507675651
2020-03-12 12:47:06,Cobbita,,0,0,0,"#LoÚltimo Mediante un comunicado oficial, el #RealMadrid ha confirmado q un jugador de Baloncesto del mismo club ha dado positivo a la prueba de #coronavirus Por ello, el club ha tomado la decisión de poner en #cuarentena tanto al equipo de Baloncesto como de Fútbol. #Covid_19 ",,,#Lo #RealMadrid #coronavirus #cuarentena #Covid_19,1238084099128033280,https://twitter.com/Cobbita/status/1238084099128033280
2020-03-12 12:45:35,orangelvalero,,0,0,0,"#AEstaHora el #COVID19 llega al @realmadrid donde un atleta del primer equipo de baloncesto a dado positivo, la institución cierra sus instalaciones de la Ciudad Real Madrid, pone en cuarentena a sus empeñados y jugadores tanto de Fútbol como de Baloncesto",,@realmadrid,#AEstaHora #COVID19,1238083716255223808,https://twitter.com/orangelvalero/status/1238083716255223808
2020-03-12 12:30:41,dpachecorojas,,2,1,3,"#dudaRAE: Es válido colocar mayúscula a la palabra «coronavirus» o «covid-19» ya que son nombres de la enfermedad que lo indica.",,,#dudaRAE,1238079966727856129,https://twitter.com/dpachecorojas/status/1238079966727856129
2020-03-12 12:27:06,Abdelo17,,0,0,0,"@doctormacias el despistaje de covid-19 es 100% efectivo? Luego de cuanto tiempo (días,horas, semanas, etc) de contraído es detectable? Buenos días.",,@doctormacias,,1238079066793750529,https://twitter.com/Abdelo17/status/1238079066793750529
2020-03-12 12:22:05,Fermaling,LaLiga,0,0,0,"@LaLiga suspende la fecha 28 y 29 por el coronavirus. #Covid_19 ",,@LaLiga,#Covid_19,1238077804920606721,https://twitter.com/Fermaling/status/1238077804920606721
2020-03-12 07:19:52,Carf29T100,elmundoes,0,1,0,"Que espera... @presidenciaperu @MartinVizcarraC @CancilleriaPeru @pcmperu @Defensoria_Peru @Minsa_Peru Para tomar una decisión similar? @RPPNoticias @canalN_ @noticias_tvperu @24Horas_Pantel @Latina_Noticias @noticiAmerica @atvmasnoticias Esperan lamentar victimas..? #COVID19 ",,@presidenciaperu @MartinVizcarraC @CancilleriaPeru @pcmperu @Defensoria_Peru @Minsa_Peru @RPPNoticias @canalN_ @noticias_tvperu @24Horas_Pantel @Latina_Noticias @noticiAmerica @atvmasnoticias,#COVID19,1238001747433488384,https://twitter.com/Carf29T100/status/1238001747433488384
2020-03-12 05:01:55,brendalozavalen,Giulia_Sammarco,1,1,1,"Poco o nada servirá lavarse las manos decenas de veces, cuando lo primero que hacemos es coger el celular de por sí contaminado. #CoronaAlert es una prueba màs de nuestra preocupante dependencia a los artículos electrónicos. #Covid_19 ",,,#CoronaAlert #Covid_19,1237967032341204992,https://twitter.com/brendalozavalen/status/1237967032341204992
2020-03-12 04:43:13,JesusRMS7,,0,0,0,"""El coronavirus ya está en las canchas"" Lo que tanto se temía ya es real, son varios los jugadores que están infectados con el COVID-19. Ya son muchas las ligas que empezaron a tomar medidas al respecto.",,,,1237962328257241088,https://twitter.com/JesusRMS7/status/1237962328257241088
2020-03-12 04:09:04,Ppukkita,,0,0,0,"Covid-19 está en 112 países y los 5 continentes es pandemia",,,,1237953731515371520,https://twitter.com/Ppukkita/status/1237953731515371520
2020-03-12 03:10:29,fernandomunioz7,JuanSheput,5,13,43,"Este es otro politico que aprovecha lo del coronavirus #Covid_19 #CODVID19 Juan. Sheput @JuanSheput para atacar al mismo gobierno que fue parte Hay que ser muy bajo para criticar sin ser especialista Que dirá de las medidas de #Paraguay o de @realDonaldTrump Da vergüenza",,@JuanSheput @realDonaldTrump,#Covid_19 #CODVID19 #Paraguay,1237938989782499330,https://twitter.com/fernandomunioz7/status/1237938989782499330
2020-03-12 03:05:42,JohnnyFitCoach,,0,0,0,"¡Aprende a lavarte correctamente las manos! Recuerda que el lavado frecuente de manos es una de las formas más eficaces para reducir la propagación de enfermedades diarreicas y respiratorias, como el COVID-19! en… https://www.instagram.com/p/B9niypbnB3m/?igshid=f076nvqjhluf",,,,1237937787543920641,https://twitter.com/JohnnyFitCoach/status/1237937787543920641
2020-03-12 02:59:42,Muni_Barranca,,0,0,0," #LOÚLTIMO: Se suspende el Festival Internacional de Surf Barranca 2020 por prevención ante propagación del #coronavirus #COVID19. ",,,#LO #coronavirus #COVID19,1237936274318725120,https://twitter.com/Muni_Barranca/status/1237936274318725120
2020-03-12 02:50:48,jorgeachata,monvalpa,0,9,19,"Brote controlado en Hong Kong por ""strong community response"" (OMS). Necesitamos hacernos responsables los unos de los otros y vernos como iguales. Actuar irresponsablemente le cuesta al que lo haga y a su comunidad. Más de 4000 personas ya han perdido su vida. #COVID19 ",,,#COVID19,1237934037232123906,https://twitter.com/jorgeachata/status/1237934037232123906
2020-03-12 02:38:31,primerafuente1,primerafuente1,0,1,4,"Hilo sobre la actitud de los limeños en las ultimas horas con el #Covid_19 ",,,#Covid_19,1237930943534567424,https://twitter.com/primerafuente1/status/1237930943534567424
2020-03-12 02:36:47,primerafuente1,,1,3,5,"Tu que te consideras culto, informado y responsable fomenta lo mismo en tus amigos y piensen que habrán peruanos que necesitan 2 unidades de las 15 que te llevas porque a ti si te alcanza pero no necesitas. #Covid_19 se solidario, se ciudadano, pelotudo",,,#Covid_19,1237930508174135298,https://twitter.com/primerafuente1/status/1237930508174135298
2020-03-12 02:29:00,primerafuente1,,2,13,21,"Hay que ganarle tiempo al #coronavirusperu #Covid_19. Si no paramos actividades hoy, la curva de infectados va a ser fuerte. Tampoco ir a comprar como locos, si preveer. Es un desafio a nuestro civismo y madurez como ciudadanos. Lastima declaraciones como el pdte de canatur..",,,#coronavirusperu #Covid_19,1237928549035773953,https://twitter.com/primerafuente1/status/1237928549035773953
2020-03-12 02:24:35,JCPP17,,0,1,2,"#Coronavid19 @CoronaVid19PERU @COVID19_Lat Coronate en higiene y limpieza ",,@CoronaVid19PERU @COVID19_Lat,#Coronavid19,1237927437784289282,https://twitter.com/JCPP17/status/1237927437784289282
2020-03-12 02:07:11,RUBYBAUTI,larepublica_pe,0,0,0,"Ya van 17 los casos confirmados con Coronavirus #Covid_19 ",,,#Covid_19,1237923060021428231,https://twitter.com/RUBYBAUTI/status/1237923060021428231
2020-03-12 02:00:02,PedroValleO,,0,1,0,"Tom Hanks también con el covid19, nadie se salva... ",,,,1237921258165149701,https://twitter.com/PedroValleO/status/1237921258165149701
2020-03-12 01:54:18,Loo_JiaLi,,0,0,0,"¡Terrible!Tom Hanks y su esposa han sido infectados con el Covid19. ",,,,1237919818721918977,https://twitter.com/Loo_JiaLi/status/1237919818721918977
2020-03-12 01:43:07,luisalozano,WRadioColombia,0,0,0,"Es q ahí está la dicotomía entre lo urgente (Covid-19) y lo importante (El de Haevey Wenstein).",,,,1237917000942354434,https://twitter.com/luisalozano/status/1237917000942354434
2020-03-12 01:40:23,edgarod,canalN_,0,1,2,"Ya son 17 casos confirmados de #COVID19 en #Perú a intensificar acciones de prevención, control, vigilancia y respuesta sanitaria! @CMP_PERU",,@CMP_PERU,#COVID19 #Per,1237916316251684865,https://twitter.com/edgarod/status/1237916316251684865
2020-03-12 01:33:02,orbisa35,,0,0,10,"Tom Hanks y Rita Wilson tienen coronavirus #coronavirus #covid #covid19 #tomhanks #ritawilson en El Comercio https://www.instagram.com/p/B9nYLulhdzH/?igshid=1dr7ot3abawb",,,#coronavirus #covid #covid19 #tomhanks #ritawilson,1237914464197869568,https://twitter.com/orbisa35/status/1237914464197869568
2020-03-12 01:26:08,edgarod,,0,3,6,"A reforzar las medidas de prevención! #LavadoDeManos y toser como Batman! #COVID19 – at Colegio Médico del Perú",,,#LavadoDeManos #COVID19,1237912730667008001,https://twitter.com/edgarod/status/1237912730667008001
2020-03-12 01:22:05,Luccio_lpx,,14,7,77,"Cuál es la relación entre el #COVID19 y el Papel Higiénico ah ?? Cual es su lógica? Pueden morir con los pulmones reventados, pero con el ""ortiz"" limpio ?",,,#COVID19,1237911711304183808,https://twitter.com/Luccio_lpx/status/1237911711304183808
2020-03-12 01:20:40,Malapalabrero,,4,13,38,"Sr. Presidente @MartinVizcarraC, la lógica es no permitir el ingreso de ninguna persona que venga de Europa a territorio peruano. Está más que claro, cuidemos a nuestra gente. Ya USA hace lo mismo. No subestime la Pandemia #COVID19 (OMS). Cuarentena en casas es una ilusión. Fin.",,@MartinVizcarraC,#COVID19,1237911351974137857,https://twitter.com/Malapalabrero/status/1237911351974137857
2020-03-12 01:18:20,Techtulia,gab007a,0,0,7,"Lo máximo! #Lima pese al #COVID19 jeje ",,,#Lima #COVID19,1237910766390476802,https://twitter.com/Techtulia/status/1237910766390476802
2020-03-12 00:54:27,Simply_Gabriel,,0,0,0,"El #COVID19 #Coronavirud luego será como otro dengue, como decir que tienes sarampión. Quizá como una fiebre amarilla o una hepatitis. Habrá que vacunarse y en caso de contagiarse, cuidarse y ya.",,,#COVID19 #Coronavirud,1237904756351340545,https://twitter.com/Simply_Gabriel/status/1237904756351340545
2020-03-12 00:53:17,fernandomunioz7,24HorasTV,0,0,1,"Señores de @PanamericanaTV @24HorasTV el país con más muertes con #COVID19 es China con más de 3 mil muertos No desinformen El segundo es Italia con 827 Irán el tercero con 354 Infórmense bien https://gisanddata.maps.arcgis.com/apps/opsdashboard/index.html#/bda7594740fd40299423467b48e9ecf6",,@PanamericanaTV @24HorasTV,#COVID19,1237904460296466432,https://twitter.com/fernandomunioz7/status/1237904460296466432
2020-03-12 00:51:04,FranciscoDReyna,canalN_,0,0,1,"La cosa [ COVID-19] está grave ",,,,1237903904920293376,https://twitter.com/FranciscoDReyna/status/1237903904920293376
2020-03-12 00:46:34,fernandomunioz7,,0,1,10,"El joven periodista Paul Jiménez de @atvpe de #AlEstiloJuliana le pregunta a un pasajero señor mayor español cómo está la situación en España sobre el corona virus en el aeropuerto Le responde Jodido como ustedes Jajaja Directo #COVID19",,@atvpe,#AlEstiloJuliana #COVID19,1237902773515169792,https://twitter.com/fernandomunioz7/status/1237902773515169792
2020-03-12 00:36:06,luismorocho,,0,0,4,"Es hora de apoyar la labor de nuestro personal de salud y valorar su trabajo como en Italia se hace con sus profesionales. #Coronavirus #COVID19 ",,,#Coronavirus #COVID19,1237900137135067136,https://twitter.com/luismorocho/status/1237900137135067136
2020-03-12 00:35:52,micostasm,,0,0,0,"Esto del #COVID19 va a traer repercusiones económicas fuertes. Así estamos, primero la salud.",,,#COVID19,1237900076971851776,https://twitter.com/micostasm/status/1237900076971851776
2020-03-12 00:29:02,micostasm,,1,0,1,"En el colegio de mi menor hijo ya acataron la suspensión de clases. Enviaran trabajos virtuales y ya se ha planificado un plan de recuperación. #COVID19",,,#COVID19,1237898358682816514,https://twitter.com/micostasm/status/1237898358682816514
2020-03-12 00:21:41,luismorocho,pucp,0,0,1,"Se veía venir. La @pucp suspende sus actividades académicas hasta el 30 de marzo. #COVID19 #Coronavirus",,@pucp,#COVID19 #Coronavirus,1237896511037399043,https://twitter.com/luismorocho/status/1237896511037399043
2020-03-12 00:07:03,efro0000,,1,0,4,"Día 1 del #COVID19. #Lucas revoloteó todo el día por el departamento. Decidimos hornear. Ya batimos, horneamos y comimos. El criaturo vuelve a revolotear por el departamento.",,,#COVID19 #Lucas,1237892826521694212,https://twitter.com/efro0000/status/1237892826521694212
2020-03-12 00:03:09,A_IgnacioRamos,,1,2,3,"Casos confirmados de #Coronavirus en #AméricaLatina que ha llegado a ser denominado #pandemia Brasil: 52. Ecuador: 17 Argentina: 21/1 Chile: 23 Perú : 15 Costa Rica 22 México: 7 Rep. Dominicana: 6 Colombia: 9 Paraguay: 5 Panamá: 8 /1 Bolivia: 2 186 casos del #COVID19",,,#Coronavirus #Am #pandemia #COVID19,1237891847122534400,https://twitter.com/A_IgnacioRamos/status/1237891847122534400
2020-03-11 23:52:33,RiccardoJt,,1,1,0,"En otras noticias mi colegio se hizo viral por hacer caso omiso a la suspensión de clases debido a la expansión del COVID19. Al verse expuesto no le quedó de otra que dar marcha atrás ",,,,1237889178584530946,https://twitter.com/RiccardoJt/status/1237889178584530946
2020-03-11 22:46:00,Clarabe94729652,glener_kiara,0,0,0,"Cuidado ahora con el COVID-19!! Ya no salgas amiga. Ahora documentales, pelis o buenos libros, menos salidas!! ",,,,1237872431382970368,https://twitter.com/Clarabe94729652/status/1237872431382970368
2020-03-11 22:31:46,J_VELAZCO82,larepublica_pe,0,0,0,"Si claro el muro impide que llegue el #COVID19 ...eres o te haces Trump? América hazte una y desaparece este imbécil.. ",,,#COVID19,1237868848369373188,https://twitter.com/J_VELAZCO82/status/1237868848369373188
2020-03-11 22:25:21,FlaviaPosada,,0,0,0,"Compras por pánico o porque si lo necesitaS: Coronavirus: la psicología detrás de las compras nerviosas por el brote de covid-19 ",,,,1237867235076485121,https://twitter.com/FlaviaPosada/status/1237867235076485121
2020-03-11 21:23:51,fernandomunioz7,,0,0,1,"Ahora que la OMS @opsoms decretó pandemia de #Coronavid19 #COVID19 #Coronavirus con la cantidad de países involucrados espero que a pesar de pérdidas económicas se estudie bien #Olympics2020 de #Japon por Comité Olímpico Internacional Pobre @atvpe que apostó todo por #Tokyo2020",,@opsoms @atvpe,#Coronavid19 #COVID19 #Coronavirus #Olympics2020 #Japon #Tokyo2020,1237851757427879937,https://twitter.com/fernandomunioz7/status/1237851757427879937
2020-03-11 21:22:05,noseaslavistima,Tify66567965,0,0,1,"La gente no lo entiende,pero al estado no le importa el bienestar de sus ciudadanos.Lo único de lo que están velando es que no haya ninguna revuelta pública ni crisis económica para que puedan enriquecerse a costa del ciudadano de a pie. #coronavirus #COVID19 #Peru",,,#coronavirus #COVID19 #Peru,1237851309711036416,https://twitter.com/noseaslavistima/status/1237851309711036416
2020-03-11 21:19:53,fiorella1201,,0,0,1,"#LoUltimo aumentan a 15 los infectados por #COVID19",,,#LoUltimo #COVID19,1237850757744873478,https://twitter.com/fiorella1201/status/1237850757744873478
2020-03-11 21:05:49,fernandomunioz7,Pquirozt,0,0,1,"¿Ahora que has regresado de Europa eres español o italiano ? Porque salvo que te hayas nacionalizado sigues siendo peruano y tenemos un gobierno Que te guste o disguste es otra cosa Chequéate a ver si no tienes #COVID19 #Coronavid19 Salud anda mal hace DÉCADAS Por CORRUPCIÓN",,,#COVID19 #Coronavid19,1237847216183578625,https://twitter.com/fernandomunioz7/status/1237847216183578625
2020-03-11 19:52:39,ManuelMontoyaM,,0,0,0,"BBC News Mundo: Coronavirus: 6 buenas noticias sobre el nuevo virus covid-19 | BBC Mundo. https://www.youtube.com/watch?v=TBuHqj-S9F4 a través de @GoogleNews",,@googlenews,,1237828803105349634,https://twitter.com/ManuelMontoyaM/status/1237828803105349634
2020-03-11 19:26:29,padmejones,jpulgarvidal,1,0,0,"Si el colegio en el que estudian los chicos tiene tantos errores de ortografía (qué manía de ponerle mayúscula a las palabras según se les antoje, eh), ¿qué clase de educación están brindando? Pd. El Covid-19 no es un ""problema"". Es un virus altamente contagioso ",,,,1237822219386003462,https://twitter.com/padmejones/status/1237822219386003462
2020-03-11 19:22:53,lifeasro,,1,0,0,"en medio de esta pandemia, debo ser la única loca que está viajando a Londres. #COVID19",,,#COVID19,1237821312598409216,https://twitter.com/lifeasro/status/1237821312598409216
2020-03-11 19:11:46,MetzyNieto,,0,0,0,"La Organización Mundial de la Salud catalogó como pandemia al coronavirus Covid-19 ",,,,1237818514435604481,https://twitter.com/MetzyNieto/status/1237818514435604481
2020-03-11 18:54:45,jucenaf,,0,0,0,"Para entender por qué se declara como pandemia por la OMS al COVID-19 : Coronavirus: la OMS declara pandemia al covid-19 ",,,,1237814233674457089,https://twitter.com/jucenaf/status/1237814233674457089
2020-03-11 18:31:17,luxtriste,,2,0,12,"yo: *junto plata para ir a españa este año* COVID-19: ",,,,1237808326630612999,https://twitter.com/luxtriste/status/1237808326630612999
2020-03-11 18:05:52,fernandomunioz7,,0,0,3,"Está usando lo de #COVID19 #Coronavid19 Corona Virus para atacar al gobierno , a la ministra de Salud @Minsa_Peru En estos momentos no se puede usar la salud como trampolín político Una vergüenza el médico Solari Seguir recomendaciones de la @opsoms De ustedes depende",,@Minsa_Peru @opsoms,#COVID19 #Coronavid19,1237801930338033666,https://twitter.com/fernandomunioz7/status/1237801930338033666
2020-03-11 18:01:32,flaaxs,robgampue,1,0,1,"Si el chape no te contagió... el rimming no lo va a hacer. Al menos no el Covid-19.",,,,1237800841584824320,https://twitter.com/flaaxs/status/1237800841584824320
2020-03-11 17:58:38,fernandomunioz7,,7,17,69,"Hay personas que aportan y otras que solo critican y lo hace a la actual ministra de salud @Minsa_Peru El ex ministro médico Luis Solari @luissolarif que fue candidato al congreso por Solidaridad Nacional usa el #Coronavid19 #COVID19 para atacar al gobierno Vergüenza de médico",,@Minsa_Peru @luissolarif,#Coronavid19 #COVID19,1237800110983196675,https://twitter.com/fernandomunioz7/status/1237800110983196675
2020-03-11 17:46:01,MoDigital,canalN_,0,1,0,"""Pandemia no es una palabra para usar a la ligera o descuidadamente. Si se usa incorrectamente, puede causar un miedo irrazonable o una aceptación injustificada de que la lucha ha terminado, lo que lleva a sufrimiento y muerte innecesarios"", @DrTedros @opsoms #COVID19 coronavirus ",,@DrTedros @opsoms,#COVID19,1237796938688299010,https://twitter.com/MoDigital/status/1237796938688299010
2020-03-11 17:19:51,Niv170727,,0,0,1," Previniendo el #Coronavirus #COVID19 en el ámbito laboral. La OMS lo declara como una ""pandemia global"". ",,,#Coronavirus #COVID19,1237790352997617665,https://twitter.com/Niv170727/status/1237790352997617665
2020-03-11 17:14:49,fernandomunioz7,NicolasLucar,2,2,5,"Disculpe periodista Nicolás Lucar @NicolasLucar ha sido usted irresponsable al ir a trabajar a radio @exitosape con síntomas de #Coronavid19 #COVID19 viniendo de España Si lo tiene ya contagio a todos los que estuvieron a menos de 2 metros con esa tos que tiene ",,@NicolasLucar @exitosape,#Coronavid19 #COVID19,1237789085898588160,https://twitter.com/fernandomunioz7/status/1237789085898588160
2020-03-11 16:39:11,Loo_JiaLi,,0,0,0,"Último!Presidente @MartinVizcarraC en conferencia,declara suspensión de clases escolares a nivel nacional por el COVID19. Via @canalN_ Pd.Turistas procedentes de Italia,España y Francia seran aislados en aeropuerto Jorge Chávez.",,@MartinVizcarraC @canalN_,,1237780116329172994,https://twitter.com/Loo_JiaLi/status/1237780116329172994
2020-03-11 16:36:05,Luccio_lpx,,0,0,11,"Todavía recuerdo con nostalgia , aquella promesa que me hice a finales del 2019, de viajar al exterior este año por vacaciones. Se fue a mierda ! Ahora solo quiero llegar vivo al 2021 #Coronavid19 #COVID19 #coronavirusperu",,,#Coronavid19 #COVID19 #coronavirusperu,1237779336670765056,https://twitter.com/Luccio_lpx/status/1237779336670765056
2020-03-11 16:31:52,elgatopop,,0,1,1,"La batalla final . . . #covid19 #coronavirus #peru #cartoon #viñeta #gatopop #luistorres #gatos #cats #cosadegatos #kitty",,,#covid19 #coronavirus #peru #cartoon #vi #gatopop #luistorres #gatos #cats #cosadegatos #kitty,1237778276615098370,https://twitter.com/elgatopop/status/1237778276615098370
2020-03-11 15:57:12,Niv170727,,0,0,0,"Se postergan las clases escolares hasta el 30 de marzo a nivel nacional. Presidente @MartinVizcarraC dicta medida de prevención ante #Coronavirus #COVID19.",,@MartinVizcarraC,#Coronavirus #COVID19,1237769550575239169,https://twitter.com/Niv170727/status/1237769550575239169
2020-03-11 15:48:40,Malapalabrero,,7,23,100,"Idel Vexler: ""lo más fácil es suspender las clases"". El educador aprista dice que 100 millones no resuelve problema de infraestructura en poco tiempo, debe ser focalizado. ¿Focalizado? Se trata de aislar focos infecciosos. Desconoce realidad de Covid19. Vexler hace política.",,,,1237767406002585600,https://twitter.com/Malapalabrero/status/1237767406002585600
2020-03-11 15:46:05,rossanalema,,0,0,0,"@MineduPeru señor ministro postergue tambien las clases en las universidades estatales y privadas. Solo para prevenir el contagio del #COVID19 . Las clases se pueden recuperar. Tome la decisión ya, el lunes empiezan varias.",,@MineduPeru,#COVID19,1237766752500699138,https://twitter.com/rossanalema/status/1237766752500699138
2020-03-11 15:44:38,ersyeliana,verdesrosas,0,0,0,"Y encima escribe mal...¿no es COVID-19?",,,,1237766389722746881,https://twitter.com/ersyeliana/status/1237766389722746881
