date,username,to,replies,retweets,favorites,text,geo,mentions,hashtags,id,permalink
2020-03-16 14:44:07,ivanfajardo,,0,0,0,"Remembranza. #estadodeemergencia #cuarentena #yomequedoencasa #covid_19 ",,,#estadodeemergencia #cuarentena #yomequedoencasa #covid_19,1239563098916339712,https://twitter.com/ivanfajardo/status/1239563098916339712
2020-03-16 14:33:28,chrisfer827,,0,0,0,"DECRETO DE URGENCIA Nº 026-2020 ESTABLECE DIVERSAS MEDIDAS EXCEPCIONALES Y TEMPORALES PARA PREVENIR LA PROPAGACIÓN DEL CORONAVIRUS (COVID-19) EN EL TERRITORIO NACIONAL https://busquedas.elperuano.pe/normaslegales/decreto-de-urgencia-que-establece-diversas-medidas-excepcion-decreto-de-urgencia-n-026-2020-1864948-1/",,,,1239560418739306496,https://twitter.com/chrisfer827/status/1239560418739306496
2020-03-16 14:24:13,SirAlguien,JuanSheput,0,1,1,"Amigos del ejército y la policía, vayan a la casa de este señor. No tiene el COVID-19, pero estoy seguro que tiene un bicho peor que le afecta algo en la corteza cerebral. ",,,,1239558091672256513,https://twitter.com/SirAlguien/status/1239558091672256513
2020-03-16 14:11:15,josefelixpinto,Paul_Doherty__,0,1,3,"Buena idea: horarios especiales en los supermercados para la gente más vulnerable al Covid-19. ",,,,1239554828487086081,https://twitter.com/josefelixpinto/status/1239554828487086081
2020-03-16 14:03:59,MarifeCastroR,,1,1,2,"La idea no es regañar al vendedor de jugos de naranja por hacer su trabajo, sino preguntarle a @MartinVizcarraC qué tiene planeado para que este trabajador independiente y su familia no pasen hambre. #YoMeQuedoEnMiCasa #CuarentenaCoronavirus #covid19",,@MartinVizcarraC,#YoMeQuedoEnMiCasa #CuarentenaCoronavirus #covid19,1239552999766163456,https://twitter.com/MarifeCastroR/status/1239552999766163456
2020-03-16 13:58:55,DrPalaciosCeli,,12,45,62,"Tenemos ya una #MédicoResidente infectada con #COVID19, NO estás sola! Todos tus colegas estamos contigo, el @CMP_PERU no los va a abandonar! No nos cansaremos de exigir seguridad para ustedes! @MartinVizcarraC dónde estás? – at Colegio Médico del Perú",,@CMP_PERU @MartinVizcarraC,#M #COVID19,1239551725691744256,https://twitter.com/DrPalaciosCeli/status/1239551725691744256
2020-03-16 13:37:09,jotaromer,,0,0,0,"LO ÚLTIMO: El ministra de salud confirmó que la cifra de casos positivos de coronavirus covid-19 se incrementó a 86 @exitosape",,@exitosape,,1239546247867969538,https://twitter.com/jotaromer/status/1239546247867969538
2020-03-16 13:19:01,latochaaa,,0,0,1,"Qué fue, Lima??? Y el clima de más de 20 grados en el que nos has tenido todos estos días?? Ayuda a matar el bicho pues, causa!!! . . #nublado #covid_19 #coronavirus #lima #hacefrio en Lince, Lima, Peru https://www.instagram.com/p/B9y8KAyhRg0/?igshid=1650q8qqbgo0z",,,#nublado #covid_19 #coronavirus #lima #hacefrio,1239541681172762629,https://twitter.com/latochaaa/status/1239541681172762629
2020-03-16 13:18:59,isabelkamtblog,,0,0,0,"Por favor. Vayan con tiempo al aeropuerto y tengan paciencia. Recuerden que sólo podrán moverse hasta el día de hoy 16 de marzo hasta la 23.59. Luego quedará restringido el tránsito aéreo y terrestre a nivel nacional. #YoMeQuedoEnCasa #Coronavirus #CoronavirusPeru #Covid19",,,#YoMeQuedoEnCasa #Coronavirus #CoronavirusPeru #Covid19,1239541672934957061,https://twitter.com/isabelkamtblog/status/1239541672934957061
2020-03-16 13:16:43,isabelkamtblog,,1,0,0,"COVID-19 Ayer por la noche volví de Arequipa, estuvimos casi una hora esperando que estacionen el avión, ya que seguramente estaba full y no había dónde desembarcar. Esto fue a la media noche. Si bien él área de llegadas nacionales estaba bastante tranquilo... ",,,,1239541105953132544,https://twitter.com/isabelkamtblog/status/1239541105953132544
2020-03-16 13:15:52,a_a_o_1971,elpanfletope,0,0,0,"@MTPE_Peru @MininterPeru Esto es rebeldía en estado de emergencia. Ahora quiero ver si se hacen respetar. Es un peligro público ese tal ""don"". #CuarentenaCoronavirus #YoMeQuedoEnMiCasa #covid19 ",,@MTPE_Peru @MininterPeru,#CuarentenaCoronavirus #YoMeQuedoEnMiCasa #covid19,1239540891301355523,https://twitter.com/a_a_o_1971/status/1239540891301355523
2020-03-16 12:33:46,PedroSanchezH,,1,0,0,"¿Los jardineros trabajan @Jimmychinchay @munisurco1 , así vamos a extinguir el Covid-19? ",,@Jimmychinchay @munisurco1,,1239530297017933824,https://twitter.com/PedroSanchezH/status/1239530297017933824
2020-03-16 12:31:45,Mercede39096338,LuisPesantes,1,0,5,"El hilo 7/10 se refiere a los adultos mayores y de discapacidad severa que tienen domicilio. No especifica a adultos mayores y niños de extrema pobreza en estado de abandono que no tienen vivienda y son vulnerables al Covid-19.",,,,1239529787749785600,https://twitter.com/Mercede39096338/status/1239529787749785600
2020-03-16 12:20:16,AduaneroPeru,,0,0,0,"Estas son algunas de las medidas implementadas por el Ejecutivo para combatir el #Coronavirus #COVID19. http://instagram.com/p/B9y1CQGAFoG/…",,,#Coronavirus #COVID19,1239526899086438402,https://twitter.com/AduaneroPeru/status/1239526899086438402
2020-03-16 11:26:41,robgrafi,,0,0,3,"A la mejor barra del mundo le toca hoy bajar a la cancha y jugar su mejor partido para ganarñ0z al COVID-19",,,,1239513413358886912,https://twitter.com/robgrafi/status/1239513413358886912
2020-03-16 10:59:10,FMabogado,,0,0,1,"El Peruano -DU establece diversas medidas excepcionales y temporales para prevenir la propagación del Coronavirus (COVID-19) DECRETO DE URGENCIA -N° 026-2020 - PODER EJECUTIVO -DECRETOS DE URGENCIA De está saldremos juntos, te amo Perú . Con fe! https://busquedas.elperuano.pe/normaslegales/decreto-de-urgencia-que-establece-diversas-medidas-excepcion-decreto-de-urgencia-n-026-2020-1864948-1/",,,,1239506490211344384,https://twitter.com/FMabogado/status/1239506490211344384
2020-03-16 07:05:20,oraculoweb,,0,3,12,"#Coronavirus adiós a las llamadas falsas al 113 de @Minsa_Peru ,en el DU n•26 #EstadoDeEmergencia te suspenden 30 días tráfico de llamadas y datos internet salientes por ser gracioso y congestionar la línea con info falsa de #Covid19 ",,@Minsa_Peru,#Coronavirus #EstadoDeEmergencia #Covid19,1239447641408356352,https://twitter.com/oraculoweb/status/1239447641408356352
2020-03-16 06:18:07,RenzoCornejo,,0,0,0,"@NianticLabs @PokemonGoAppLA cancelen la app por la pandemia Covid-19 coronavirus, súmense a la causa @PokemonGOespana @NianticHelp @NianticEng por lo menos por 15 días!",,@NianticLabs @PokemonGoAppLA @PokemonGOespana @NianticHelp @NianticEng,,1239435758634557440,https://twitter.com/RenzoCornejo/status/1239435758634557440
2020-03-16 06:17:02,VetKusiAlkho,,0,0,0," IMPORTANTE!!! Estimados Amigos, por las medidas tomadas por nuestro gobierno debido a la PANDEMIA COVID-19, la atención médica sera con PREVIA CITA para evitar las aglomeraciones en la sala de espera. El Horario… https://www.instagram.com/p/B9yL3UzBdCJ/?igshid=1rf5b9zk9lr7n",,,,1239435487414079490,https://twitter.com/VetKusiAlkho/status/1239435487414079490
2020-03-16 06:10:39,ljcisneros,,0,2,1,"#Perú cierra todas sus fronteras por #coronavirus #COVID19 reporta @AFPespanol #AFP via @infobae",,@AFPespanol @infobae,#Per #coronavirus #COVID19 #AFP,1239433882900008960,https://twitter.com/ljcisneros/status/1239433882900008960
2020-03-16 06:09:17,Carf29T100,,0,0,0,"Medidas de emergencia que hemos vinido solicitando del cierre de fronteras y de vuelos internacionales al Perú, días atrás, eran necesarias y urgentes para evitar la proliferación del #COVID19 y así controlarlo evitando víctimas. ",,,#COVID19,1239433538317025280,https://twitter.com/Carf29T100/status/1239433538317025280
2020-03-16 06:00:00,Nieveria,KarenMontoyaAn1,0,0,0,"Joven y sano en buena hora y a cuidarse porque te puede tomar en Nuevo covid 19 0 la gripe aviar que avanza en Filipinas según un tuit",,,,1239431201561227268,https://twitter.com/Nieveria/status/1239431201561227268
2020-03-16 05:36:57,elgatopop,,1,1,4,"#GATOPOP expresa su apoyo a todo el Perú en #EstadoDeEmergenciaNacional anunciado por el Gobierno, seamos responsables, debemos quedarnos en casa para detener el contagio del #Coronavirus Covid -19. Vamos a pasarla muy bien, prometemos publicar más. Hay mil formas para ser únicos ",,,#GATOPOP #EstadoDeEmergenciaNacional #Coronavirus,1239425398972256261,https://twitter.com/elgatopop/status/1239425398972256261
2020-03-16 05:18:46,Yo_CuidoFcPeru,,0,0,0,"Interesante salimos de dudas !!! #EpilepsyDay #covid_19 #YocuidoyquienCuidaDeMi #YoCuido en Lima, Peru https://www.instagram.com/p/B9yFMg-hO2V/?igshid=yb95a32yk1fq",,,#EpilepsyDay #covid_19 #YocuidoyquienCuidaDeMi #YoCuido,1239420823045201920,https://twitter.com/Yo_CuidoFcPeru/status/1239420823045201920
2020-03-16 05:16:03,Clarabe94729652,Worrissey,0,0,1,"Qué lindo gesto. Este COVID-19 esta sacando lo mejor en algunas personas. Hermoso!!! ",,,,1239420139298263040,https://twitter.com/Clarabe94729652/status/1239420139298263040
2020-03-16 05:06:02,Mercede39096338,ToniAlvaL,1,10,56,"Ministra amiga @ToniAlvaL me preocupa las personas adultas mayores y niños que viven en completo desamparo en las calles y que constituyen un alto riesgo para contraer el Covid-19. ¿Existe un plan de contingencia para ellos?. Gracias.",,@ToniAlvaL,,1239417618106376192,https://twitter.com/Mercede39096338/status/1239417618106376192
2020-03-16 04:45:22,DianaSantibanez,,0,0,2,"Yo sólo quiero que llegue Diciembre y ver el índice de natalidad que nos dejó el COVID-19 en el 2020 ",,,,1239412420688449537,https://twitter.com/DianaSantibanez/status/1239412420688449537
2020-03-16 04:27:14,chamato,,0,0,0,"@drhuerta Dr. Huerta buenas noches, acabo de recibir un audio por whatsapp que dice que el ibuprofeno potencia el covid-19 y que recomiendan no tomarlo Que hay de cierto en eso? Gracias",,@drhuerta,,1239407854022471680,https://twitter.com/chamato/status/1239407854022471680
2020-03-16 04:09:53,yuyiii,,1,0,8,"Mi flaco va a tener que seguir trabajando en 3 lugares, donde si se contagia del COVID-19, pues ni siquiera seguro le ofrecen. Pero él ahí dándolo todo por sus pacientes y sin alardear. Yo soy tu fan corazón, que siempre hayan doctores como tú!",,,,1239403487676465152,https://twitter.com/yuyiii/status/1239403487676465152
2020-03-16 03:51:38,MauricioPahuara,,1,1,2,"#URGENTE De manera ordenada les comparto la edición extraordinaria del Diario El Peruano referente al #DecretoSupremo que declara #EstadoDeEmergencia en el Perú por 15 días. #YoMeQuedoEnCasa #COVID19 Abro hilo: – at Presidencia del Consejo de Ministros",,,#URGENTE #DecretoSupremo #EstadoDeEmergencia #YoMeQuedoEnCasa #COVID19,1239398896880832513,https://twitter.com/MauricioPahuara/status/1239398896880832513
2020-03-16 03:26:57,eduardosolis,,0,4,7,"Situación actual es España, gobierno dispone de la salud privada para atender al país. #COVIDー19 #Covid19 #Covid19Pe",,,#COVID #Covid19 #Covid19Pe,1239392686190268417,https://twitter.com/eduardosolis/status/1239392686190268417
2020-03-16 03:05:13,padmejones,,0,0,0,".@UNMSM_ http://suspe.de desde este lunes 16 toda actividad académica en la Ciudad Universitaria, con excepción de experimentos de laboratorio en curso y el cuidado de animales #COVID19 ",,@UNMSM_,#COVID19,1239387213282127872,https://twitter.com/padmejones/status/1239387213282127872
2020-03-16 03:04:36,diavolo1902,,0,0,0,"Y si las entidades bancarias, financieras, tiendas retail, reducen las líneas de crédito de todos a fin que los #acaparadores no #desabastezcan los #supermercados ? Un poquito de responsabilidad social hoy en los tiempos del #COVID19 #CovidEnPeru #NoAlEgoísmo",,,#acaparadores #desabastezcan #supermercados #COVID19 #CovidEnPeru #NoAlEgo,1239387061414776833,https://twitter.com/diavolo1902/status/1239387061414776833
2020-03-16 02:42:04,ChristianLM2000,,0,0,0,"#Powerups #songpop #Thanks #Coronavirus #Covid19 en Enel Perú https://www.instagram.com/p/B9xzQ4UAK6-/?igshid=fshnmxbfvwly",,,#Powerups #songpop #Thanks #Coronavirus #Covid19,1239381390967427072,https://twitter.com/ChristianLM2000/status/1239381390967427072
2020-03-16 02:41:23,ChristianLM2000,,0,0,0,"#WeeklyResults #songpop #Thanks #Coronavirus #Covid19 en Enel Perú https://www.instagram.com/p/B9xzL3KAEXw/?igshid=hrgxkxzhvm7y",,,#WeeklyResults #songpop #Thanks #Coronavirus #Covid19,1239381217591558150,https://twitter.com/ChristianLM2000/status/1239381217591558150
2020-03-16 02:40:56,RenovadoxC,,0,0,0,"Este es el documento donde se informa del Decreto Supremo, el cual ordena el estado de Emergencia en el Perú por el coronavirus (COVID-19). El presidente de la República, Martín Vizcarra, comunicó varios parámetros… https://www.instagram.com/p/B9xzIkPJ1mx/?igshid=jburmzej297z",,,,1239381104664199169,https://twitter.com/RenovadoxC/status/1239381104664199169
2020-03-16 02:40:42,edgarod,,0,0,0,"Actualización en #CENTROAMÉRICA (#COVID19) #Panamá 55 1 #CostaRica 35 #Honduras 6 #Guatemala 2 1 TOTAL: 98 2 Fuente: Ministerios de Salud (15/03/2020, 21:30h ) – at Colegio Médico del Perú",,,#CENTROAM #COVID19 #Panam #CostaRica #Honduras #Guatemala,1239381045461557250,https://twitter.com/edgarod/status/1239381045461557250
2020-03-16 02:35:01,edgarod,,1,1,5,"Actualización en #SUDAMERICA (#COVID19) Brasil 200 Chile 75 Perú 74 Argentina 56 2 Colombia 45 Ecuador 37 2 Venezuela 17 Bolivia 11 Paraguay 7 Uruguay 6 TOTAL: 528 4 Fuente: Ministerios de Salud (15/03/2020, 21:30h ) – at Colegio Médico del Perú",,,#SUDAMERICA #COVID19,1239379614641926146,https://twitter.com/edgarod/status/1239379614641926146
2020-03-16 02:18:15,Mercede39096338,Malapalabrero,0,0,0,"¡Fuerza Compatriotas!. La vida y la salud está por delante. ¡Venceremos al Covid-19!. No quedaba otra solución. ",,,,1239375396249964545,https://twitter.com/Mercede39096338/status/1239375396249964545
2020-03-16 02:17:15,the_jonathan25,Covid19_Time,0,0,0,"Cómo ves las medidas que tomo Perú? Tarde? O aún estamos a tiempo?",,,,1239375143425671174,https://twitter.com/the_jonathan25/status/1239375143425671174
2020-03-16 02:06:45,StaleinJackson,,0,0,0,"Primera frase elemental del mensaje a la Nación sobre el COVID 19...""Lucha contra la corrupcion"" ,... ",,,,1239372501702119424,https://twitter.com/StaleinJackson/status/1239372501702119424
2020-03-16 01:55:39,jotaromer,,0,2,0,"Ojo, debemos acatar las disposiciones. Esto no solo es por uno mismo sino por todos. Juntos contra el covid-19 ",,,,1239369709964984321,https://twitter.com/jotaromer/status/1239369709964984321
2020-03-16 01:44:20,JeanVites78,,0,0,0,"El periodista de @Latina_pe en punto final, dice que el último. Uemo confirmado que viene a Lima es desde San JOSÉ, PUERTO RICO. ¡Dios mio! Covid19 llevamos de una vez.",,@Latina_pe,,1239366862183546880,https://twitter.com/JeanVites78/status/1239366862183546880
2020-03-16 01:34:35,rescate_sos,,2,10,14,"Síntomas del COVID-19 ",,,,1239364406611521536,https://twitter.com/rescate_sos/status/1239364406611521536
2020-03-16 01:32:29,fernandomunioz7,javierhhb,0,0,0,"Tiene sus padres súper vulnerables para el COVID19 Es verdad lo que pones pero esto es una excepción tipo guerra y acá todos debemos estar unidos",,,,1239363876682182657,https://twitter.com/fernandomunioz7/status/1239363876682182657
2020-03-16 01:20:02,Techtulia,,0,3,4,"A partir de ahora #QuedateOnLine #QuedateEnTuCasa ... Por el bien de todos. #SiSePuede disminuir la curva de crecimiento #COVID19",,,#QuedateOnLine #QuedateEnTuCasa #SiSePuede #COVID19,1239360747085299715,https://twitter.com/Techtulia/status/1239360747085299715
2020-03-16 01:14:55,DennysVirhuez,exitosape,0,0,0,"Presidente #Perú #Vizcarra anuncia mediante un Decreto de urgencia el #AislamientoObligatorio por 14 días para contener la expansión exponencial del #SARS_CoV_2 #Covid19 #2019_nCov #Coronavirus",,,#Per #Vizcarra #AislamientoObligatorio #SARS_CoV_2 #Covid19 #2019_nCov #Coronavirus,1239359458477780992,https://twitter.com/DennysVirhuez/status/1239359458477780992
2020-03-16 01:13:42,jotaromer,,0,2,0,"LO ÚLTIMO: Presidente @MartinVizcarraC indicó que se entregará una bonificación a los profesionales de la salud que trabajan intensamente para evitar la propagación del covid-19.",,@MartinVizcarraC,,1239359151425441793,https://twitter.com/jotaromer/status/1239359151425441793
2020-03-16 01:09:50,PedroValleO,,0,0,0,"Toma de muestras a domicilio a los que soliciten o sospechen que puedan tener #covid19",,,#covid19,1239358179701600257,https://twitter.com/PedroValleO/status/1239358179701600257
2020-03-16 01:09:10,Rodri_220993,,0,0,1,"Toque de queda mas Cuarentena Salimos con todo COVID-19; a ponerle el pecho",,,,1239358011082186752,https://twitter.com/Rodri_220993/status/1239358011082186752
2020-03-16 01:06:18,GuiilleOcampo,DiaDatv,0,1,0,"Vamos Perú , Dios todopoderoso té guarde de covid-19 ",,,,1239357288474906627,https://twitter.com/GuiilleOcampo/status/1239357288474906627
2020-03-16 01:05:57,erick5chavez,,0,0,0,"Martin Vizcarra: ""Estado de emergencia nacional por el COVID-19. Tendrá una vigencia de 15 días. Aislamiento social de todo el país""",,,,1239357201275326468,https://twitter.com/erick5chavez/status/1239357201275326468
2020-03-16 01:05:41,Sergio1591,,0,0,0,"Estado de emergencia en el país por Covid-19 #coronavirus por 15 días",,,#coronavirus,1239357135831683072,https://twitter.com/Sergio1591/status/1239357135831683072
2020-03-16 01:05:15,LAJPC,,0,0,0,"Estado de Emergencia en el Perú por 15 días. Qué implica eso? Experiencia nueva total para este huachano de 1992 #Covid19",,,#Covid19,1239357026456797186,https://twitter.com/LAJPC/status/1239357026456797186
2020-03-16 01:04:52,delaCalleJulian,,0,0,4,"#Covid19 El presidente Martin Vizcarra declara estado de Emergencia Nacional @San Isidro District, Lima https://www.instagram.com/p/B9xoI5qBUiNlh_reYGM0U1hEdb8reDssj5fGRc0/?igshid=1bwygjtrxd651",,,#Covid19,1239356926443622401,https://twitter.com/delaCalleJulian/status/1239356926443622401
2020-03-16 00:53:09,jotaromer,,0,1,0,"OJO: En algunos minutos, el presidente @MartinVizcarraC ofrecerá un mensaje a la nación con nuevas medidas referidas al coronavirus covid-19. Siga la transmisión de @exitosape",,@MartinVizcarraC @exitosape,,1239353980096036865,https://twitter.com/jotaromer/status/1239353980096036865
2020-03-16 00:37:08,igp_peru,,0,32,78,"Protejamos a los adultos mayores del #coronavirus. Ten en cuenta las siguientes recomendaciones. #covid19 #PerúEstáEnNuestrasManos",,,#coronavirus #covid19 #Per,1239349948421935104,https://twitter.com/igp_peru/status/1239349948421935104
2020-03-16 00:32:07,sentidoseis,,1,0,3,"Al parecer el último fin de semana en la playa por la coyuntura #COVID19 . Ya en Lima para permanecer en la medida de lo posible en casa. Es un momento crucial para la humanidad, NO DIVULGUEMOS INFORMACIÓN FALSA O DE FUENTES NO COMPROBADAS. ",,,#COVID19,1239348686083235841,https://twitter.com/sentidoseis/status/1239348686083235841
2020-03-15 23:49:02,eduardosolis,,0,0,0,"Esta cuarentena pondrá también a prueba muchos servicios, por ejemplo el Internet de @ClaroPeru camina muy mal repentinamente, imagino que mucha gente conectada desde sus casas simultáneamente, ¿estaremos preparados? #cuarentena #covid19 #covid19Pe",,@ClaroPeru,#cuarentena #covid19 #covid19Pe,1239337845640347653,https://twitter.com/eduardosolis/status/1239337845640347653
2020-03-15 23:43:38,luisalfredogarc,RenattoBautista,0,0,0,"Rafael Rey -ministro de Garcia- ta hubiera sacado su pisco “Covid 19” ",,,,1239336484156497920,https://twitter.com/luisalfredogarc/status/1239336484156497920
2020-03-15 23:27:16,DrPalaciosCeli,,1,11,27,"Me dirijo a mis #MédicosResidentes para enviarles desde @CMP_PERU un solidario e incondicional apoyo a la heroica y anónima labor de atender en medio de enormes esfuerzos a afectados por #COVID19,a sus familiares y contactos sin dejar de atender la habitual carga de enfermedad. – at Colegio Médico del Perú",,@CMP_PERU,#M #COVID19,1239332365740146693,https://twitter.com/DrPalaciosCeli/status/1239332365740146693
2020-03-15 23:22:03,Abdelo17,nicko_redhead,0,0,0,"La gente estan palta por el covid-19 no salen! ",,,,1239331055372566532,https://twitter.com/Abdelo17/status/1239331055372566532
2020-03-15 23:17:48,Abdelo17,Alelegabi,1,0,2,"Habla pe! Si estoy cerca te caigo y te preparo tu caldo de gashiiiina, si me pegas el covid-19 ya luego tu me visitas ",,,,1239329982775734272,https://twitter.com/Abdelo17/status/1239329982775734272
2020-03-15 23:14:32,synchronicity23,,0,0,0,"CUARENTENA #cuarentena #quarantine #coronavirus #coronhavirus #covid_19 #botero #painting #anibachrach @San Isidro District, Lima https://www.instagram.com/p/B9xbgtMBv07/?igshid=1wzsf38dfy3xc",,,#cuarentena #quarantine #coronavirus #coronhavirus #covid_19 #botero #painting #anibachrach,1239329160134144000,https://twitter.com/synchronicity23/status/1239329160134144000
2020-03-15 23:00:31,JetVargas,,0,0,1,"Cuando te dicen q te quedes en tu casa para proteger a los más Vulnerables y ves a algunos de juerga #Lima #COVID-19 @Minsa_Peru – at Oceanus Casa Club",,@Minsa_Peru,#Lima #COVID,1239325635421536257,https://twitter.com/JetVargas/status/1239325635421536257
2020-03-15 22:57:57,JorgeRojasOrr,,0,0,0,"Medios deben seguir llamando a la calma. Mercados mayoristas de conos están totalmente abarrotados de gente. Unicachi por ejemplo @RPPNoticias @exitosape @elcomercio_peru #YoMeQuedoEnCasa #COVID19 – at MEGA UNICACHI",,@RPPNoticias @exitosape @elcomercio_peru,#YoMeQuedoEnCasa #COVID19,1239324988814946304,https://twitter.com/JorgeRojasOrr/status/1239324988814946304
2020-03-15 22:42:23,Olimpia_o_o,MarcoAvilesH,0,0,0,"¿Capitalismo con rostro humano? Siempre fue la misma esencia. El #COVID19 está camino a dejar sin sustento a todos aquellos que defienden a ultranza el libre mercado. ",,,#COVID19,1239321069221183488,https://twitter.com/Olimpia_o_o/status/1239321069221183488
2020-03-15 22:23:44,fernandomunioz7,,37,9,54,"#ULTIMOMINUTO Lideresa Keiko Fujimori @KeikoFujimori no vote por Fuerza Popular nunca pero en estos tiempos de crisis por #COVID19 #CoronaVirusPeru podría ayudar con mensaje de unión con todos los peruanos apoyando y exigiendo medidas extraordinarias para bien común Gracias",,@KeikoFujimori,#ULTIMOMINUTO #COVID19 #CoronaVirusPeru,1239316376373919746,https://twitter.com/fernandomunioz7/status/1239316376373919746
2020-03-15 22:22:47,JuanCarlosLL,,0,4,11,"Por favor, no tuiteen, ni compartan WhatsApps con frases que contengan ""podría"", ""estaría"", ""haría"". Solo información oficial. OJO periodistas y amiguitos que quieren ganar relevancia. #COVID19",,,#COVID19,1239316138519154690,https://twitter.com/JuanCarlosLL/status/1239316138519154690
2020-03-15 22:16:16,JuanCarlosLL,Presidencia_Ec,0,0,0,"Ecuador ya prohibió aglomeraciones de más de 30 personas. ¿Qué esperas @MartinVizcarraC? #COVID19 ",,@MartinVizcarraC,#COVID19,1239314497698963457,https://twitter.com/JuanCarlosLL/status/1239314497698963457
2020-03-15 22:15:29,pilarpuente1,lokaldammert,0,0,2,"Quizás el número d personas positivo a #COVID19 es.mucho +, ya q no todos los q necesitan tienen el tamizaje. ¡Es raro! x ejm q #Huánuco tenga hasta ahora solo 2 casos positivos,cuando se sabe q viajaron en bus con 50 pasajeros y han seguido en contacto con otros #cuarentenaYA",,,#COVID19 #Hu #cuarentenaYA,1239314299803312129,https://twitter.com/pilarpuente1/status/1239314299803312129
2020-03-15 22:11:42,padmejones,,0,0,1,"Mientras más larga se hace la espera por las nuevas medidas ante el #COVID19 en el Perú, más y más ""decretos"" sobre la cuarentena aparecen en redes...",,,#COVID19,1239313349868957703,https://twitter.com/padmejones/status/1239313349868957703
2020-03-15 22:06:07,jesusnoriega,eldacantu,0,0,1,"Para que entiendan cómo se propaga el #Covid-19 #YoMeQuedoEnCasa",,,#Covid #YoMeQuedoEnCasa,1239311944697425923,https://twitter.com/jesusnoriega/status/1239311944697425923
2020-03-15 21:53:57,Techtulia,GabyPerona,1,6,23,"El #COVID19 se detiene con solidaridad. ",,,#COVID19,1239308882809425920,https://twitter.com/Techtulia/status/1239308882809425920
2020-03-15 21:46:24,fernandomunioz7,ivnvc,0,0,0,"Que lastima que estando en emergencia sanitaria ustedes en vez de estar sumando estén discutiendo quien de los que apoyan es más corrupto como si el COVID19 escogiera infectar de acuerdo a ideología política ¿Ni por esta crisis pueden pensar no en ustedes ni sus ideas políticas?",,,,1239306983943090178,https://twitter.com/fernandomunioz7/status/1239306983943090178
2020-03-15 21:28:23,RAFAEL_P1NEDA,,0,1,0,"(Lima-Perú) Se registran 71 casos positivos de Coronavirus COVID-19 tras analizarse 1822 muestras. Con relación al procedimiento de las nuestras por Coronavirus COVID-19 , el ministerio de Salud (Minsa) informa a la población lo siguiente; ",,,,1239302447241351170,https://twitter.com/RAFAEL_P1NEDA/status/1239302447241351170
2020-03-15 21:25:16,recf_6,martinhidalgo,0,0,7,"Cualquier cosa qué pasa es culpa de Vizcarra, hasta el nacimiento del COVID-19, fujimoristas delincuentes y ridiculos... ",,,,1239301662436704258,https://twitter.com/recf_6/status/1239301662436704258
2020-03-15 21:24:05,edgarod,,0,3,3,"Asi vamos hoy en #CENTROAMÉRICA (#COVID19) #Panamá 43 1 #Costa Rica 35 #Honduras 3 #Guatemala 1 TOTAL: 82 1 Fuente: Ministerios de Salud (Actualizado 15/03/2020, 16:20h ) – at Colegio Médico del Perú",,,#CENTROAM #COVID19 #Panam #Costa #Honduras #Guatemala,1239301364532097025,https://twitter.com/edgarod/status/1239301364532097025
2020-03-15 21:18:04,edgarod,,1,8,14,"Asi vamos hoy en #SUDAMÉRICA (#COVID19) Brasil 185 Chile 75 Perú 71 Argentina 46 2 Ecuador 37 2 Colombia 34 Bolivia 11 Venezuela 10 Paraguay 7 Uruguay 6 TOTAL: 482 4 Fuente: Ministerios de Salud (Actualizado 15/03/2020,16:12h ) – at Colegio Médico del Perú",,,#SUDAM #COVID19,1239299854137995264,https://twitter.com/edgarod/status/1239299854137995264
