date,username,to,replies,retweets,favorites,text,geo,mentions,hashtags,id,permalink
2020-03-13 18:29:20,ejarar13,Jose_Chavarri,0,0,1,"El COVID-19 en deportistas y todo lo que afecta en este deporte tan hermoso, que tanto nos apasiona.",,,,1238532612370595842,https://twitter.com/ejarar13/status/1238532612370595842
2020-03-13 18:26:14,Zoi819,,0,0,0,"@realDonaldTrump The Covid-19 lo introdujiste en china..matando no sólo allí , ahora da la cura.. eso fue creado en laboratorio sob.",,@realDonaldTrump,,1238531834125987847,https://twitter.com/Zoi819/status/1238531834125987847
2020-03-13 18:22:33,OmarArzapalo,,0,0,0,"@MartinVizcarraC @MininterPeru @leydelacalle Debe haber sanción penal al que difunda información falsa con respecto a la existencia de la cura del #Covid_19 lo hacen por redes sociales usando las esquelas de medios de comunicación internacionales.",,@MartinVizcarraC @MininterPeru @leydelacalle,#Covid_19,1238530904714350594,https://twitter.com/OmarArzapalo/status/1238530904714350594
2020-03-13 18:19:46,edgarod,javargashe,0,1,3,"Bien @javargashe, una explicación valiosa y muy necesaria para cuantificar adecuadamente los casos de #COVID19 en nuestro fragmentado sistema de salud Peruano! @CMP_PERU @Minsa_Peru @Ojo_Publico",,@javargashe @CMP_PERU @Minsa_Peru @Ojo_Publico,#COVID19,1238530206471774210,https://twitter.com/edgarod/status/1238530206471774210
2020-03-13 18:18:22,isiencalada,PCaterianoB,0,0,0,"Ojala se los lleve el covid19, no deseo el mal a nadie pero ellos hacen mas daño ",,,,1238529853563027456,https://twitter.com/isiencalada/status/1238529853563027456
2020-03-13 18:12:03,PabloGa39559507,MartinVizcarraC,0,0,0,"Se @MartinVizcarraC invasores se apropiaron del terreno destinado a posta de salud y local comunal esquina geranios con Abraham ballenas sjm altura 12 de rosa Lozano pista nueva #coronavirusperu #EmergenciaSanitaria #CODVID19 #estadodealarma #Covid_19 ",,@MartinVizcarraC,#coronavirusperu #EmergenciaSanitaria #CODVID19 #estadodealarma #Covid_19,1238528262852227073,https://twitter.com/PabloGa39559507/status/1238528262852227073
2020-03-13 18:01:31,javierurbaneja1,,0,0,0,"Confirman los dos primeros casos de Coronavirus en #Venezuela. A partir del lunes 16 quedan suspendidas las clases a nivel nacional. Quedan suspendidos todos los eventos públicos y se cerraran salas de cines y museos. #coronavirusenvzla #Covid_19",,,#Venezuela #coronavirusenvzla #Covid_19,1238525615046905857,https://twitter.com/javierurbaneja1/status/1238525615046905857
2020-03-13 17:55:33,bersofe,,0,0,0,"""Suspender la Santa Misa en capillas"": Esto recomienda la Conferencia Episcopal Peruana por COVID-19 https://rpp.pe/p/1251350 vía @RPPNoticias",,@RPPNoticias,,1238524110566809602,https://twitter.com/bersofe/status/1238524110566809602
2020-03-13 17:54:48,bersofe,,0,1,2,"""Suspender la Santa Misa en capillas"": Esto recomienda la Conferencia Episcopal Peruana por COVID-19 https://rpp.pe/p/1251350 vía @RPPNoticias",,@RPPNoticias,,1238523924666777602,https://twitter.com/bersofe/status/1238523924666777602
2020-03-13 17:45:43,dmarsi,,0,6,8,"#Covid_19 #HisteriaColectiva si a cada instante nos hablan del coronavirus, que aumentaron los infectados, que la cuarentena, cómo no van a crear pánico. O es que acaso quieren eso? Vizcarra es ministro de salud, de turismo, es supervisor de la UGEL... Es todo y nada. #Incapaz",,,#Covid_19 #HisteriaColectiva #Incapaz,1238521637986861057,https://twitter.com/dmarsi/status/1238521637986861057
2020-03-13 16:56:01,NegraProinciana,papaspai,0,0,1,"El amor en tiempos de COVID - 19. ",,,,1238509128051458055,https://twitter.com/NegraProinciana/status/1238509128051458055
2020-03-13 16:52:01,malditopretell,,1,0,1,"COVID 19 • Voy 5 días metido en casa por mis esguinces. Extraño mucho mi trabajo y a mis amigos pero seamos responsables con todo el tema del Covid19 . Tomen distancia, eviten lugares muy concurridos, tengan en… https://www.instagram.com/p/B9rmJjjlK4j/?igshid=fpm0lmenyfdu",,,,1238508124207644677,https://twitter.com/malditopretell/status/1238508124207644677
2020-03-13 16:27:44,KipuLlaxta,,0,1,0,"#COMUNICADO Suspensión temporal de actividades públicas como medida preventiva por la pandemia #COVID-19.",,,#COMUNICADO #COVID,1238502013543088130,https://twitter.com/KipuLlaxta/status/1238502013543088130
2020-03-13 16:24:12,MadameTempestad,conf_episcopal,1,0,1,"Católicos de Perú y Balnearios, alerta con esto #coronavirusperu #EmergenciaSanitaria #CoronavirusPrevencionYAccion #Covid_19 #IglesiaCatólica",,,#coronavirusperu #EmergenciaSanitaria #CoronavirusPrevencionYAccion #Covid_19 #IglesiaCat,1238501121737609216,https://twitter.com/MadameTempestad/status/1238501121737609216
2020-03-13 16:22:58,CEI_peru,conf_episcopal,0,0,0,"Comunicado de la CEP sobre recomendaciones para evitar la propagación del COVID 19 ",,,,1238500810620690433,https://twitter.com/CEI_peru/status/1238500810620690433
2020-03-13 16:08:16,n_i_p_p_i,,0,0,1,"""Wash your hands to avoid COVID-19"" but when was the last time you cleaned your phone? ""Lavate las manos para evitar el COVID-19"" pero cuando fue la última vez que limpiaste to teléfono?",,,,1238497111353819136,https://twitter.com/n_i_p_p_i/status/1238497111353819136
2020-03-13 15:30:42,BestiasAlVolant,NicolasLucar,0,1,1,"CIERREN LAS FRONTERAS! Presidente Martín Vizcarra @MartinVizcarraC no podemos ser tan IRRESPONSABLES d esperar hasta el lunes para PROHIBIR todos los vuelos de entrada y salida a los países con más contaciados d #Coronavirus #Covid_19 q sea DE INMEDIATO! @pcmperu @presidenciaperu",,@MartinVizcarraC @pcmperu @presidenciaperu,#Coronavirus #Covid_19,1238487660525686784,https://twitter.com/BestiasAlVolant/status/1238487660525686784
2020-03-13 15:30:30,clublacantera,,0,6,6," COMUNICADO : Como medida preventiva por los casos de contagio del COVID-19, suspendemos actividades en todas nuestras sedes hasta nuevo aviso. ",,,,1238487607308357632,https://twitter.com/clublacantera/status/1238487607308357632
2020-03-13 15:17:23,joluisj,,0,2,2,"(Cuarentena no es vacaciones) #Covid_19",,,#Covid_19,1238484307108339713,https://twitter.com/joluisj/status/1238484307108339713
2020-03-13 15:03:15,MadameTempestad,ReutersLatam,0,1,0,"El gringo debe estar en trompo #Covid_19 #TrumpVirus",,,#Covid_19 #TrumpVirus,1238480750682558468,https://twitter.com/MadameTempestad/status/1238480750682558468
2020-03-13 15:00:11,MadameTempestad,ConvocaPe,0,0,0,"Listo: Bolsonaro el primer Presidente de América que cae #Covid_19 #Bolsonaro",,,#Covid_19 #Bolsonaro,1238479977374457857,https://twitter.com/MadameTempestad/status/1238479977374457857
2020-03-13 14:49:44,wchm_pe,suselparedes,0,0,0,"Em caso la persona tenga gripe fuerte debe entrar en cuarentena si presenta síntomas toman muestras covid19. El caso de vacaciones es para lo primero cuando no tienen diagnóstico y por consiguiente descanso médico.",,,,1238477347420020743,https://twitter.com/wchm_pe/status/1238477347420020743
2020-03-13 14:33:05,Erhbol88,M0cupe,0,0,2,"El cuerpo lo sabe.. Sabe que debe cuidarse del #Covid_19 saludos amigos chiclayanos..",,,#Covid_19,1238473157603885056,https://twitter.com/Erhbol88/status/1238473157603885056
2020-03-13 14:27:32,rossanalema,,0,0,0,"Hazlo viral para que le llegue a esa gente que ha acaparado estos productos. #Babosos #rexontrababosos #coronavirusperu #CoronavirusPrevencionYAccion #covid19 #covid19Peru",,,#Babosos #rexontrababosos #coronavirusperu #CoronavirusPrevencionYAccion #covid19 #covid19Peru,1238471761886396418,https://twitter.com/rossanalema/status/1238471761886396418
2020-03-13 14:27:02,Fermaling,MuniLima,0,0,0,"Todo suma #Covid_19 ",,,#Covid_19,1238471636480921608,https://twitter.com/Fermaling/status/1238471636480921608
2020-03-13 14:19:56,malvaro1123,lucianolopez27,0,0,0,"Parece que todos oiendan que el COVID-19 esta solo en Europa y Asia... Habria que decirles que hay tambien en USA, Mexico u otros paises de America y dicirles que hay vuelos de conexion tambien...",,,,1238469849212428295,https://twitter.com/malvaro1123/status/1238469849212428295
2020-03-13 14:05:53,jcalderon_01,,0,0,1,"Ahhhhh ahora entiendo el xq... Ingenio perucho! #coronavirusperu #Coronavid19 #COVID19 ",,,#coronavirusperu #Coronavid19 #COVID19,1238466313120555008,https://twitter.com/jcalderon_01/status/1238466313120555008
2020-03-13 13:50:02,suzaninha09,,0,0,1,"Subio a 28 casos del #Covid_19 relacionado a los primero pacientes. Va a subir pero tranquilos. Seamos responsables en la higiene.",,,#Covid_19,1238462325360693250,https://twitter.com/suzaninha09/status/1238462325360693250
2020-03-13 13:50:01,jotaromer,,0,0,0,"LO ÚLTIMO: Desde Piura, el presidente @MartinVizcarraC informó que la cifra de casos confirmados con coronavirus covid-19 en el Perú se incrementa a 28. @exitosape",,@MartinVizcarraC @exitosape,,1238462322785615872,https://twitter.com/jotaromer/status/1238462322785615872
2020-03-13 13:48:00,RALVAMARTINEZ,,1,3,5," #Coronavirus... Presidente @MartinVizcarraC informa que se eleva a 28 el número de personas contagiadas con #Covid19 en el Perú... Vía @RadioNacionalFM",,@MartinVizcarraC @RadioNacionalFM,#Coronavirus #Covid19,1238461812615647232,https://twitter.com/RALVAMARTINEZ/status/1238461812615647232
2020-03-13 13:43:44,RenzoCornejo,,0,0,0,"Desde Barcelona, @PattyBenavidesP nos cuenta la situación que vive por el coronavirus o covid19. ",,@PattyBenavidesP,,1238460739674873857,https://twitter.com/RenzoCornejo/status/1238460739674873857
2020-03-13 13:19:53,Cristia_MejiaS,,0,0,0,"La estupidez en su máxima expresión considera que el #papelhigienico es una herramienta para disuadir al #Covid19. No seamos egoístas e informémonos de manera adecuada con las recomendaciones del @Minsa_Peru",,@Minsa_Peru,#papelhigienico #Covid19,1238454737663655936,https://twitter.com/Cristia_MejiaS/status/1238454737663655936
2020-03-13 12:47:58,Claudiaal77,,0,0,0,"El lavado continuo de manos y el cubrirse la boca al toser son acciones clave para evitar la transmisión del #COVID19.",,,#COVID19,1238446705412112391,https://twitter.com/Claudiaal77/status/1238446705412112391
2020-03-13 12:36:17,Wilfredo_Aguero,,0,0,0,"Covid19: Como resarcirá China al mundo de los daños ocasionados? Se hará el won con la misma postura que trata a su gente o cambiará de actitud?",,,,1238443764965756928,https://twitter.com/Wilfredo_Aguero/status/1238443764965756928
2020-03-13 12:34:37,fernandomunioz7,Cecilia605040,0,0,1,"Justo iba a criticar al Minsa porque tengo amiga hermana que ha estado llamando al 113 pero ya contestaron ybdescartaron que tiene covid19 Hay mucha gente que llama por broma y satura Hay que criticar y exigir pero también apoyar unidos Abrazos",,,,1238443344612777994,https://twitter.com/fernandomunioz7/status/1238443344612777994
2020-03-13 12:23:45,EDGAREDUARDOBO,,0,0,0,"Reposted from @rppnoticias ¡ATENCIÓN! ¿Sospechas ser un portador del COVID-19? Comunícate a los siguientes números . . . #Coronavirus #Enfermedad #Virus #Salud #COVID19 - #regrann en Lima, Peru https://www.instagram.com/p/B9rHcpoFSeK/?igshid=eji8efbjdbko",,@RPPNoticias,#Coronavirus #Enfermedad #Virus #Salud #COVID19 #regrann,1238440612107517954,https://twitter.com/EDGAREDUARDOBO/status/1238440612107517954
2020-03-13 12:23:36,Marian161963,JBCPERU,0,0,1,"Solo traen el covid-19.",,,,1238440571716468736,https://twitter.com/Marian161963/status/1238440571716468736
2020-03-13 12:05:59,cereza612,DiarioDeCurwen,0,0,2,"Creo que este fds es CLAVE para NO elevar los casos de contagio de #COVID19 . Los negocios de bares y discotecas deberían cerrar ! ""limitar"" el aforo es ridículo e irresponsable queda claro que sus intereses como negocio están por delante del beneficio colectivo #facepalm",,,#COVID19 #facepalm,1238436139217965066,https://twitter.com/cereza612/status/1238436139217965066
2020-03-13 11:59:29,RALVAMARTINEZ,,0,8,8," #Coronavirus... 4 peruanos en Italia dieron contagiados de #COVID19... Desde el lunes 16 prohíben vuelos de Europa y Asia... Niegan que sacerdote haya muerto por coronavirus... Más detalles en @RadioNacionalFM 103.9FM 7.2 TDT señal abierta",,@RadioNacionalFM,#Coronavirus #COVID19,1238434502315249667,https://twitter.com/RALVAMARTINEZ/status/1238434502315249667
2020-03-13 11:16:58,Paola310,,0,8,1,"El embajador de Peru em Italia,Eduardo Martinetti, informo que 4 peruanos estan infectados con el covid19 en ese país.....#ahora en @noticias_tvperu",,@noticias_tvperu,#ahora,1238423804113797123,https://twitter.com/Paola310/status/1238423804113797123
2020-03-13 11:12:01,joluisj,,0,2,2,"El gran error de España o EEUU ( incluso Brasil) es que la reacción ha sido tarde. El problema con el Covid19 no es q sea muy letal, sino la rapidez con que se extiende al ser altamente contagioso y hacer que el sist. de salud público o privado colapse y no pueda ofrecer atención",,,,1238422559135272962,https://twitter.com/joluisj/status/1238422559135272962
2020-03-13 10:51:18,joluisj,QHaRi,0,0,1,"El #Covid_19 nos explica qué es el #Coronavirus Interesante hilo",,,#Covid_19 #Coronavirus,1238417344256446464,https://twitter.com/joluisj/status/1238417344256446464
2020-03-13 10:42:03,joluisj,,0,0,7,"Y nuestras casas vuelven a ser ( o empiezan a ser) Iglesias domesticas realmente en donde habita el amor y celebramos el sacramento de la unidad en la diversidad y pedimos. a Dios que aumente nuestra solidaridad. #coronaVirus #Covid_19",,,#coronaVirus #Covid_19,1238415018191921155,https://twitter.com/joluisj/status/1238415018191921155
2020-03-13 09:12:34,Carf29T100,,0,0,0,"1ro. informémonos, luego hablamos de RESPETOS y de INTELIGENCIA. En Perú se realizo algo más de 1,000 test COVID-19 de 30 millones de personas, arrojando 22 positivos En cada país europeo/asia no se tomaron 1,000 test para que les arroje 2,000 positivos, fueron +de 100 mil test https://twitter.com/patriciagamarra/status/1238181405496086528",,,,1238392498906640384,https://twitter.com/Carf29T100/status/1238392498906640384
2020-03-13 09:11:27,karicayo,JuanFraEscobar,0,0,0,"TOTALMENTE CIERTO #coronavirus #Covid_19 #Peru",,,#coronavirus #Covid_19 #Peru,1238392216407564288,https://twitter.com/karicayo/status/1238392216407564288
2020-03-13 09:09:43,Carf29T100,patriciagamarra,0,0,0,"1ro. informémonos, luego hablamos de RESPETOS y de INTELIGENCIA. En Perú se realizo algo más de 1,000 test COVID-19 de 30 millones de personas, arrojando 22 positivos En cada país europeo/asia no se tomaron 1,000 test para que les arroje 2,000 positivos, fueron +de 100 mil test ",,,,1238391781353566208,https://twitter.com/Carf29T100/status/1238391781353566208
2020-03-13 07:00:22,JesuspereyraG,,0,0,0,"#Covid_19 El hacinamiento y la aglomeración son el peor escenario para la propagación del susodicho #virus. Lo único cierto y evidente es que se cumple a cabalidad esto...'A río revuelto ganancia de pescadores' ....o comerciantes!",,,#Covid_19 #virus,1238359227493756930,https://twitter.com/JesuspereyraG/status/1238359227493756930
2020-03-13 06:59:01,Yakuza_Hanafuda,,0,0,0,"La compra desproporcionada y masiva de papel higiénico no me sorprende por dos motivos: 1. No se lavan las manos, menos se van a lavar el poto. 2. Hay otra pandemia anterior y que opera sobre esta. Ya lo dijo Marco Aurelio Denegri: es la estupidez. #Covid_19 #coronavirus",,,#Covid_19 #coronavirus,1238358888753356800,https://twitter.com/Yakuza_Hanafuda/status/1238358888753356800
2020-03-13 06:12:51,GodosElejalder,,101,30,501,"ROGUEMOS al SEÑOR. TE LO PEDIMOS SEÑOR. AL TODO PODEROSO, PARQUE TERMINE CON ESTA PANDEMIA COVID 19, EN EL MUNDO. DIOS MÍO D LA NOCHE A LA MAÑANA HAN MUERTO MILES D PERSONAS .SEÑOR ALGO ESTARÁ PAGANDO LA HUMANIDAD. ALGO MALO. DIOS MÍO PARA ESTO YA. AMÉN",,,,1238347271072251904,https://twitter.com/GodosElejalder/status/1238347271072251904
2020-03-13 05:24:08,Yomirasc20,RenatoLoureiro3,0,0,0,"Ya ven y sin COVID-19 ",,,,1238335011402776576,https://twitter.com/Yomirasc20/status/1238335011402776576
2020-03-13 05:04:22,andreammi8,ActualidadRT,0,0,0,"Ojalá escucharan esto todos los peruanos #coronavirusperu #Covid_19 #COVID19 #coronavirus #rt",,,#coronavirusperu #Covid_19 #COVID19 #coronavirus #rt,1238330038057152513,https://twitter.com/andreammi8/status/1238330038057152513
2020-03-13 04:14:51,cepoficial2,,0,4,6,"El CEP se pronuncia Ante los casos de #Coronavirus presentados en nuestro país, el Consejo Nacional del Colegio de Enfermeros del Perú se pronuncia . #Covid19 #SomosReformaDeEnfermeria #AñoMundialDeLaEnfermeria",,,#Coronavirus #Covid19 #SomosReformaDeEnfermeria #A,1238317573680357377,https://twitter.com/cepoficial2/status/1238317573680357377
2020-03-13 04:14:12,cepoficial2,,0,2,2,"#COMUNICADO El Colegio de Enfermeros del Perú dirigido por el Consejo Directivo Nacional, ante las disposiciones de Salud emitidas en nuestro país por la propagación del COVID-19 (Coronavirus), se une y compromete con las medidas tomadas ",,,#COMUNICADO,1238317411444690944,https://twitter.com/cepoficial2/status/1238317411444690944
2020-03-13 04:13:50,Unidad4x4Ayuda,,0,0,4,"Coronavirus impulsa el repoblamiento del Ande Un huancavelicano nos dijo hoy que con toda su familia se regresa a su pueblito que muy lejos y aislado está Allá están seguros que el Covid19 no llegará",,,,1238317319434244097,https://twitter.com/Unidad4x4Ayuda/status/1238317319434244097
2020-03-13 04:08:52,Jcgambini,,16,16,52,"Tres reacciones sobre la suspensión de espectáculos públicos, una es verdaderamente inaceptable, por la irresponsabilidad del comentario: ósea tu plata vale más que la salud y la vida de tu público? Pobre diablo!!! #irresponsable #ubicate #faltoso #covid19 #coronavirusperu",,,#irresponsable #ubicate #faltoso #covid19 #coronavirusperu,1238316069657468929,https://twitter.com/Jcgambini/status/1238316069657468929
2020-03-13 03:34:31,fernandomunioz7,,1,1,1,"Sandro Reategui @sreateguir Tienes que aprender a tener empatía con el resto que no piensa como tú pues todos son peruanos El #Covid_19 ataca a pobres,ricos,viejos,niños, jóvenes,maduros, de izquierda,centro ,derecha,independientes, libertarios Después critiquemos a Vizcarra",,@sreateguir,#Covid_19,1238307425515700224,https://twitter.com/fernandomunioz7/status/1238307425515700224
2020-03-13 03:18:17,fernandomunioz7,,0,4,12,"Lo único que faltaría que los presidentes de Brasil Bolsonaro , De Estados Unidos Trump y De Rusia Putin salgan positivo de #Covid_19 Creo que ya cayó Bolsonaro Faltan los que decían que era fake new Este corona virus no cree en nadie Ataca a todos sin asco #YoMeQuedoEnCasa",,,#Covid_19 #YoMeQuedoEnCasa,1238303338233507840,https://twitter.com/fernandomunioz7/status/1238303338233507840
2020-03-13 03:17:02,cugartegil,tim_neville,0,0,0,"ya no sorprende el nivel de egoismo de algunos/ the level of selfishness of some is no longer surprising #COVID19 #aplanarlacurva #FlattenTheCurve #quedateencasa #stayathome",,,#COVID19 #aplanarlacurva #FlattenTheCurve #quedateencasa #stayathome,1238303024843558912,https://twitter.com/cugartegil/status/1238303024843558912
2020-03-13 03:14:33,fernandomunioz7,,1,0,2,"Veo que si hay fujimoristas y Apristas que entran en razón con la emergencia sanitaria y medidas de gobierno un poco tardías de Vizcarra pero al menos se dieron con respecto al #CoronaVirusPeru #Covid_19 Pero @TubinoCarlos @JuanSheput andan criticando todo #YoSiMeQuedoEnCasa",,@TubinoCarlos @JuanSheput,#CoronaVirusPeru #Covid_19 #YoSiMeQuedoEnCasa,1238302398881378304,https://twitter.com/fernandomunioz7/status/1238302398881378304
2020-03-13 03:14:08,ivanfajardo,,0,0,4,"ATENCIÓN! ULTIMO MINUTO! De acuerdo con las medidas tomadas por el presidente Martin Vizcarra, queda suspendido el concierto del Martes 17 de Marzo. Las entradas adquiridas seguirán siendo válidas para una fecha próxima, la cual será anunciada pronto. #coronavirus #covid_19 ",,,#coronavirus #covid_19,1238302293910585344,https://twitter.com/ivanfajardo/status/1238302293910585344
2020-03-13 03:05:16,fernandomunioz7,AlbertoZevallo5,0,1,5,"El único que escribe asi es ud Alberto Zevallos Fujimorista que cree que el #CoronaVirusPeru #Covid_19 es de mafia rojo caviar o como el dictador chavista Maduro que es imperialista Aprenda a ser empatico Nadie es Vizcarrista bastante inepto A Uds 90% rechaza #YoSiMeQuedoEmCasa",,,#CoronaVirusPeru #Covid_19 #YoSiMeQuedoEmCasa,1238300062305771520,https://twitter.com/fernandomunioz7/status/1238300062305771520
2020-03-13 02:59:21,mirkoncho85,,0,0,0,"Muy bien, presidente @MartinVizcarraC por las acciones tomadas para controlar la pandemia del Coronavirus, pero también sería bueno y urgente descentralizar el análisis de nuestras, pues en provincias, los resultados se toman un tiempo demasiado prudencial. #Covid_19",,@MartinVizcarraC,#Covid_19,1238298576167538689,https://twitter.com/mirkoncho85/status/1238298576167538689
2020-03-13 02:56:52,fernandomunioz7,sreateguir,2,2,6,"Eres limitado y básico Me importa 2 carajos tu posición política sobre Vizcarra Por eso estamos cagados por personas como tu egoísta, sólo crees que tienes la razón El corona virus no distingue color político Aprende a ser empatico #CoronaVirusPeru #Covid_19 #YoMeQuedoEnCasa",,,#CoronaVirusPeru #Covid_19 #YoMeQuedoEnCasa,1238297951136407556,https://twitter.com/fernandomunioz7/status/1238297951136407556
2020-03-13 02:52:24,MadameTempestad,ToniAlvaL,0,4,8,"Se amplía la prórroga del Impuesto a la Renta para las personas naturales #coronavirusperu #Covid_19 #cuarentena #EmergenciaSanitaria",,,#coronavirusperu #Covid_19 #cuarentena #EmergenciaSanitaria,1238296828078145537,https://twitter.com/MadameTempestad/status/1238296828078145537
2020-03-13 02:46:07,MadameTempestad,QHaRi,0,0,3,"Lean detenidamente este quipu, para que sean responsables y le bajen un poquito a la histeria #coronavirusperu #cuarentena #EmergenciaSanitaria #Covid_19 ",,,#coronavirusperu #cuarentena #EmergenciaSanitaria #Covid_19,1238295244921331714,https://twitter.com/MadameTempestad/status/1238295244921331714
2020-03-13 02:44:45,MadameTempestad,QHaRi,0,0,1,"Liberales a la peruana y Cámara de turismo #coronavirusperu #Covid_19 #cuarentena #EmergenciaSanitaria",,,#coronavirusperu #Covid_19 #cuarentena #EmergenciaSanitaria,1238294901311365120,https://twitter.com/MadameTempestad/status/1238294901311365120
2020-03-13 02:42:06,Fermaling,merinobeatriz,0,0,2,"Como diría el diario @marca, “TE VAMOS A GANAR”. #Covid_19 ",,@marca,#Covid_19,1238294233150377984,https://twitter.com/Fermaling/status/1238294233150377984
2020-03-13 02:26:34,neojavila,EICoronavirus,0,0,0,"jajaj el covid-19 #coronavirusperu, Hops representa muy bien a los políticos peruanos, le sacan la vuelta a la ley con tal de ganar.",,,#coronavirusperu,1238290324553949185,https://twitter.com/neojavila/status/1238290324553949185
2020-03-13 02:05:36,MadameTempestad,TubinoCarlos,4,6,63,"Todavía recuerdo cuando en plena epidemia de cólera, Alberto Fujimori salía en la tele comiendo pescado...por eso y por mucho más: fujimorismo nunca más #coronavirusperu #cuarentena #EmergenciaSanitaria #Covid_19 ",,,#coronavirusperu #cuarentena #EmergenciaSanitaria #Covid_19,1238285047624499201,https://twitter.com/MadameTempestad/status/1238285047624499201
2020-03-13 01:59:16,gustavorevatta,,1,0,1,"Aún jugando así, me quedo con la sensación que hoy y el jueves pudo quedar empate. El problema es que arriba hacemos menos daño que desenfriolito al Covid 19.",,,,1238283453692628997,https://twitter.com/gustavorevatta/status/1238283453692628997
2020-03-13 01:55:04,fernandomunioz7,PatiCa0316,0,0,1,"Te va a impactar esa película Coreana Virus parece el inicio del COVID19 en Wuhan China",,,,1238282397197709312,https://twitter.com/fernandomunioz7/status/1238282397197709312
2020-03-13 01:37:55,ClaaAlejandra,,0,0,0,"Estimad@s, lean a conciencia esta información, no a la desesperación: Preguntas y respuestas sobre la enfermedad por #coronavirus (COVID-19) según la OMS ",,,#coronavirus,1238278083473440769,https://twitter.com/ClaaAlejandra/status/1238278083473440769
2020-03-13 01:33:58,javierurbaneja1,,1,6,9,"#CoronaVirus en Latinoamérica a 344 casos ACTUALIZACIÓN 149-Brasil 33-Chile 31-Argentina | 1 Muerto 27-Panamá | 1 Muerto 23-Costa Rica 22-Perú 19-Ecuador 15-México 9-Colombia 6-Paraguay 5-República D. 3-Bolivia 2-Honduras #COVID19 ",,,#CoronaVirus #COVID19,1238277086185500674,https://twitter.com/javierurbaneja1/status/1238277086185500674
2020-03-13 01:28:31,Zamarritano,,0,1,0,"Lo del corona virus no es que te vaya a sentar en el trono y que por eso vayas a necesitar taaaanto papel higiénico, como tampoco cagarse de miedo como efecto del pánico colectivo; así que relaja con eso de comprar como loco. #HisteriaColectiva #COVID19 #coronavirusperu",,,#HisteriaColectiva #COVID19 #coronavirusperu,1238275717533765640,https://twitter.com/Zamarritano/status/1238275717533765640
2020-03-13 01:11:15,ChdJuan,,0,0,0,"https://p.dw.com/p/3ZHWx?maca=es-Twitter-sharing Así es como #Taiwan logró contener el brote de #coronavirus #Covid_19",,,#Taiwan #coronavirus #Covid_19,1238271371240669185,https://twitter.com/ChdJuan/status/1238271371240669185
2020-03-13 00:40:53,cereza612,sandravoley119,0,0,0,"El voley tmb para ! #COVID19 ",,,#COVID19,1238263727885094914,https://twitter.com/cereza612/status/1238263727885094914
2020-03-13 00:26:10,fernandomunioz7,JuanSheput,0,5,13,"Dígale eso a los presidentes y primeros ministros de Italia, Francia , España, Canada, Argentina, Paraguay, Chile La irresponsabilidad de un político ex congresista resentido nada más Juan Sheput @JuanSheput Que vergüenza suya #CoronaVirusPeru #Covid_19 #YoMeQuedoEnCasa",,@JuanSheput,#CoronaVirusPeru #Covid_19 #YoMeQuedoEnCasa,1238260023513550850,https://twitter.com/fernandomunioz7/status/1238260023513550850
