date,username,to,replies,retweets,favorites,text,geo,mentions,hashtags,id,permalink
2020-03-12 23:43:47,fdavaloso,,0,0,0,"Bill Gates tenía esta hipótesis del #Covid_19 en 2015. Bill alertó de la falencia sanitaria. Interesante, saquen ustedes sus conclusiones... #BillGates",,,#Covid_19 #BillGates,1238249357356433408,https://twitter.com/fdavaloso/status/1238249357356433408
2020-03-12 23:40:35,Pableinzvillalb,,0,0,1,"Me voy a quedar encerrado en la casa, pero no por el #Covid19 sino porque me vaya a encontrar con #Kaviedes y me dé por joderle.",,,#Covid19 #Kaviedes,1238248553325178882,https://twitter.com/Pableinzvillalb/status/1238248553325178882
2020-03-12 23:38:03,pachafmquito,,0,0,0,"#EstáEnTusManos cuidarte a ti y a los tuyos del #Covid_19. Cada 3 horas lava tus manos con agua y jabón por al menos 20 segundos. #QuitoSaludableOtraVez",,,#Est #Covid_19 #QuitoSaludableOtraVez,1238247915543572492,https://twitter.com/pachafmquito/status/1238247915543572492
2020-03-12 23:27:14,Juano_Rodriguez,Salud_Ec,0,0,0,"Lo dicho, ascienden a 19 los casos de covid-19 en el país ",,,,1238245195461820416,https://twitter.com/Juano_Rodriguez/status/1238245195461820416
2020-03-12 23:25:10,analialedesmaec,,1,8,16,"El @AeropuertoUIO mantiene todas sus operaciones con normalidad. Se están tomando las debidas precauciones y se siguen los protocolos ante posibles casos de #Covid_19. Importante mantenernos informados por medios oficiales. @ServiAeroQuito @SandroRuizSa @Quiport.",,@AeropuertoUIO @ServiAeroQuito @SandroRuizSa @Quiport,#Covid_19,1238244675179425792,https://twitter.com/analialedesmaec/status/1238244675179425792
2020-03-12 23:13:51,pachafmquito,,0,0,3,"𝐌𝐄𝐃𝐈𝐃𝐀𝐒 #COVID19 | El Municipio de Quito recomienda hidratarse cada tres horas. El agua de Quito es totalmente potable y de consumo humano. #EstáEnTusManos #QuitoSaludableOtraVez",,,#COVID19 #Est #QuitoSaludableOtraVez,1238241824520749059,https://twitter.com/pachafmquito/status/1238241824520749059
2020-03-12 23:04:56,multipasajes,,0,1,0,"Evita aglomeraciones y no te quedes sin viajar . . . . . #hoy #ecuador #pilas #virus #covid #covid_19 #coronavirus #queelvirusnotepare #distraccion #cumpletumeta #cuidate #usavitaminac #haciaadelante #viajeros @… https://www.instagram.com/p/B9psB5IAScb/?igshid=12fm7homi4en2",,,#hoy #ecuador #pilas #virus #covid #covid_19 #coronavirus #queelvirusnotepare #distraccion #cumpletumeta #cuidate #usavitaminac #haciaadelante #viajeros,1238239581398429697,https://twitter.com/multipasajes/status/1238239581398429697
2020-03-12 23:02:28,LEXGeovanny,,0,1,3,"Hay cosas peores que el #CoronavirusEnEcuador #Covid_19 y ver gente que quiere politizar una #EmergenciaSanitaria GLOBAL, entre todo hay algo tan ilógico como lo de @yakuperezg : ""El #CoronaVirus es culpa de la mineria"". Es decepcionante tener gente asi en cargos publicos.",,@yakuperezg,#CoronavirusEnEcuador #Covid_19 #EmergenciaSanitaria #CoronaVirus,1238238963246211072,https://twitter.com/LEXGeovanny/status/1238238963246211072
2020-03-12 23:00:41,PatricioSalasG,FedesegEc,0,15,14,"Posición de FEDESEG sobre los seguros de asistencia médica y el COVID19 ",,,,1238238511209332737,https://twitter.com/PatricioSalasG/status/1238238511209332737
2020-03-12 22:53:22,josorojas,,0,0,2,"Todo sea por la seguridad y para combatir el #Coronavirus #Covid_19 ",,,#Coronavirus #Covid_19,1238236673433047045,https://twitter.com/josorojas/status/1238236673433047045
2020-03-12 22:50:49,pachafmquito,,0,0,0,"𝐂𝐎𝐌𝐔𝐍𝐈𝐂𝐀𝐃𝐎| El Alcalde Dr. Jorge Yunda Machado mediante resolución A020 de 12 de marzo de 2020 declara en emergencia sanitaria al Distrito Metropolitano de Quito e indica medidas para precautelar la salud de la ciudadanía ante #COVID19. #QuitoGrandeOtraVez",,,#COVID19 #QuitoGrandeOtraVez,1238236028198105094,https://twitter.com/pachafmquito/status/1238236028198105094
2020-03-12 22:46:29,JorgeDavidV10,,0,2,6,"DURA NOTICIA PARA QUIENES AMAMOS EL FÚTBOL. Paulo Dybala, jugador de la Juventus ha dado positivo por CORONAVIRUS (#Covid_19) ",,,#Covid_19,1238234939377823744,https://twitter.com/JorgeDavidV10/status/1238234939377823744
2020-03-12 22:46:08,avefalconi,,4,34,170,"Vi las fotos del #Supermaxi y, la verdad, prefiero morirme de hambre a hacer fila con tanto gil. #CoronavirusEnEcuador #Covid_19",,,#Supermaxi #CoronavirusEnEcuador #Covid_19,1238234849284145153,https://twitter.com/avefalconi/status/1238234849284145153
2020-03-12 22:43:47,MiguelEJijonH,,0,0,0,"En verdad gente, vergüenza les debería dar #CoronavirusEnEcuador #EmergenciaSanitaria #Covid_19 #Ecuador #cuarentena @Salud_Ec @mariapaularomo @Lenin",,@Salud_Ec @mariapaularomo @Lenin,#CoronavirusEnEcuador #EmergenciaSanitaria #Covid_19 #Ecuador #cuarentena,1238234261704134657,https://twitter.com/MiguelEJijonH/status/1238234261704134657
2020-03-12 22:43:01,EcuabetEc,,0,0,1," La @conmebol anuncia suspención de la #libertadores apartir de la siguiente semana por causa del #covid19 ",,@CONMEBOL,#libertadores #libertadores #covid19,1238234068808011777,https://twitter.com/EcuabetEc/status/1238234068808011777
2020-03-12 22:41:31,Salud_CZ9,,0,6,7,"#PrevenciónEsSalud | Entérate más sobre las medidas básicas de prevención que todos debemos adoptar, ante el #COVID19. Más información https://coronavirusecuador.com/ ¡Todos estamos #ActivadosPorLaSalud! #CoronavirusEnEcuador #Covid_19 ",,,#Prevenci #COVID19 #ActivadosPorLaSalud #CoronavirusEnEcuador #Covid_19,1238233690431541252,https://twitter.com/Salud_CZ9/status/1238233690431541252
2020-03-12 22:36:49,verorivadeneira,clarincom,0,0,0,"Hebe de Bonafini, Madre de Plaza de Mayo pide suspender marcha del 24 de marzo por #Covid_19 ",,,#Covid_19,1238232505867780097,https://twitter.com/verorivadeneira/status/1238232505867780097
2020-03-12 22:33:29,WaldoLanda,,0,0,0,"Cualquier medida que pueda prevenir la diseminación del #Covid_19 existiendo o no casos, es importante a nivel nacional y global.",,,#Covid_19,1238231666130325504,https://twitter.com/WaldoLanda/status/1238231666130325504
2020-03-12 22:31:41,BeatrizHLeon,,0,17,66,"Varias compañías de seguros médicos están comunicando desde esta mañana que Si cubrirán gastos de sus afiliados relacionados a #COVID19 Bien por todo lo que ayuda, como esto!",,,#COVID19,1238231215901224960,https://twitter.com/BeatrizHLeon/status/1238231215901224960
2020-03-12 22:29:34,juanflores18,,2,8,5," #ÚltimaHora | Ministerio de @Salud_Ec informa de 2 nuevos casos confirmados de #Coronavirus En total, son 19 los casos positivos de #COVID19 en #Ecuador Se presume - no indica el comunicado - que los 02 nuevos casos son en #Pichincha, según información de @OPSOMS",,@Salud_Ec @opsoms,#Coronavirus #COVID19 #Ecuador #Pichincha,1238230684050784257,https://twitter.com/juanflores18/status/1238230684050784257
2020-03-12 22:29:27,JorgeDavidV10,,0,0,1,"URGENTE: El Director Técnico del Arsenal, Mikel Arteta tiene coronavirus. #Covid_19 ",,,#Covid_19,1238230654850076672,https://twitter.com/JorgeDavidV10/status/1238230654850076672
2020-03-12 22:11:39,pachafmquito,,0,0,0,"𝐌𝐄𝐃𝐈𝐃𝐀𝐒 #COVID19 | El Municipio de Quito recomienda lavarse de manos cada tres horas. #EstáEnTusManos #QuitoSaludableOtraVez",,,#COVID19 #Est #QuitoSaludableOtraVez,1238226173617897473,https://twitter.com/pachafmquito/status/1238226173617897473
2020-03-12 22:10:39,juanflores18,anniecanizares,1,6,4,"Según información de @OPSOMS, en #Ecuador se registrarían 19 casos confirmados de #Coronavirus/#COVID19, 2 más que el Ministerio de @Salud_Ec y serían en #Pichincha ¿Cuáles son las cifras reales @Lenin - @mariapaularomo - @CataAndramuno, es importante aclarar esta situación?",,@opsoms @Salud_Ec @Lenin @mariapaularomo @CataAndramuno,#Ecuador #Coronavirus #COVID19 #Pichincha,1238225921037000704,https://twitter.com/juanflores18/status/1238225921037000704
2020-03-12 22:07:35,ericfochoa,bbcmundo,0,2,5,"Efectivamente no se trata ya de contener el Covid-19 sino de ralentizar su propagación para que nuestros sistemas de salud no colapsen. Vía @bbcmundo",,@bbcmundo,,1238225150681780224,https://twitter.com/ericfochoa/status/1238225150681780224
2020-03-12 21:59:21,CentroEcuador,,0,0,0,"Ecuador está en emergencia sanitaria por la presencia de covid-19. Las clases fueron suspendidas en todo el territorio ecuatoriano a partir de esta tarde. Se cancelan también todos los eventos masivos de más de 1.000 personas.",,,,1238223078355808266,https://twitter.com/CentroEcuador/status/1238223078355808266
2020-03-12 21:47:44,DanielAcostag,DanielAcostag,0,0,0,"Se suspende inicio de audiencia de juzgamiento del #CasoSingue. Tribunal resolverá caducidad de la prision preventiva contra @JorgeGlas y el dictamen lo revelarán mañana. Además se pidió suspensión xq existen 2 procesados mayores de 65 años con riesgo al COVID19. ",,@JorgeGlas,#CasoSingue,1238220153030148098,https://twitter.com/DanielAcostag/status/1238220153030148098
2020-03-12 21:34:31,ZULNELEA,,13,183,491,"Si me desinfecto solo yo no sirve de mucho, mejor si los demás también pueden hacerlo por lo que no es inteligente comprar hasta desabastecer gel y/o alcohol para los demás. Pensemos más allá de nuestro metro cuadrado. Eso ayudará a detener la propagación de. COVID 19.",,,,1238216829753069568,https://twitter.com/ZULNELEA/status/1238216829753069568
2020-03-12 21:21:57,efnv94,marceloespinel,0,0,0,"No le da CoViD19, le da Cetoacidosis Diabética ",,,,1238213665372979207,https://twitter.com/efnv94/status/1238213665372979207
2020-03-12 21:16:18,Gabicho_Ec,FUNDAMEDIOS,0,6,7,"El servicio del periodismo en tiempos de coronavirus está en ser profesional y ético, para así ser referente confiable. El periodismo tiene ante el COVID-19 la oportunidad de mostrar lo imprescindible y necesario del periodismo. Gracias por compartir esta información @FUNDAMEDIOS",,@FUNDAMEDIOS,,1238212245508820993,https://twitter.com/Gabicho_Ec/status/1238212245508820993
2020-03-12 21:09:00,marthacelondono,elcomerciocom,1,4,2,"Esto me parece una medida urgente. ¿Por qué el gobierno no permite a laboratorios privados poder hacer la prueba del #Covid_19? ¿Por el precio de los reactivos? ¿Alguien muy importante estará lucrando? Por favor @Salud_Ec hay que sincerar la información y tomar mejores decisiones",,@Salud_Ec,#Covid_19,1238210406281367552,https://twitter.com/marthacelondono/status/1238210406281367552
2020-03-12 21:05:25,maitemontalvog,pictoline,0,0,1,"Les dejo estos interesantes fondos de pantalla para que no se olviden de los hábitos efectivos que nos mantienen en prevención del #Covid_19 Gracias @pictoline ",,@pictoline,#Covid_19,1238209503541280770,https://twitter.com/maitemontalvog/status/1238209503541280770
2020-03-12 20:46:57,pasodeoroec,,0,0,1,"Por el #Covid_19, la #FIFA suspende la primera fecha de las Eliminatorias Sudamericanas al Mundial de Catar 2022. #Ecuador tenía que visitar a #Argentina, el 26 de marzo.",,,#Covid_19 #FIFA #Ecuador #Argentina,1238204858265669632,https://twitter.com/pasodeoroec/status/1238204858265669632
2020-03-12 20:35:16,rpdrichard,,0,0,0,"Importancia de distanciamiento social (suspensión clases, eventos, evitar aglomeración de personas) para frenar expansión del #coronavirus #Covid_19 No es lo mismo 10 casos en 10 días que 100 casos en 1 día. ",,,#coronavirus #Covid_19,1238201917454548992,https://twitter.com/rpdrichard/status/1238201917454548992
2020-03-12 20:29:57,QueenLdu,,0,0,2,"Mierda!! Hoy tenía que ir a comprar comida para mis gatos, y en el supermaxi ya han acabado con todo Esta gente que arrasa con los productos, hace un consumo de 100 a 300 en compras y difiere para 3 o 6 meses y se tragan en 1 semana #Covid_19 #CoronavirusEnEcuador",,,#Covid_19 #CoronavirusEnEcuador,1238200580847423489,https://twitter.com/QueenLdu/status/1238200580847423489
2020-03-12 20:25:33,alinroberto,fifamedia,0,0,0,"@FIFAcom acepta solicitud de @CONMEBOL y suspende la fecha 1 y 2 de las #EliminatoriasSudamericanas. Serán reprogramadas. #Covid_19. ",,@FIFAcom @CONMEBOL,#EliminatoriasSudamericanas #Covid_19,1238199471621713920,https://twitter.com/alinroberto/status/1238199471621713920
2020-03-12 20:19:52,PMaria2587,,0,0,0,"Tengo esa extraña sensación que como humanidad no hemos avanzado desde la peste negra #Covid_19",,,#Covid_19,1238198043951980545,https://twitter.com/PMaria2587/status/1238198043951980545
2020-03-12 20:18:47,gustavomerino,,1,13,18,"#ATENCION: Ante pandemia de #coronavirus FIFA pospone los partidos de las eliminatorias para la Copa Mundial Catar 2022. Mientras CONMEBOL suspende encuentro de la copa Libertadores #Covid_19 #EmergenciaSanitaria #cuarentena #pandemia #coronavirusec",,,#ATENCION #coronavirus #Covid_19 #EmergenciaSanitaria #cuarentena #pandemia #coronavirusec,1238197768197373956,https://twitter.com/gustavomerino/status/1238197768197373956
2020-03-12 20:18:32,estebi2705,,0,0,0,"#Covid_19 Ante la #EmergenciaSanitaria sobre el #CoronavirusEnEcuador es importarte mantener la calma, informarse por medios oficiales y cumplir con las disposiciones de prevención y contención. #Ecuador Les dejo esto ",,,#Covid_19 #EmergenciaSanitaria #CoronavirusEnEcuador #Ecuador,1238197705635217418,https://twitter.com/estebi2705/status/1238197705635217418
2020-03-12 20:18:19,SanderMcx,,0,0,2,"La iglesia dará misa por YouTube. Pide que demos limosna por PayPal. Y la ostia la enviaran por uber eats. #Ecuador #Covid_19 #CoronavirusEnEcuador",,,#Ecuador #Covid_19 #CoronavirusEnEcuador,1238197654082985989,https://twitter.com/SanderMcx/status/1238197654082985989
2020-03-12 20:17:20,flacsoradio,,0,2,2," #ComunicadoOficial de Flacso Ecuador ante #EmergenciaSanitaria en el país por #COVID-19. #Prevención #Salud.",,,#ComunicadoOficial #EmergenciaSanitaria #COVID #Prevenci #Salud,1238197406652645393,https://twitter.com/flacsoradio/status/1238197406652645393
2020-03-12 20:16:26,alinroberto,CONMEBOL,0,0,0,"@CONMEBOL suspende la @Libertadores del 15 al 21 de marzo. #Covid_19 ",,@CONMEBOL @Libertadores,#Covid_19,1238197178281140224,https://twitter.com/alinroberto/status/1238197178281140224
2020-03-12 20:12:29,Quespuesvs,,0,0,0,"Gracias a todos los energúmenos que corrieron a vaciar los supermercados y farmacias, hasta salir del trabajo esto fue todo lo que alcancé a comprar. #CoronavirusEnEcuador #Covid_19 ",,,#CoronavirusEnEcuador #Covid_19,1238196185204129798,https://twitter.com/Quespuesvs/status/1238196185204129798
2020-03-12 20:07:57,Hugoes008,,1,2,7,"Quiero pedir disculpas a todos los directores de películas zombies que he criticado con frases tipo “Esto es tan falso, la gente no seria así de pendeja en caso de crisis sanitaria o apocalipsis”. Pues parece que sí. #CoronavirusEnEcuador #Covid_19 #CuidemonosDelCoronavirus",,,#CoronavirusEnEcuador #Covid_19 #CuidemonosDelCoronavirus,1238195045263646727,https://twitter.com/Hugoes008/status/1238195045263646727
2020-03-12 19:41:46,Tofusensei,,0,1,1,"Convoco de manera urgente y obligatoria a todos los pastores evangélicos a que vayan a rezar, tocar su pandereta e invocar el nombre del señor Jesucristo, aleluya, a todos los centros de captación de casos del #Covid_19 para que de forma milagrosa sean salvados. ",,,#Covid_19,1238188452904140800,https://twitter.com/Tofusensei/status/1238188452904140800
2020-03-12 19:33:49,ByronLight,,1,0,0,"¿Y que han informado los medios en tu país con respecto al #Covid_19 ? *Pues... #CoronavirusEnEcuador",,,#Covid_19 #CoronavirusEnEcuador,1238186452103634945,https://twitter.com/ByronLight/status/1238186452103634945
2020-03-12 19:21:04,marthacelondono,FatimaQuishpe,0,0,0,"La iglesia, como siempre, en negación. Corresponde a la gente tomarse en serio el #Covid_19 y rezar en sus casas. Me parece el colmo que no cierren las iglesias. ¡Irresponsables! ",,,#Covid_19,1238183245289832455,https://twitter.com/marthacelondono/status/1238183245289832455
2020-03-12 19:09:41,DayraMunoz3,spectatorindex,0,3,1,"Todo se suspende. #Ecuador debería de suspender la entrada de vuelos de los países donde más contagios hay de #Covid_19 esto es una emergencia! #CoronavirusEnEcuador",,,#Ecuador #Covid_19 #CoronavirusEnEcuador,1238180379615531008,https://twitter.com/DayraMunoz3/status/1238180379615531008
2020-03-12 19:02:07,maritagauc,,0,0,0,"Qué está pasando?, prohíben eventos para evitar la aglomeración. Supermercados pueden ser foco de infección. Conciencia y responsabilidad. #CoronavirusEnEcuador #Covid_19 ",,,#CoronavirusEnEcuador #Covid_19,1238178474956926976,https://twitter.com/maritagauc/status/1238178474956926976
2020-03-12 18:58:53,dm_todofutbol,,0,0,0,"Coronavirus: Leicester tendría tres casos de jugadores con COVID-19 ",,,,1238177661706526722,https://twitter.com/dm_todofutbol/status/1238177661706526722
2020-03-12 18:47:36,SofiaRamirez_E,,0,0,0,"Lo siento pero seguimos siendo un pueblo. Ni bien se anuncian las medidas de emergencia sanitaria y lo primero que hacemos es ir como locos al supermercado a desabastecerlo. la gente no entiende lo que es prevención #Covid_19",,,#Covid_19,1238174824477921282,https://twitter.com/SofiaRamirez_E/status/1238174824477921282
2020-03-12 18:38:07,AccesoriosBliss,,0,0,0,"Son tiempos de responsabilidad para la humanidad No seamos alarmistas pero también procuremos cuidarnos y cuidar al resto #Covid_19 ",,,#Covid_19,1238172436950142976,https://twitter.com/AccesoriosBliss/status/1238172436950142976
2020-03-12 18:36:20,exactodigital,,0,1,0,"#Quito #Ecuador #Pandemia #covid19 #coronavirusec #covid19ec Emergencia Sanitaria no significa acaparar los víveres, vaciar mercados y supermercados. Significa ser inteligentes, solidarios y prevenir. en Quito, Ecuador https://www.instagram.com/p/B9pNSjiJiD9/?igshid=dqz07axtmbjp",,,#Quito #Ecuador #Pandemia #covid19 #coronavirusec #covid19ec,1238171985882107908,https://twitter.com/exactodigital/status/1238171985882107908
2020-03-12 18:27:19,QueenLdu,,2,0,5,"DICEN QUE EVITEMOS AGLOMERACIONES Y LA GENTE PENDEJA LO ÚNICO QUE HACE ES HACER MAS PENDEJADAS DIOSITO DAME PACIENCIA!!!! #Covid_19 #CoronavirusEnEcuador #COVID19ec #Uio #ecuador ",,,#Covid_19 #CoronavirusEnEcuador #COVID19ec #Uio #ecuador,1238169719112417281,https://twitter.com/QueenLdu/status/1238169719112417281
2020-03-12 18:22:44,SofiaRamirez_E,,1,0,0,"Suspenden clases mañana pero... ¿los profesores SÍ tienen que ir a las instituciones educativas a supervisar los trabajos que los chicos tienen que hacer desde casa? ¿es así? #Covid_19",,,#Covid_19,1238168562503729154,https://twitter.com/SofiaRamirez_E/status/1238168562503729154
2020-03-12 17:46:42,pachafmquito,,0,0,0,"#AHORA| Instalamos el Comité de Operaciones de Emergencia en Quito, como parte de las medidas de prevención en el marco de la declaratoria de emergencia sanitaria del Distrito Metropolitano de Quito realizada por el Alcalde Jorge Yunda Machado. #COVID19 #QuitoSaludableOtraVez",,,#AHORA #COVID19 #QuitoSaludableOtraVez,1238159495597080580,https://twitter.com/pachafmquito/status/1238159495597080580
2020-03-12 17:46:31,EPMQuitoTurismo,,0,0,1,"Los mercados del Distrito Metropolitano de Quito se mantendrán activos y con las medidas de higiene reforzadas luego de las respectivas capacitaciones para la prevención del #COVID19. #QuitoSaludableOtraVez",,,#COVID19 #QuitoSaludableOtraVez,1238159448226619394,https://twitter.com/EPMQuitoTurismo/status/1238159448226619394
2020-03-12 17:45:37,EPMQuitoTurismo,,0,1,4,"#AHORA | Instalamos el Comité de Operaciones de Emergencia en Quito, como parte de las medidas de prevención en el marco de la declaratoria de emergencia sanitaria del Distrito Metropolitano de Quito realizada por el Alcalde Jorge Yunda Machado. #COVID19 #QuitoSaludableOtraVez",,,#AHORA #COVID19 #QuitoSaludableOtraVez,1238159224699568130,https://twitter.com/EPMQuitoTurismo/status/1238159224699568130
2020-03-12 17:39:09,Hugoes008,,0,0,3,"¿Qué acaban de prohibir en el Congreso de los Estados Unidos? Según la traductora de sordomudos. #CoronavirusEnEcuador #Covid_19 #CuidemonosDelCoronavirus",,,#CoronavirusEnEcuador #Covid_19 #CuidemonosDelCoronavirus,1238157597468999680,https://twitter.com/Hugoes008/status/1238157597468999680
2020-03-12 17:17:48,IdaliaMolina,,0,0,2,"Cuidado.con los saludos #FelizJueves #Covid_19 #CoronavirusEnEcuador",,,#FelizJueves #Covid_19 #CoronavirusEnEcuador,1238152224213262336,https://twitter.com/IdaliaMolina/status/1238152224213262336
2020-03-12 17:11:50,radiolacalle,,14,70,96,"A esta hora, las personas colapsan los supermercados en Quito. Hacemos un llamado a la ciudadanía a mantener la calma. #Covid_19 #CoronavirusEnEcuador",,,#Covid_19 #CoronavirusEnEcuador,1238150721444425735,https://twitter.com/radiolacalle/status/1238150721444425735
2020-03-12 17:04:08,mandres_an,,0,0,0,"Thanos tenía razón, lo confirmo y te confirmo y no pienso discutirlo con nadie! #Covid_19",,,#Covid_19,1238148782187073537,https://twitter.com/mandres_an/status/1238148782187073537
2020-03-12 17:02:32,antoine__angos,,0,2,6,"No serán estúpidos por favor #Covid_19 #CoronavirusEnEcuador #COVID19ec #cuarentena #coronavirus #COVID19 #FelizJueves #Quito #Guayaquil #Ecuador #Ecuatorianos",,,#Covid_19 #CoronavirusEnEcuador #COVID19ec #cuarentena #coronavirus #COVID19 #FelizJueves #Quito #Guayaquil #Ecuador #Ecuatorianos,1238148381261914113,https://twitter.com/antoine__angos/status/1238148381261914113
2020-03-12 16:56:38,Hugoes008,,1,4,12,"Primera recomendación evitar las aglomeraciones y mi gente valiendo verga! Con que uno tenga coronavirus y chao! Conciencia #CoronavirusEnEcuador #COVID19 #CuidemonosDelCoronavirus",,,#CoronavirusEnEcuador #COVID19 #CuidemonosDelCoronavirus,1238146896901943311,https://twitter.com/Hugoes008/status/1238146896901943311
2020-03-12 16:37:51,jplazaecu,,0,0,0,"#ECUADOR en #EmergenciaSanitaria por el #coronavirus #Covid_19 El alcalde de Quito, Jorge Yunda, también declaró a la capital en emergencia sanitaria. Las clases se suspenden desde mañana en todo el país. Al igual que todo evento masivo. Fútbol con estadios vacíos.",,,#ECUADOR #EmergenciaSanitaria #coronavirus #Covid_19,1238142170743398400,https://twitter.com/jplazaecu/status/1238142170743398400
2020-03-12 16:36:28,antoine__angos,,0,0,1,"Los #Ecuatorianos somos tan noveleros y estúpidos que ya vamos a dejar vacíos los supermercados y farmacias. Y para colmo esa gente piensa que la #cuarentena es 40 días de aislamiento jaja #Covid_19 #CoronavirusEnEcuador #COVID19ec #COVID19 #Quito #Guayaquil #Ecuador #FelizJueves",,,#Ecuatorianos #cuarentena #Covid_19 #CoronavirusEnEcuador #COVID19ec #COVID19 #Quito #Guayaquil #Ecuador #FelizJueves,1238141822016389120,https://twitter.com/antoine__angos/status/1238141822016389120
2020-03-12 16:29:50,DanielAcostag,,0,7,0," Discotecas y bares NO PODRÁN FUNCIONAR desde esta medianoche como medida de prevención del COVID-19. @ucsg_tv – at Presidencia De La República De Ecuador",,@ucsg_tv,,1238140150733058055,https://twitter.com/DanielAcostag/status/1238140150733058055
2020-03-12 16:27:06,dm_todofutbol,,0,0,0,"Por motivos del #COVID19 en nuestro país, los partidos de la fecha 3 de #SerieB se jugarán sin presencia de público.",,,#COVID19 #SerieB,1238139462959456260,https://twitter.com/dm_todofutbol/status/1238139462959456260
2020-03-12 16:26:08,pasodeoroec,,0,0,0,"#ECUADOR | El principal torneo de fútbol ecuatoriano se jugará sin presencia de público en los estadios por el #Covid_19 #CoronavirusEnEcuador Esta decisión se aplicará este fin de semana y se seguirá evaluando la situación. @lamula @PachiComunicar",,@lamula @PachiComunicar,#ECUADOR #Covid_19 #CoronavirusEnEcuador,1238139220797071360,https://twitter.com/pasodeoroec/status/1238139220797071360
2020-03-12 16:22:27,efnv94,EstebanOrtizMD,0,0,7,"La pandemia de la ignorancia nos va a matar antes que CoViD19 y compañía ",,,,1238138293956554754,https://twitter.com/efnv94/status/1238138293956554754
2020-03-12 16:17:28,silvanajharo,,1,2,4,"Quien asumió con responsabilidad y determinación las medidas frente al #Covid_19 es @LoroHomero el Gobierno como siempre lejos de cubrir las necesidades y expectativas. Ojalá estén preparados para atender la emergencia. Por nuestra parte hagamos lo que nos corresponde con empatia",,@LoroHomero,#Covid_19,1238137039964471297,https://twitter.com/silvanajharo/status/1238137039964471297
2020-03-12 16:16:48,MariaBelenArro1,DrTedros,0,4,3,"Dos razones por las que se declaró la #pandemia del #COVID19: -rapidez y escala de la transmisión -falta de compromiso de ciertos Estados, a pesar de las múltiples advertencias #OMS @revistavistazo",,@revistavistazo,#pandemia #COVID19 #OMS,1238136873438121984,https://twitter.com/MariaBelenArro1/status/1238136873438121984
2020-03-12 16:15:49,efnv94,BeatrizHLeon,0,0,0,"Pues la ciudadana que trajo un certificado falso de tener CoViD19 a un Juzgado en Quito y que puso en jaque a todos los presentes, es un brillante ejemplo de lo que puede pasar. Imagínese que todos los laboratorios hubieran estado autorizados ayer, FREGADOS.",,,,1238136623235301377,https://twitter.com/efnv94/status/1238136623235301377
2020-03-12 16:15:14,MMercedesGranda,,0,0,0,"Gobierno anuncia medidas sobre la declaratoria de emergencia sanitaria por el covid19 a nivel mundial. En ecuador, las clases se suspenden a nivel nacional ..",,,,1238136478850519040,https://twitter.com/MMercedesGranda/status/1238136478850519040
2020-03-12 16:04:15,ervalencia1,,0,0,1,"Leer para estar preparados Coronavirus: qué tan rápidamente se está extendiendo el covid-19 por América Latina. #Covid_19 #CoronavirusEnEcuador #coronavirusEC #coronavirus #covidEC #coronavirusec #COVID19ec",,,#Covid_19 #CoronavirusEnEcuador #coronavirusEC #coronavirus #covidEC #coronavirusec #COVID19ec,1238133715034935296,https://twitter.com/ervalencia1/status/1238133715034935296
2020-03-12 16:03:02,Suphiie,,0,0,0,"Miji, primero me cancelan el concierto de LP por el paro y ahora me lo van a cancelar por el Covid-19. Vale verga la vida.",,,,1238133406015328256,https://twitter.com/Suphiie/status/1238133406015328256
