date,username,to,replies,retweets,favorites,text,geo,mentions,hashtags,id,permalink
2020-03-17 23:36:49,Salud_CZ9,,0,2,2,"#QuédateEnCasa | decretó #EstadoDeExcepción, lo que implica un #ToqueDeQueda desde este martes y la suspensión de todas las actividades exceptuando las vinculadas con salud y abastecimiento de alimentos. #ActivadosPorLaSalud #CoronavirusEc #Covid_19 ",,,#Qu #EstadoDeExcepci #ToqueDeQueda #ActivadosPorLaSalud #CoronavirusEc #Covid_19,1240059547412299777,https://twitter.com/Salud_CZ9/status/1240059547412299777
2020-03-17 23:34:36,Salud_CZ9,,0,1,1,"#QuédateEnCasa | Informamos a la ciudadanía que habrá fuertes sanciones para quienes especulen con los precios u obliguen a sus trabajadores a laborar presencialmente. #EstadoDeExcepción #ActivadosPorLaSalud #CoronavirusEc #Covid_19 ",,,#Qu #EstadoDeExcepci #ActivadosPorLaSalud #CoronavirusEc #Covid_19,1240058988324102145,https://twitter.com/Salud_CZ9/status/1240058988324102145
2020-03-17 23:33:47,Salud_CZ9,,0,1,1,"#QuédateEnCasa | Es importante que seamos responsables con el uso del salvoconducto, caso contrario se tendrán consecuencias. #EstadoDeExcepción #ActivadosPorLaSalud #CoronavirusEc #Covid_19 ",,,#Qu #EstadoDeExcepci #ActivadosPorLaSalud #CoronavirusEc #Covid_19,1240058780999651328,https://twitter.com/Salud_CZ9/status/1240058780999651328
2020-03-17 23:28:03,VictorMCh84,,0,0,0,"Más de una semana con intermitencia en el servicio de agua potable y acaba de irse en emergencia sanitaria por el #COVID19. Nadie da solución. Conjunto Terrazas del Pichincha sector la biloxi. @aguadequito @LoroHomero @Lenin",,@aguadequito @LoroHomero @Lenin,#COVID19,1240057340059140097,https://twitter.com/VictorMCh84/status/1240057340059140097
2020-03-17 23:27:55,pachafmquito,,0,3,5,"Ante la declaratoria de emergencia sanitaria por el #COVID19, la Secretaría de Inclusión Social entrega kits de ayuda a los Grupos de Atención Prioritaria más vulnerables como personas adultas mayores y habitantes de calle. #ConMedidasSalvamosVidas",,,#COVID19 #ConMedidasSalvamosVidas,1240057306009735169,https://twitter.com/pachafmquito/status/1240057306009735169
2020-03-17 23:16:50,ZULNELEA,,76,663,2425,"Sostengamos mañana y 13 días más las calles vacías en Quito. Sí podemos mantener al #Covid-19 a raya! Lejos! No le demos posibilidad de moverse en la ciudad! Vamos Quito! ",,,#Covid,1240054518051676160,https://twitter.com/ZULNELEA/status/1240054518051676160
2020-03-17 23:01:02,EnriqueRoseroC,DanielNovasco,0,0,4,"Suficiente contraridad con el #Covid_19 para averiguar de algo más despreciablemente virulento...",,,#Covid_19,1240050539884425216,https://twitter.com/EnriqueRoseroC/status/1240050539884425216
2020-03-17 22:56:38,patriciovimos88,,0,0,0,"Colorida con tonos grises #Quito 17:50 #cuarentena #cuarentona #Covid_19 – at Seminario mayor",,,#Quito #cuarentena #cuarentona #Covid_19,1240049430985945090,https://twitter.com/patriciovimos88/status/1240049430985945090
2020-03-17 22:51:56,juanflores18,,9,150,72," ECUATORIANOS Nuestra @cruzrojaecuador alertó hoy sobre desabastecimiento de sangre en el país , hacemos un llamado a TODOS los que puedan donar ¡Una pinta, salva 3-7 vidas ! 0992717486 (UIO) / 098122388 (GYE) #QuedateEnLaCasa #Covid_19 #CoronavirusEC",,@cruzrojaecuador,#QuedateEnLaCasa #Covid_19 #CoronavirusEC,1240048249714757632,https://twitter.com/juanflores18/status/1240048249714757632
2020-03-17 22:51:14,esthercuestasan,,1,17,11,"#Covid_19 en Italia: 31.506 casos positivos y 2.503 muertos. Nuestro abrazo solidario al pueblo italiano y a nuestros compatriotas en Italia. #QuedateEnLaCasa Superata la soglia dei 2.500 morti ma aumentano le guarigioni: 2.941",,,#Covid_19 #QuedateEnLaCasa,1240048073864290307,https://twitter.com/esthercuestasan/status/1240048073864290307
2020-03-17 22:49:44,pachafmquito,,0,1,3,"¡Hoy es el día 1! Porque me importa mi familia, porque quiero cuidarme y cuidarte, porque es ahora el momento de prevenir y evitar el contagio del #COVID19, por eso y más, me quedo en casa. #ConMedidasSalvamosVidas #QuédateEnCasa #QuitoEnCasa",,,#COVID19 #ConMedidasSalvamosVidas #Qu #QuitoEnCasa,1240047698188869637,https://twitter.com/pachafmquito/status/1240047698188869637
2020-03-17 22:48:38,AndresFranko,,0,0,0,"“Si hubiera que elegir un sonido universal para la paz, votaría por el ronroneo.” (B.L. Diamond). . Coméntame qué te parece la foto . Hoy estamos todos en casa, dado a la situación preocupante del #covid_19 en… https://www.instagram.com/p/B92iI4qALnl/?igshid=qra4ymi0pmts",,,#covid_19,1240047418772615168,https://twitter.com/AndresFranko/status/1240047418772615168
2020-03-17 22:33:12,SeBaS_SMP,,0,15,14,"La posible cura para el #Covid_19 es un interferon que activa la respuesta inmune, para la formación de proteínas antivíricas, mi gran reconocimiento al Centro de Ingenieria Genética y Biotecnología de Cuba @CIGBCuba #EcuadorNecesitaDeCuba @MashiRafael",,@CIGBCuba @MashiRafael,#Covid_19 #EcuadorNecesitaDeCuba,1240043535040118791,https://twitter.com/SeBaS_SMP/status/1240043535040118791
2020-03-17 22:04:28,LasManuelasEc,,0,1,1,"#QuédateEnCasa | Ventilar la casa ayuda a cuidar la salud de todos, evitando que tú y tu familia sufran el riesgo de afectarse por las partículas de gripe o virus como el #COVID19. Recuerda que la #PrevenciónEsSalud ¡Mantengámonos #ActivadosPorLaSalud!",,,#Qu #COVID19 #Prevenci #ActivadosPorLaSalud,1240036306111082497,https://twitter.com/LasManuelasEc/status/1240036306111082497
2020-03-17 21:58:45,WaldoLanda,,1,0,3,"Confirmen cuantos están paranoicos y ya sintieron dificultad respiratoria, tos y fiebre desde que empezó esto del #covid19",,,#covid19,1240034865585762312,https://twitter.com/WaldoLanda/status/1240034865585762312
2020-03-17 21:57:29,marlondanny94,,0,0,1,"#eco De #PlayGround @EmmanuelMacron destinará 300.000 millones para ayudar a las empresas. Suspende temporalmente las obligaciones fiscales y las cotizaciones sociales. El estado asumirá el pago de agua, luz y gas ante la crisis del #Covid_19 Enlace: https://www.instagram.com/p/B910Ofsqyjf/?igshid=1s44kujhk6fsr",,@EmmanuelMacron,#eco #PlayGround #Covid_19,1240034546797678592,https://twitter.com/marlondanny94/status/1240034546797678592
2020-03-17 21:49:38,sofyromeroyanez,,9,183,217,"Pidamos al gobierno que reactive los convenios con #Cuba y de esta manera prevenir el avance del #Covid_19. Súmate al tuitazo para pedir que el Gobierno reactive los convenios con Cuba y que nos envíen medicamentos y especialistas . #EcuadorNecesitaDeCuba",,,#Cuba #Covid_19 #EcuadorNecesitaDeCuba,1240032571733540866,https://twitter.com/sofyromeroyanez/status/1240032571733540866
2020-03-17 21:35:27,condelpach,,0,0,0,"@DinersClubEC @FEGASG que pasó?? Me imagino que mi caso no es el único, si uno es consultor y no tiene un ingreso fijo mensual, que se puede hacer, cuando las actividades están suspendidas por el #Covid_19 #QuedateEnLaCasa #coronavirus",,@DinersClubEC @FEGASG,#Covid_19 #QuedateEnLaCasa #coronavirus,1240029004272459779,https://twitter.com/condelpach/status/1240029004272459779
2020-03-17 21:29:22,bb00cc11,,0,0,0,"Médicos exigen dotación de equipos de protección para fortalecer atención del Covid-19 - ",,,,1240027472315453440,https://twitter.com/bb00cc11/status/1240027472315453440
2020-03-17 21:29:19,ortegajorgeluis,dayumaEc,1,0,0,"Cuál es la idea? Si un infectado de #Covid_19 se acerca le disparo ?",,,#Covid_19,1240027460432953344,https://twitter.com/ortegajorgeluis/status/1240027460432953344
2020-03-17 21:29:05,daamichelena,,0,0,0,"JUMANJIIIIIIIIIIIIIIII ... Ay coño perdón, aún estamos en marzo..UPS #quedateEnTuCasa a esto le falta algo... #QuedateEnTuCasaCOÑO ahora si.. Bueno seguimos #coronavirusecuador #Covid_19 #YoMeQuedoEnCasa Fin de éste comunicado",,,#quedateEnTuCasa #QuedateEnTuCasaCO #coronavirusecuador #Covid_19 #YoMeQuedoEnCasa,1240027401884704768,https://twitter.com/daamichelena/status/1240027401884704768
2020-03-17 21:28:21,vladimirypunto,,0,0,2,"Guayaquil y Quito, hoy martes 17 de marzo, a la misma hora. Guayaquil tiene 81 casos confirmados, mientras que Quito 8. #COVID19 Juzguen ustedes..... ",,,#COVID19,1240027217377271813,https://twitter.com/vladimirypunto/status/1240027217377271813
2020-03-17 21:23:39,LasManuelasEc,,0,1,2,"#ActivadosPorLaSalud | Las precauciones de aislamiento son de vital importancia para establecer barreras entre virus y personas. #QuédateEnCasa, no te expongas a espacios donde ha estado una persona enferma. #COVID19 #PrevenciónEsSalud #CoronavirusEc",,,#ActivadosPorLaSalud #Qu #COVID19 #Prevenci #CoronavirusEc,1240026031102349314,https://twitter.com/LasManuelasEc/status/1240026031102349314
2020-03-17 21:17:08,LasRollingas,libermanmartin,0,0,0,"Ojalá no regrese más. Y esa inversión como la llaman de los súper sueldos de la haga para este tipo de premuras de salud mundial como la que estamos viviendo. Si vieron ese tuit que dice que Messi gana tanto y un científico tanto? Ahora pídanle a Messi la cura de Covid19 ",,,,1240024392677175296,https://twitter.com/LasRollingas/status/1240024392677175296
2020-03-17 21:14:51,KaruaFilms,,1,3,10,"Vista desde el aire #Quito en su primer día de #CuarentenaNacional. #Covid_19 #QuedateEnLaCasa #Coronavirus #CoronavirusEnEcuador",,,#Quito #CuarentenaNacional #Covid_19 #QuedateEnLaCasa #Coronavirus #CoronavirusEnEcuador,1240023816522338304,https://twitter.com/KaruaFilms/status/1240023816522338304
2020-03-17 21:13:46,dm_todofutbol,,0,0,0,"Detectados seis casos de COVID-19 en el Espanyol ",,,,1240023546170093573,https://twitter.com/dm_todofutbol/status/1240023546170093573
2020-03-17 21:09:22,tito28junrxto,ChrisRValle,0,0,1,"Guayaquil tiene mas infectados Covid19, la medida tomada por alcalde Yunda en la capital tiene respaldo de los quiteños",,,,1240022438076874752,https://twitter.com/tito28junrxto/status/1240022438076874752
2020-03-17 21:04:05,soycarlosguia,drmiguelmarcos,0,7,4,"Compartir está información tan importante del #COVID_19 #QuedateEnLaCasa #YoMeQuedoEnCasa #ATENCION #quedateEnTuCasa",,,#COVID_19 #QuedateEnLaCasa #YoMeQuedoEnCasa #ATENCION #quedateEnTuCasa,1240021107085901824,https://twitter.com/soycarlosguia/status/1240021107085901824
2020-03-17 20:57:05,UniYachayTech,,0,20,45,"¡@RBionatura, la revista especializada en ciencia de @UniYachayTech, presenta el artículo: ""COVID-19: An effective vaccine is needed"", para conocer un poco más sobre el #COVID19! ►http://revistabionatura.com/2020.05.02.2-.html #HacemosCienciaYT",,@RBionatura @UniYachayTech,#COVID19 #HacemosCienciaYT,1240019346497339400,https://twitter.com/UniYachayTech/status/1240019346497339400
2020-03-17 20:46:24,LasManuelasEc,,0,3,4,"#PrevenciónEsSalud | Recuerda hacer lo que debes para cuidar a tus seres queridos. Toma las precauciones necesarias. #ActivadosPorLaSalud #COVID19 #CoronavirusEc #QuédateEnCasa",,,#Prevenci #ActivadosPorLaSalud #COVID19 #CoronavirusEc #Qu,1240016658443485187,https://twitter.com/LasManuelasEc/status/1240016658443485187
2020-03-17 20:40:49,coberdigital,,0,9,5,"Si encuentras una información falsa en Facebook, así la denuncias #CoronaVirusFacts #CoronaVirusFactsEC #FakeNews #Covid_19 ",,,#CoronaVirusFacts #CoronaVirusFactsEC #FakeNews #Covid_19,1240015251938201603,https://twitter.com/coberdigital/status/1240015251938201603
2020-03-17 20:39:47,LuisRod115,adan_ulrich,0,0,0,"Aplaudo la gestión y Estrategia inteligente de nuestro alcalde @LoroHomero a través de sus directrices para resguardar la Salud de todos nosotros los quiteños, así evitar la expansion del covid-19 Dios Lo Siga Bendiciendo #YoMeQuedoEnCasa",,@LoroHomero,#YoMeQuedoEnCasa,1240014993015234560,https://twitter.com/LuisRod115/status/1240014993015234560
2020-03-17 20:39:36,dm_todofutbol,BarcelonaSC,0,0,0,"#BarcelonaSC informa que hasta el momento las pruebas del #COVID19 han sido negativas ",,,#BarcelonaSC #COVID19,1240014948924825600,https://twitter.com/dm_todofutbol/status/1240014948924825600
2020-03-17 20:39:05,antonio_dflores,,0,2,3,"Ante la #PandemiaMundial por el #Covid_19, realicé este vídeo donde hago un recuento de lo que ha pasado y las medidas que ha tomado el gobierno de #Ecuador hasta el momento para evitar que el virus se propague Les comparto el resultado https://youtu.be/33-xQGQLf5o",,,#PandemiaMundial #Covid_19 #Ecuador,1240014817903214596,https://twitter.com/antonio_dflores/status/1240014817903214596
2020-03-17 20:34:22,dm_todofutbol,,0,0,0,"El COI sigue adelante con los preparativos para Tokio 2020 pese al COVID-19 ",,,,1240013628411187200,https://twitter.com/dm_todofutbol/status/1240013628411187200
2020-03-17 20:22:14,analialedesmaec,UNWTO,1,6,13,"Es un momento muy duro para el sector turístico. Sin embargo el sacrificio de hoy será la recompensa de mañana. No puede existir turismo sin personas. #Covid_19 #QuédateEnCasa.",,,#Covid_19 #Qu,1240010577008828421,https://twitter.com/analialedesmaec/status/1240010577008828421
2020-03-17 20:15:38,bb00cc11,,0,0,0,"Coronavirus: de 20 a 49 años, los más contagiados con COVID-19 en Ecuador ",,,,1240008914160230401,https://twitter.com/bb00cc11/status/1240008914160230401
2020-03-17 20:09:50,xicasanovac,,1,4,5,"#COVID19 avanza de modo vertiginoso, hay un aumento explosivo y vamos a enfrentar batallas épicas. El Estado ha demostrado responsabilidad y sensatez en las medidas adoptadas, pero la ciudadanía aún no toma la conciencia necesaria. ",,,#COVID19,1240007458032099335,https://twitter.com/xicasanovac/status/1240007458032099335
2020-03-17 20:05:56,coberdigital,EFEnoticias,0,3,3,"#CoronaVirusFactsEC “Es muy raro que el COVID-19 pueda acabar contagiando a alguien por esa vía” Por lo que experto Consejo Científico del Colegio Médicos de Madrid recomienda “no generar un estado de ansiedad extrema"" Este chequeo no le va a gustar a muchos pero.. ",,,#CoronaVirusFactsEC,1240006473469624332,https://twitter.com/coberdigital/status/1240006473469624332
2020-03-17 20:04:39,BomberosQuito,,3,60,140,"Personal de #BomberosQuito realiza patrullajes preventivos y solicita a la ciudadanía que permanezca en casa debido a la emergencia sanitaria. ¡#QuédateEnCasa! Es la mejor manera de precautelar tu bienestar y el de toda tu familia. #COVID19 ",,,#BomberosQuito #Qu #COVID19,1240006150466220033,https://twitter.com/BomberosQuito/status/1240006150466220033
2020-03-17 20:03:17,schumyn,,0,3,0,"#Coronavirus: ¿qué le hace el covid-19 a tu cuerpo? | Ecuavisa ",,,#Coronavirus,1240005808433364993,https://twitter.com/schumyn/status/1240005808433364993
2020-03-17 20:00:47,pachafmquito,,0,0,2,"COMUNICADO | Por el Estado de Excepción se suspenden las campañas de esterilización y la atención en los Centros Veterinarios de Urbanimal. El cuidado de los animales que están en los albergues de paso continúa. No los abandones, ellos no transmiten el #COVID19 #QuédateEnCasa",,,#COVID19 #Qu,1240005176980918274,https://twitter.com/pachafmquito/status/1240005176980918274
2020-03-17 19:57:54,HeiferEcuador,,0,4,4,"#Atención | Comunicado oficial @HeiferEcuador medidas adoptadas frente al #Covid_19. ",,@HeiferEcuador,#Atenci #Covid_19,1240004454369419264,https://twitter.com/HeiferEcuador/status/1240004454369419264
2020-03-17 19:55:08,CamaraCIP,,0,8,12,"CIP INFORMA | Revisa quienes están exentos de la restricción de movilidad en #Quito. Recuerda que las cadenas de producción, distribución y comercialización de productos de primera necesidad pueden circular con normalidad para el abastecimiento en emergencia sanitaria #Covid_19 ",,,#Quito #Covid_19,1240003758404390913,https://twitter.com/CamaraCIP/status/1240003758404390913
2020-03-17 19:48:01,pachafmquito,,0,3,6,"El @MunicipioQuito tomó medidas frente a la crisis del #COVID19, precisamente para no sufrir la experiencia de Italia u otros países en donde se rebasó los límites de la pandemia. El aislamiento es obligatorio en sus hogares. #ConMedidasSalvamosVidas #QuédateEnCasa 2/2",,@MunicipioQuito,#COVID19 #ConMedidasSalvamosVidas #Qu,1240001966958350338,https://twitter.com/pachafmquito/status/1240001966958350338
2020-03-17 19:45:47,pachafmquito,,3,8,17,"El @MunicipioQuito tomó medidas frente a la crisis del #COVID19, precisamente para no sufrir la experiencia de Italia u otros países en donde se rebasó los límites de la pandemia. El aislamiento es obligatorio en sus hogares. #ConMedidasSalvamosVidas #QuédateEnCasa 1/2",,@MunicipioQuito,#COVID19 #ConMedidasSalvamosVidas #Qu,1240001405651488768,https://twitter.com/pachafmquito/status/1240001405651488768
2020-03-17 19:28:41,pachafmquito,,0,1,2,"#EstáEnTusManos cuidarte a ti y a los tuyos del #COVID19. Cada 3 horas lava tus manos con agua y jabón por al menos 20 segundos. #QuédateEnCasa",,,#Est #COVID19 #Qu,1239997099032395776,https://twitter.com/pachafmquito/status/1239997099032395776
2020-03-17 19:24:48,diegomaster84,,0,1,0,"Primera vez que el #ecuatoriano supera las expectativas. Incluso solo en el #Guayas rompieron récord individualmente como provincia. Expectativas: 79 “Realidad”: 111 No hay duda, expertos en valer verga! #QuedateEnLaCasa #Covid_19 #17Mar #Ecuador",,,#ecuatoriano #Guayas #QuedateEnLaCasa #Covid_19 #17Mar #Ecuador,1239996123051429891,https://twitter.com/diegomaster84/status/1239996123051429891
2020-03-17 19:24:26,positiva_860am,,0,0,2,"#ULTIMAHORA El club Juventus de Italia, acaba de confirmar el segundo caso de #covıd19 en el equipo, se trata del francés Blaise Matuidi. El jugador se encuentra asintomático y en aislamiento. ",,,#ULTIMAHORA #cov,1239996030407585797,https://twitter.com/positiva_860am/status/1239996030407585797
2020-03-17 19:23:54,BloqueAP35,,0,8,13," Ayer el Presidente de la @AsambleaEcuador @cesarlitardo informó sobre los resultados de la reunión virtual con la Ministra de @Salud_Ec @CataAndramuno . Hoy se espera el decreto ministerial que establece techos de los precios del examen del #Covid_19 en laboratorios privados ",,@AsambleaEcuador @cesarlitardo @Salud_Ec @CataAndramuno,#Covid_19,1239995897968197632,https://twitter.com/BloqueAP35/status/1239995897968197632
2020-03-17 19:11:00,MunicipioQuito,,0,8,15,"#EstáEnTusManos cuidarte a ti y a los tuyos del #COVID19. Cada 3 horas lava tus manos con agua y jabón por al menos 20 segundos. #QuédateEnCasa",,,#Est #COVID19 #Qu,1239992649790238722,https://twitter.com/MunicipioQuito/status/1239992649790238722
2020-03-17 18:59:14,maitemontalvog,pictoline,0,0,0," ¿Por qué es importante mantener una distancia entre personas para evitar contagios? #Covid_19 ",,,#Covid_19,1239989690427674624,https://twitter.com/maitemontalvog/status/1239989690427674624
2020-03-17 18:57:30,LAMARCEMORA,elconfidencial,0,0,0," Excelente reportaje! Aprendamos de los errores y de los logros de otros! #Covid_19 #coronavirus",,,#Covid_19 #coronavirus,1239989253251227648,https://twitter.com/LAMARCEMORA/status/1239989253251227648
2020-03-17 18:44:23,SESEIB_Ec,,0,0,0,"La Secretaría de Educación Intercultural Bilingüe emite la Resolucion Nº 10 referente a lineamientos y medidas de precaución ante la expansión del virus COVID-19. Por lo que dispone el Teletrabajo. RESOLUCIÓN https://bit.ly/3bfgldp",,,,1239985951486730240,https://twitter.com/SESEIB_Ec/status/1239985951486730240
2020-03-17 18:37:05,WilliamDavilaB,,1,2,11,"Guste o no hay que guardarse, hay que combatir la curva ascendente de contagio . Lo de @LoroHomero ha sido drástico pero necesario en la capital. Tomemos consciencia, dejemos en otro lado las disputas políticas y colaboremos todos . #QuédateEnLaCasa #Covid_19 #coronavirusec",,@LoroHomero,#Qu #Covid_19 #coronavirusec,1239984117179129858,https://twitter.com/WilliamDavilaB/status/1239984117179129858
2020-03-17 18:25:26,SantiagoZMD,,1,0,2," INFORMACIÓN #Covid_19 ¿Qué quiere decir “contacto cercano”? Quiere decir haber cuidado o vivido con alguien infectado con #coronavirus o haber tenido contacto directo con las secreciones respiratorias o los fluidos corporales de un paciente con #COVID19",,,#Covid_19 #coronavirus #COVID19,1239981185398439936,https://twitter.com/SantiagoZMD/status/1239981185398439936
2020-03-17 18:20:07,FERBUSTAMANTEG,,0,10,6,"#ALERTA PRUEBA DE #coronavirusec Si es ordenada por un médico público(MSP): costo máximo $80 Si es ordenada por un médico privado: costo máximo $120 Son gratuitas si el médico, por el protocolo indispensables, la hace @Salud_Ec expedirá tarifario para test #Covid_19",,@Salud_Ec,#ALERTA #coronavirusec #Covid_19,1239979846698237958,https://twitter.com/FERBUSTAMANTEG/status/1239979846698237958
2020-03-17 18:19:29,ortegajorgeluis,,0,0,0,"Este sería el tipo penal por el que la @FiscaliaEcuador podría procesar a quienes incumplan las disposiciones de las autoridades. Pero más allá de la sanción se consciente #QuedateEnLaCasa que el #Covid_19 no es una simple gripe. https://twitter.com/teleamazonasec/status/1239973485041999876",,@FiscaliaEcuador,#QuedateEnLaCasa #Covid_19,1239979687062929410,https://twitter.com/ortegajorgeluis/status/1239979687062929410
2020-03-17 18:14:25,GioFray,chrisviteri,1,0,1,"Deber del Estado velar por todos,en caso emergencia sanitaria, por el que tiene por el qu no, el MSP, es un nuevo iess, les están dando cotas para después de 15 días, para hacerle la prueba del covid 19, en caso de que el Sr del call center decide si es o no un posible caso.",,,,1239978410451054592,https://twitter.com/GioFray/status/1239978410451054592
2020-03-17 18:02:15,mashinancyg,,1,15,15,"de pacientes con #Covid_19 demostrando un elevado nivel de efectividad. En crisis epidemiológica el Ministerio de Salud y Estado no pueden continuar con la misma política de bloqueo con Cuba q evita el acceso a estos medicamentos pues eso solo abonará a la crisis @MashiRafael @",,@MashiRafael,#Covid_19,1239975351012306956,https://twitter.com/mashinancyg/status/1239975351012306956
2020-03-17 17:49:55,jp_cordova,EstebanOrtizMD,1,5,9,"Yo hice seguimiento; y, desde el viernes 13 hasta hoy 17 de marzo han incrementado 13.846 casos en Italia. Remito capturas. Fuente: Covid-19 Tracker App ",,,,1239972244618543105,https://twitter.com/jp_cordova/status/1239972244618543105
2020-03-17 17:43:50,AccesoriosBliss,teleamazonasec,0,0,0,"Varios comerciantes viven el día a dia... un día sin trabajo es un día sin comer... Todos estamos con el #QuedateEnLaCasa pero se requiere medidas sociales y económicas más coherentes con la realidad #Covid_19 #Ecuador",,,#QuedateEnLaCasa #Covid_19 #Ecuador,1239970715505283072,https://twitter.com/AccesoriosBliss/status/1239970715505283072
2020-03-17 17:40:44,inamhi,,0,3,7,"#QuédateEnCasa​ | Mientras dure el #EstadoDeExcepción​, estarán cerrados los servicios públicos, excepto los de salud, seguridad, servicio de riesgos y aquellos que deban funcionar por la emergencia. #ActivadosPorLaSalud #CoronavirusEc #Covid_19 ",,,#Qu #EstadoDeExcepci #ActivadosPorLaSalud #CoronavirusEc #Covid_19,1239969934257479681,https://twitter.com/inamhi/status/1239969934257479681
2020-03-17 17:35:29,TSongForZula,TSongForZula,4,1,2,"Comente este tuit con las frases más pendejas que ha dejado el Coronavirus #Covid_19 ",,,#Covid_19,1239968613370490880,https://twitter.com/TSongForZula/status/1239968613370490880
2020-03-17 17:28:09,coberdigital,,0,4,5,"Piensa antes de linchar #Covid_19 #Covid19ec Cada vez que estes tentado a juzgar sin comprobar o por lo menos ten la responsabilidad de acceder al otro lado de la historia #PiensaAnteDePublicar en tiempos de #CoronaVirus #FakeNews",,,#Covid_19 #Covid19ec #PiensaAnteDePublicar #CoronaVirus #FakeNews,1239966768212267010,https://twitter.com/coberdigital/status/1239966768212267010
2020-03-17 17:26:06,gisella_bayona,,9,13,55,"En entrevistas con Vicepresidente @ottosonnenh “De un día al otro se duplicaron los casos de covid-19, el riesgo es exponencial. Quienes no acaten las restricciones podrían ir a la cárcel de 1 a 3 años”. @fmmundo #CuarentenaNacional #QuedateEnLaCasa",,@ottosonnenh @fmmundo,#CuarentenaNacional #QuedateEnLaCasa,1239966251314589697,https://twitter.com/gisella_bayona/status/1239966251314589697
2020-03-17 17:20:20,mocavarea,EcuadorTV,1,1,3," No digan “socializar” no significa lo que ustedes creen. Digan informar, anunciar, avisar, comunicar, notificar. No acaben con el idioma, ni en tiempos de #Covid_19",,,#Covid_19,1239964800790085634,https://twitter.com/mocavarea/status/1239964800790085634
2020-03-17 17:19:46,diegojpozo,,0,0,0,"@MinTrabajoEc es legal adelantar vacaciones en este caso de la cuarentena por el covid 19, o dejar de cancelar los salarios por estos días?",,@MinTrabajoEc,,1239964659836305408,https://twitter.com/diegojpozo/status/1239964659836305408
2020-03-17 17:15:44,cjaramillo88,,0,1,2,"Ahora resulta que todos ustedes se creen “Sector Estratégico” (?) #COVID19 #coronavirusec",,,#COVID19 #coronavirusec,1239963644093280259,https://twitter.com/cjaramillo88/status/1239963644093280259
2020-03-17 17:05:33,patriciovimos88,,0,0,1,"Al menos le brindamos un respiro al planeta, lo único bueno que puedo decir de esta pandemia. #COVID2019 #COVID19",,,#COVID2019 #COVID19,1239961078316044289,https://twitter.com/patriciovimos88/status/1239961078316044289
2020-03-17 17:04:55,PanasJorgeYunda,,35,124,358,"El sentido de colaboración y la solidaridad caracterizan a los quiteños. Con las medidas implementadas se salvan miles de vidas y evitamos la expansión del #Covid_19 #QuitoEnCasa Fotos: @ECU911_",,@ECU911_,#Covid_19 #QuitoEnCasa,1239960918840291328,https://twitter.com/PanasJorgeYunda/status/1239960918840291328
2020-03-17 17:04:31,VasconezNelson,babadmerchan,0,1,1,"Hay q tener cuidado cuándo las autoridades no se ponen d acuerdo @babadmerchan la idiosincrasia d nuestro pueblo amerita medidas extremas para evitar contagio,el COVID19 ya circula en la comunidad.Reactivar la movilidad pero con cautela ya q podría dispararse la curva epidémica ",,@babadmerchan,,1239960820135624710,https://twitter.com/VasconezNelson/status/1239960820135624710
