date,username,to,replies,retweets,favorites,text,geo,mentions,hashtags,id,permalink
2020-03-16 00:59:39,MariaEl51613621,,0,0,0,"@MSPEcuador Hay un caso sospechoso de COVID 19 en Loja tomaron la muestra a paciente, y porque se envían a Cuenca y luego a Guayaquil ????? Eso es atención oportuna???? En emergencia sanitaria?",,@MSPEcuador,,1239355617476857862,https://twitter.com/MariaEl51613621/status/1239355617476857862
2020-03-16 00:50:41,LoloMino,,2,23,60,"Qué lástima vivir en un país donde la venganza política es más importante que la salud de todos. Hoy @CJudicaturaEc y la @CorteNacional nos han expuesto a todos a más contagio de #Covid_19. Solidaridad con los colegas que mañana deben cumplir con esta orden absurda.",,@CJudicaturaEc @CorteNacional,#Covid_19,1239353358898597891,https://twitter.com/LoloMino/status/1239353358898597891
2020-03-16 00:46:06,pattyhidal,,0,2,8,"Si la interfaz es una “red de actores humanos, institucionales y tecnológicos que están interconectados y mantienen diferentes tipos de relaciones”, podríamos decir que el COVID-19 es un actor, el más disruptivo, de una compleja trama socio-tecnológica.. ",,,,1239352207474077697,https://twitter.com/pattyhidal/status/1239352207474077697
2020-03-16 00:45:32,mmagus1,jaimeclown,0,0,0,"En verdad @DouglasTRANZAS perdiste ya no creo en ti. Seguro que alguien de tu cercanía tendrá covid19 .... ahi veremos. ",,@DouglasTRANZAS,,1239352062724517889,https://twitter.com/mmagus1/status/1239352062724517889
2020-03-16 00:42:26,Salud_CZ9,,0,8,4,"#Quito || Es el momento de estar en casa y aprovechar de la familia, son las palabras firmes de @DrSergioMeraSn1 coordinador @Salud_CZ9, pidiéndole a la ciudadana la colaboración para prevenir la expansión de #COVID19 #SaludParaTodos #YoMeQuedoEnMiCasa",,@DrSergioMeraSn1 @Salud_CZ9,#Quito #COVID19 #SaludParaTodos #YoMeQuedoEnMiCasa,1239351282785271809,https://twitter.com/Salud_CZ9/status/1239351282785271809
2020-03-16 00:40:04,Salud_CZ9,,0,5,7,"#Quito || @DrSergioMeraSn1 coordinador @Salud_CZ9 se dirige a la ciudadanía por @TVCElComercioTv tratando el tema #COVID19, donde resalta el trabajo preventivo que se está realizando en el país #SaludParaTodos",,@DrSergioMeraSn1 @Salud_CZ9 @TVCElComercioTv,#Quito #COVID19 #SaludParaTodos,1239350687328321538,https://twitter.com/Salud_CZ9/status/1239350687328321538
2020-03-16 00:34:40,CruzPichincha,,0,6,6,"Si seguimos las recomendaciones con responsabilidad, superaremos la situación con la menor cantidad de casos de #COVID19. #QuédateEnCasa",,,#COVID19 #Qu,1239349330127044609,https://twitter.com/CruzPichincha/status/1239349330127044609
2020-03-15 23:47:07,Khontas,,0,0,2,"La Dulce Espera en Tiempos de Covid19! Estamos a pocos días de conocer a mi pequeño y Ayer me preguntaba: Qué propósitos tendrá Dios con traer a este niño #CharlieDavid en estos momentos… https://www.instagram.com/p/B9xfPhPg1f2ZJD7DizhvDgN6CGYf1mRaUfh5RY0/?igshid=o9ssoma1d55b",,,#CharlieDavid,1239337361688997888,https://twitter.com/Khontas/status/1239337361688997888
2020-03-15 23:42:42,Falionheart,,0,0,0,"Así estaríamos si no fuera por el #covid_19 ! . . . #celtictrip #celtaes #celtic #uio #quito #ecuador #kilt #band #latincelticband en Quito, Ecuador https://www.instagram.com/p/B9xevKggXik/?igshid=t23r4g4c3k9a",,,#covid_19 #celtictrip #celtaes #celtic #uio #quito #ecuador #kilt #band #latincelticband,1239336250273914881,https://twitter.com/Falionheart/status/1239336250273914881
2020-03-15 23:23:00,GuevaraYulissa,drexlerjorge,0,0,0,"Si, gracias y por favor #YoMeQuedoEnMiCasa #quedatencasa #Covid_19 ",,,#YoMeQuedoEnMiCasa #quedatencasa #Covid_19,1239331292019376129,https://twitter.com/GuevaraYulissa/status/1239331292019376129
2020-03-15 23:17:39,DannyValle_,,1,1,1,"Era lógico que la gente fuese a Ipiales a arrasar con los que pueden y después dicen que piensan en la economía? es tan dificil cerrar la frontera ? Quien los asesora el dinero o la irresponsabilidad ? @ottosonnenh @Lenin @mariapaularomo #Covid_19 #COVID19ec #YoMeQuedoEnMiCasa",,@ottosonnenh @Lenin @mariapaularomo,#Covid_19 #COVID19ec #YoMeQuedoEnMiCasa,1239329947979845633,https://twitter.com/DannyValle_/status/1239329947979845633
2020-03-15 23:17:35,EstebanOrtizMD,,119,443,1655,"La autoridad sanitaria y la vicepresidencia junto a las más altas autoridades del Ecuador nos han recibido y escuchando a unos 20 colegas de todas las áreas del conocimiento, vamos horas reunidos y desde la academia hemos sugerido lineamientos sobre #covid19 para #aplanarlacurva",,,#covid19 #aplanarlacurva,1239329928065232896,https://twitter.com/EstebanOrtizMD/status/1239329928065232896
2020-03-15 23:17:00,ByronLima,,0,0,0,"Alejandro #Sanz en Vivo #LaGiraSeQuedaEnCasa https://youtu.be/LlWWT-eKOwU #Covid_19",,,#Sanz #LaGiraSeQuedaEnCasa #Covid_19,1239329782799753217,https://twitter.com/ByronLima/status/1239329782799753217
2020-03-15 23:10:57,YomiMoreiraL,,0,0,0,"Enfrentar esta emergencia es un simple ejercicio de #CoRresponsabilidad. #QuédateEnCasa #Ecuador #PrevenciónEsSalud #COVID19ec #COVID19 ",,,#CoRresponsabilidad #Qu #Ecuador #Prevenci #COVID19ec #COVID19,1239328260070223874,https://twitter.com/YomiMoreiraL/status/1239328260070223874
2020-03-15 23:10:42,GuevaraYulissa,,0,0,0,"Aguacero nivel Dios #Ecuador #YoMeQuedoEnCasa #quedatencasa #coronavirusec #Covid_19 ",,,#Ecuador #YoMeQuedoEnCasa #quedatencasa #coronavirusec #Covid_19,1239328195943464960,https://twitter.com/GuevaraYulissa/status/1239328195943464960
2020-03-15 23:10:27,YomiMoreiraL,,1,0,1,"#COVID19ec | Una buena forma de ilustrar la importancia de moverse lo menos posible en el entorno, para disminuir la velocidad y el número de contagios. #QuédateEnCasa #PrevenciónEsSalud #COVID19 ",,,#COVID19ec #Qu #Prevenci #COVID19,1239328133356101633,https://twitter.com/YomiMoreiraL/status/1239328133356101633
2020-03-15 22:59:58,MunicipioQuito,,2,5,8,"¡La prevención es la clave en el #Covid_19! Cada 3 horas es importante que te hidrates, de preferencia con agua. #QuitoSaludableOtraVez",,,#Covid_19 #QuitoSaludableOtraVez,1239325496476864513,https://twitter.com/MunicipioQuito/status/1239325496476864513
2020-03-15 22:47:36,_sheilamichelle,,0,0,0,"Centros comerciales repletos. En camino para hacer compras en Buses con destino a la playa. Y luego: el Sistema de Salud falla, el gobierno no hace nada. A Ecuador le falta una dosis de realismo en vez de tanto pendejo sacando memes. #covid19 #covid19ecuador #COVID19ec",,,#covid19 #covid19ecuador #COVID19ec,1239322382067814400,https://twitter.com/_sheilamichelle/status/1239322382067814400
2020-03-15 22:38:50,mgalarzalanas,,1,5,19,"Los que ejercemos en materia penal necesitamos que urgente el @CJudicaturaEc dé un lineamiento claro sobre las audiencias fijadas para esta semana. Como todos los ecuatorianos debemos contribuir a que el Covid-19 no se propague y eso es quedándonos en casa. Esto es serio...",,@CJudicaturaEc,,1239320177159942144,https://twitter.com/mgalarzalanas/status/1239320177159942144
2020-03-15 22:30:03,soycarlosguia,JaviTannhauser,0,2,4,"Excelente descripción gráfica de la curva del #Covid_19 #covid19ecuador #ULTIMOMINUTO #YoMeQuedoEnCasa #ATENCION #coronavirusperu #CoronavirusEnVenezuela #covid19chile",,,#Covid_19 #covid19ecuador #ULTIMOMINUTO #YoMeQuedoEnCasa #ATENCION #coronavirusperu #CoronavirusEnVenezuela #covid19chile,1239317968112279554,https://twitter.com/soycarlosguia/status/1239317968112279554
2020-03-15 22:29:44,jaky_factos,DeporteEc,0,7,26,"#YoMeQuedoEnCasa Juntos podemos lograrlo #Ecuador y vencer al #Covid_19 ",,,#YoMeQuedoEnCasa #Ecuador #Covid_19,1239317888491806721,https://twitter.com/jaky_factos/status/1239317888491806721
2020-03-15 21:50:35,pachafmquito,,0,0,0,".@aguadequito inició la entrega del compuesto con el que se realizará la desinfección de las unidades de transporte público, según lo dispuesto por el alcalde Dr. Jorge Yunda. Recuerda que prevenir el #COVID19 #EstáEnTusManos. #QuitoSaludableOtraVez",,@aguadequito,#COVID19 #Est #QuitoSaludableOtraVez,1239308035056640011,https://twitter.com/pachafmquito/status/1239308035056640011
2020-03-15 21:50:13,pachafmquito,,2,0,2,".@aguadequito inició la entrega del compuesto con el que se realizará la desinfección de las unidades de transporte público, según lo dispuesto por el alcalde Dr. Jorge Yunda. Recuerda que prevenir el #COVID19 #EstáEnTusManos. #QuitoSaludableOtraVez",,@aguadequito,#COVID19 #Est #QuitoSaludableOtraVez,1239307943012716545,https://twitter.com/pachafmquito/status/1239307943012716545
2020-03-15 21:42:17,pachafmquito,,0,2,4,"¡Juntos enfrentamos el #COVID19! Necesitamos demostrar disciplina y compromiso social para evitar su propagación. Contamos contigo. #QuédateEnCasa #EstáEnTusManos",,,#COVID19 #Qu #Est,1239305945680920579,https://twitter.com/pachafmquito/status/1239305945680920579
2020-03-15 21:27:15,maurimun,,0,1,3,"Algunas medidas Gobierno de España ante COVID19: aplazamiento de deudas tributarias, plazos procesales (excepto algunos casos penales), suspensión de plazos de prescripción y caducidad, apoyo $al turismo y aplazamiento reembolso préstamos pymes. @pfvillegas @ottosonnenh @Lenin",,@pfvillegas @ottosonnenh @Lenin,,1239302163584692225,https://twitter.com/maurimun/status/1239302163584692225
2020-03-15 21:27:11,fredd_jara,gyllenpresley,0,0,0,"@Eminem trascendental. Toma eso #Covid_19 ",,@Eminem,#Covid_19,1239302147105263617,https://twitter.com/fredd_jara/status/1239302147105263617
2020-03-15 21:13:14,Mateofloresm,,2,12,39,"Después de que pase toda esta dura situación de la pandemia del #Covid_19, todos los países del mundo deberíamos unirnos para exigirle a los EE.UU le quite el criminal bloqueo económico a #Cuba. Gracias a la medicina cubana, la humanidad va a sobrevivir.",,,#Covid_19 #Cuba,1239298635461992449,https://twitter.com/Mateofloresm/status/1239298635461992449
2020-03-15 21:09:27,verorivadeneira,lcvelez,0,0,0,"Aplica para todos los viajeros sobre todo quienes llegaron de países de alta circulación de Covid-19 ",,,,1239297682579038215,https://twitter.com/verorivadeneira/status/1239297682579038215
2020-03-15 21:08:45,Salud_CZ9,,1,2,2,"#ActivadosPorLaSalud | Cualquier persona que niegue, limite u obstaculice el servicio de salud será sancionada con todo el rigor de la Ley. Esto garantizará brindar atención médica oportuna a posibles casos con #COVID19. #CoronavirusEcuador #Covid19Ecuador",,,#ActivadosPorLaSalud #COVID19 #CoronavirusEcuador #Covid19Ecuador,1239297505675948038,https://twitter.com/Salud_CZ9/status/1239297505675948038
2020-03-15 21:03:32,CruzPichincha,,0,12,17,"Seamos responsables para frenar la expansión del COVID-19. #QuédateEnCasa",,,#Qu,1239296194947538950,https://twitter.com/CruzPichincha/status/1239296194947538950
2020-03-15 20:59:44,Sr_Gino,,0,0,3,"…me gusta tu foto de perfil, promoviendo la protección y prevención contra el virus #Covid_19 @mjco2302…",,@mjco2302,#Covid_19,1239295239438860289,https://twitter.com/Sr_Gino/status/1239295239438860289
2020-03-15 20:52:18,soycarlosguia,DenisCosnard,0,2,5,"Descripción gráfica de cómo podemos desde la responsabilidad individual detener al #COVID_19 #covid19ecuador #YoMeQuedoEnCasa #quedateEnTuCasa #quedateencasa",,,#COVID_19 #covid19ecuador #YoMeQuedoEnCasa #quedateEnTuCasa #quedateencasa,1239293366875099136,https://twitter.com/soycarlosguia/status/1239293366875099136
2020-03-15 20:27:53,pachafmquito,,0,0,2,"MEDIDAS #COVID19 | Las personas que usan sillas de ruedas deben mantener aislamiento voluntario para evitar contagios. #EstáEnTusManos #QuédateEnCasa",,,#COVID19 #Est #Qu,1239287223582969859,https://twitter.com/pachafmquito/status/1239287223582969859
2020-03-15 20:26:40,pachafmquito,,0,1,0,"¡La prevención es la clave en el #Covid_19! Cada 3 horas es importante que te hidrates, de preferencia con agua. #QuitoSaludableOtraVez",,,#Covid_19 #QuitoSaludableOtraVez,1239286917553893376,https://twitter.com/pachafmquito/status/1239286917553893376
2020-03-15 20:23:36,pachafmquito,,0,0,1,"Toma en cuenta que el aislamiento social es la mejor manera de prevenir la propagación del #COVID19. Cuida a quienes usan sillas de ruedas porque son más propensos a contagios. #QuédateEnCasa #EstáEnTusManos",,,#COVID19 #Qu #Est,1239286147269955584,https://twitter.com/pachafmquito/status/1239286147269955584
2020-03-15 20:21:59,pachafmquito,,0,0,0,"Hoy #PensandoEnTi se une a la programación especial sobre el #COVID19 en #PachaFm, para hablar sobre las acciones que debemos tomar en este tiempo de aislamiento social tan importante para evitar el contagio. Somos #LaRadioDeLaCiudad #QuédateEnCasa",,,#PensandoEnTi #COVID19 #PachaFm #LaRadioDeLaCiudad #Qu,1239285739013234689,https://twitter.com/pachafmquito/status/1239285739013234689
2020-03-15 20:08:30,GioFray,bbcmundo,0,0,0,"Este artículo sería bueno que leyera don @Lenin @CataAndramuno según este artículo en Italia, ya es imposible controlar la pandemia, porque se lo tomaron a la ligera como lo están haciendo aca en Ecuador. A todos nos toca hacer la prueba del covid 19. ",,@Lenin @CataAndramuno,,1239282344940515331,https://twitter.com/GioFray/status/1239282344940515331
2020-03-15 19:22:42,JorgeDavidV10,,0,1,1,"¡ ATENCIÓN! En #Mexico también se suspende la #LigaMX y #AsensoMX, hasta nuevo aviso. Esta decisión se toma para evitar la propagación del coronavirus (#Covid_19) 15/3/20 ",,,#Mexico #LigaMX #AsensoMX #Covid_19,1239270820708581378,https://twitter.com/JorgeDavidV10/status/1239270820708581378
2020-03-15 19:15:30,Salud_CZ9,,0,3,6,"#Quito|| Personal del centro de salud Amaguaña Distrito 17D08 en conjunto con el GAD parroquial realizan actividades de prevención de enfermedades respiratorias frente al #COVID19, a los usuarios y trabajadores del mercado central de la parroquia #PrevenciónEsSalud.",,,#Quito #COVID19 #Prevenci,1239269009117364225,https://twitter.com/Salud_CZ9/status/1239269009117364225
2020-03-15 19:02:17,soycarlosguia,,0,0,0,"Información importante sobre los hipertensos y el #COVID_19 ",,,#COVID_19,1239265680207286272,https://twitter.com/soycarlosguia/status/1239265680207286272
2020-03-15 18:58:04,BeatrizHLeon,,0,1,3,"La aplaudida respuesta de Klopp sobre el coronavirus https://youtu.be/rxeMSpYlMyg vía @YouTube Hay autoridades que deben responder las dudas sobre #COVID19. Médicos, profesores que estudian microbiologia, epidemiologia e inmunidad pueden contestar mejor que famosos de cualquier área.",,@YouTube,#COVID19,1239264620348674052,https://twitter.com/BeatrizHLeon/status/1239264620348674052
2020-03-15 18:47:12,datalat,,0,2,6,"Si buscan los documentos e información actualizada en #Ecuador respecto a #covid19ecuador #CoronavirusEnEcuador #COVID19 Revisen la web oficial https://coronavirusecuador.com/",,,#Ecuador #covid19ecuador #CoronavirusEnEcuador #COVID19,1239261885884780551,https://twitter.com/datalat/status/1239261885884780551
2020-03-15 18:44:55,CanalRTU,,0,3,7," [#ATENCIÓN] La empresa pública de Agua Potable NO realizará suspensiones del servicio por falta de pago para evitar posibles exposiciones al contagio del #COVID19, cómo parte de las medidas preventivas de la ciudad de #Quito.",,,#ATENCI #COVID19 #Quito,1239261312275951624,https://twitter.com/CanalRTU/status/1239261312275951624
2020-03-15 18:37:34,DrPediatra,,0,0,4,"Esta semana pudimos compartir información con la comunidad del barrio Quito Tenis acerca del COVID-19 y cómo prevenirlo. ",,,,1239259462545924099,https://twitter.com/DrPediatra/status/1239259462545924099
2020-03-15 18:32:32,schumyn,,0,1,1,"Tiempos de #COVID19 #CoronavirusEnEcuador. Día 2 de #quedateEnTuCasa",,,#COVID19 #CoronavirusEnEcuador #quedateEnTuCasa,1239258195606081536,https://twitter.com/schumyn/status/1239258195606081536
2020-03-15 18:24:54,alvarofreile91,,0,0,0,"Previniendo el #COVID19 ",,,#COVID19,1239256271590744066,https://twitter.com/alvarofreile91/status/1239256271590744066
2020-03-15 18:18:27,FCOMHemisferios,,0,2,2,"Mira en nuestro IGTV el mensaje del Rector @DiegoAJaramillo ante el periodo de Emergencia Sanitaria COVID-19: https://www.instagram.com/tv/B9u7h4mAUDS/?igshid=1jis790bb4o6m",,@DiegoAJaramillo,,1239254652178313216,https://twitter.com/FCOMHemisferios/status/1239254652178313216
2020-03-15 18:11:02,MunicipioQuito,,2,14,17,"MEDIDAS #COVID19 | Las personas que usan sillas de ruedas deben mantener aislamiento voluntario para evitar contagios. #EstáEnTusManos #QuédateEnCasa",,,#COVID19 #Est #Qu,1239252785222352896,https://twitter.com/MunicipioQuito/status/1239252785222352896
2020-03-15 18:00:02,NicoSumiller,,0,0,0,"Los que deben estar contentos son los Testigos de Jehova !! Saben que estamos en nuestras casas... #cuarentena #coronavirusecuador #covid19",,,#cuarentena #coronavirusecuador #covid19,1239250014398013441,https://twitter.com/NicoSumiller/status/1239250014398013441
2020-03-15 17:58:53,schumyn,MoniVelasquezV,0,0,0,"Esto es apoyar a esfuerzo del trabajador en tiempos de crisis. #COVID19 #coronavirud #CoronavirusESP",,,#COVID19 #coronavirud #CoronavirusESP,1239249726622621698,https://twitter.com/schumyn/status/1239249726622621698
2020-03-15 17:53:10,pachafmquito,,1,2,0,"Evitar el contagio de #COVID19 es sencillo: lava tus manos cada 3 horas, evita aglomeraciones, no viajes, no toques tu rostro y sobre todo #QuédateEnCasa. #EstáEnTusManos",,,#COVID19 #Qu #Est,1239248287464652800,https://twitter.com/pachafmquito/status/1239248287464652800
2020-03-15 17:37:35,EstebanOrtizMD,,54,548,941,"Gente querida del Ecuador, a lo realmente importante existen más casos de #covid19 en Ecuador, fui a la farmacia y me encontré con mucha más gente de la que necesitamos en las calles, Minos lactantes entrando a lugares concurridos entiendan ESTO NO ES UN JUEGO #quedatencasa",,,#covid19 #quedatencasa,1239244366134247424,https://twitter.com/EstebanOrtizMD/status/1239244366134247424
2020-03-15 17:34:52,ObrasPublicasEc,,0,85,70,"#PrevenciónEsSalud | Cumpliendo con los protocolos de vigilancia epidemiológica, frente a la emergencia sanitaria por el #COVID19 damos a conocer las medidas de prevención dispuestas en todos los puertos del país. ",,,#Prevenci #COVID19,1239243680176898048,https://twitter.com/ObrasPublicasEc/status/1239243680176898048
2020-03-15 17:31:05,CruzPichincha,,0,3,3,"Protegernos del COVID-19 es una responsabilidad de todas y todos. Toma en cuenta estas recomendaciones #QuédateEnCasa",,,#Qu,1239242727914713091,https://twitter.com/CruzPichincha/status/1239242727914713091
2020-03-15 17:24:14,juanflores18,,0,4,1,"#ÚltimaHora || Suben a (37) los casos positivos de #Coronavirus en el #Ecuador Se distribuyen así en todo el país 19 #Guayas • 10 #LosRíos • 6 #Pichincha • 1 #Azuay • 1 #Sucumbios #CoronavirusEnEcuador #COVID19 ",,,#Coronavirus #Ecuador #Guayas #LosR #Pichincha #Azuay #Sucumbios #CoronavirusEnEcuador #COVID19,1239241007901880321,https://twitter.com/juanflores18/status/1239241007901880321
2020-03-15 17:17:57,bb00cc11,,0,0,0,"Aumentan a 37 los casos de coronavirus COVID-19 en Ecuador ",,,,1239239422899617793,https://twitter.com/bb00cc11/status/1239239422899617793
2020-03-15 17:01:22,MunicipioQuito,,0,4,5,"#EstáEnTusManos cuidarte a ti y a los tuyos del #Covid_19. Cada 3 horas lava tus manos con agua y jabón por al menos 20 segundos. #QuitoSaludableOtraVez",,,#Est #Covid_19 #QuitoSaludableOtraVez,1239235251039285256,https://twitter.com/MunicipioQuito/status/1239235251039285256
2020-03-15 16:48:16,Juano_Rodriguez,Riesgos_Ec,0,0,1,"#Atención ascienden a 37 los casos confirmados por covid-19 en Ecuador ",,,#Atenci,1239231956082180099,https://twitter.com/Juano_Rodriguez/status/1239231956082180099
2020-03-15 15:59:28,schumyn,QHaRi,0,0,1,"Hola a todos Soy el #coronavirus #COVID19 ",,,#coronavirus #COVID19,1239219673138421761,https://twitter.com/schumyn/status/1239219673138421761
2020-03-15 15:58:07,schumyn,lopezandres,0,0,1,"#CuarentenaCoronavirus #PelotaDeLetras #COVID19 Una forma más para pasarla bien ",,,#CuarentenaCoronavirus #PelotaDeLetras #COVID19,1239219332594520069,https://twitter.com/schumyn/status/1239219332594520069
2020-03-15 15:51:55,radiolacalle,,0,18,8,"#LaCalleEnEmergencia Laboratorios cobran desde USD 200 por prueba de Covid-19 — Radio La Calle - https://go.shr.lc/2vr9mi8 vía @radiolacalle",,@radiolacalle,#LaCalleEnEmergencia,1239217772720201732,https://twitter.com/radiolacalle/status/1239217772720201732
2020-03-15 15:46:18,AndreGrijalvaV,,0,0,0,"La economía y política del país están fracturadas, mientras el #COVID19 agrava aún más la crisis. ¿Cómo enfrenta Ecuador esta crisis? ¿Escenario para oportunistas en época pre electoral?",,,#COVID19,1239216360787509250,https://twitter.com/AndreGrijalvaV/status/1239216360787509250
2020-03-15 15:44:03,SrMatico,,0,0,0,"Estimado @EstebanOrtizMD me llego un audio del virologo argentino Pablo Goldschmidt, el comenta que el #COVID19 es una exageración y que no es más que una neumonía normal. Quisiera conocer tu apreciación del tema. Te envío el artículo. Gracias ",,@EstebanOrtizMD,#COVID19,1239215793910493184,https://twitter.com/SrMatico/status/1239215793910493184
2020-03-15 15:06:08,CruzPichincha,,0,4,6,"Todos podemos colaborar para evitar la expansión del COVID-19, toma en cuenta estas recomendaciones. #QuédateEnCasa",,,#Qu,1239206252888162304,https://twitter.com/CruzPichincha/status/1239206252888162304
2020-03-15 14:51:21,Randyacevedob,,0,0,1,"Ojalá le de COVID-19 a todas las feminazis locas que andan haciendo espectáculos denigrando a la mujer. Así como también a todos los comunistas y socialistas del mundo. Un virus para limpiar el mundo de tanta mierda humana.",,,,1239202530590105600,https://twitter.com/Randyacevedob/status/1239202530590105600
2020-03-15 14:46:30,AveCaicedo,,0,16,19,"Todos listos para avanzar clases y proyectos desde nuestros hogares. Quedémonos en casa para evitar la propagación de la COVID-19 @e_teran_ec @PhDenEcuador @USFQ_Ecuador @USFQ_COCIBA @IMUSFQ @CientificasEC",,@e_teran_ec @PhDenEcuador @USFQ_Ecuador @USFQ_COCIBA @IMUSFQ @CientificasEC,,1239201309695369219,https://twitter.com/AveCaicedo/status/1239201309695369219
2020-03-15 14:38:39,patriciovimos88,,0,0,0,"Lo mejor de quedarse en casa por el #covid19ecuador #COVID19 es que estoy con mis padres.",,,#covid19ecuador #COVID19,1239199334991900672,https://twitter.com/patriciovimos88/status/1239199334991900672
2020-03-15 14:28:02,pachafmquito,,0,0,0,"#QuédateEnCasa | ¡Evita aglomeraciones! Recuerda que se realizan controles en la ciudad a fin de que se cumpla la declaratoria de emergencia sanitaria y los establecimientos nocturnos se mantengan cerrados, como medida preventiva frente a #Covid_19. #QuitoSeguroOtraVez",,,#Qu #Covid_19 #QuitoSeguroOtraVez,1239196664981794820,https://twitter.com/pachafmquito/status/1239196664981794820
2020-03-15 14:25:10,Randyacevedob,metro_caracas,0,0,1,"Tenía que llegar el Covid-19 a Vzla para que se dignaran a limpiar. Aunque como a esta gente le encanta vivir de las apariencias para que el mismo crea, doy mis dudas a que todos los vagones del metro hayan sido lavados. ",,,,1239195940877209600,https://twitter.com/Randyacevedob/status/1239195940877209600
2020-03-15 14:24:14,TapiaDavidF,VidsVirales_Ec,0,1,2,"La falta de educación y de respeto a las leyes, regulaciones y a la autoridad es el principio y el fin de gran parte de los problemas en el país (y en el mundo). Que la emergencia por el #COVID19 sirva para trabajar en mejorar los sistemas de salud, pero sobre todo de EDUCACIÓN. ",,,#COVID19,1239195706226860043,https://twitter.com/TapiaDavidF/status/1239195706226860043
2020-03-15 14:14:40,AldojacmeJacome,,0,0,0,"Tenemos que ser disciplinados, para afrontar el Covid19",,,,1239193301384859648,https://twitter.com/AldojacmeJacome/status/1239193301384859648
2020-03-15 14:09:01,Randyacevedob,peru21noticias,0,0,0,"Con todo este tema del Coronavirus he certificado que la estupidez humana no tiene nada que ver con eso de que ""la gente del primero mundo"" y todo ese mito que llevábamos por años. La estupidez es una pandemia igualita al COVID-19 llega a todo el mundo. ",,,,1239191879742341120,https://twitter.com/Randyacevedob/status/1239191879742341120
2020-03-15 14:01:27,bb00cc11,,0,0,0,"Las cuatro fases del coronavirus COVID-19 ",,,,1239189975977115651,https://twitter.com/bb00cc11/status/1239189975977115651
2020-03-15 13:40:35,pachafmquito,,0,2,1,"#EstáEnTusManos cuidarte a ti y a los tuyos del #Covid_19. Cada 3 horas lava tus manos con agua y jabón por al menos 20 segundos. #QuitoSaludableOtraVez",,,#Est #Covid_19 #QuitoSaludableOtraVez,1239184723420884992,https://twitter.com/pachafmquito/status/1239184723420884992
2020-03-15 13:35:03,Mike_Revelo,,0,0,0,"En , la evolución del número de casos de #Covid_19 ha sido drásticamente menor que en la región. Solo para muestra, el 01/03 en el país había 6 casos y salvo , nadie más registraba data. Hoy, más de 7 países nos superan y en el resto se duplicó en una semana",,,#Covid_19,1239183331771723777,https://twitter.com/Mike_Revelo/status/1239183331771723777
2020-03-15 13:25:40,pachafmquito,,0,3,1,"ATENCIÓN | Identifica los síntomas del coronavirus #COVID19. Llama al 171 en caso de manifestarlos. #QuédateEnCasa #EstáEnTusManos",,,#COVID19 #Qu #Est,1239180968847716352,https://twitter.com/pachafmquito/status/1239180968847716352
2020-03-15 13:21:15,cordova_arauz,ActualidadRT,0,2,2,"Qué oportuno ha sido el aparecimiento del #COVID19; tanto así, que pronto corremos el riesgo de dejar en el buzón de los pendientes temas centrales para la continuidad de nuestra existencia. ",,,#COVID19,1239179859273842691,https://twitter.com/cordova_arauz/status/1239179859273842691
