date,username,to,replies,retweets,favorites,text,geo,mentions,hashtags,id,permalink
2020-03-19 23:52:22,yandunfreddy,,0,2,3," Comité Operativo de Emergencias de Quito 5ta sesión, con todas sus autoridades locales y delegados de instituciones zonales | Seguimos trabajando por la ciudad #Quito | Emergencia #COVID19 #QuedateEnCasa @coequito",,@coequito,#Quito #COVID19 #QuedateEnCasa,1240788235699224579,https://twitter.com/yandunfreddy/status/1240788235699224579
2020-03-19 23:40:10,mabelen_c,zchagoya,1,4,6,"Son nuestros comportamientos los que definen el qué hacer y cómo hacer ante esta situación pero se visibiliza la falta de conciencia en nuestra sociedad. ##DialogusCI #Covid_19",,,#DialogusCI #Covid_19,1240785162390179841,https://twitter.com/mabelen_c/status/1240785162390179841
2020-03-19 23:35:14,LuSuarez1986,cristianviterin,0,0,1,"260 casos confirmados de COVID - 19. Por favor, hermanos ecuatorianos, la resposabilidad de detener el contagio depende sólo de nosotros. #yo_me_quedo_en_casa #Ecuador_emergencia_sanitaria",,,#yo_me_quedo_en_casa #Ecuador_emergencia_sanitaria,1240783920700043264,https://twitter.com/LuSuarez1986/status/1240783920700043264
2020-03-19 23:27:13,mabelen_c,nataliasara2,1,0,3,"Sin duda a otro virus al que nos enfrentamos es de la desinformación, información incompleta-confusa y/o fake news #DialogusCI #covid19",,,#DialogusCI #covid19,1240781906876280834,https://twitter.com/mabelen_c/status/1240781906876280834
2020-03-19 23:22:06,mabelen_c,nataliasara2,1,1,4,"Saludos @nataliasara2, cuales considera son los retos que nos plantea esta crisis? #DialogusCI #Covid_19",,@nataliasara2,#DialogusCI #Covid_19,1240780615957520387,https://twitter.com/mabelen_c/status/1240780615957520387
2020-03-19 23:21:37,taninarte,wilfridolaz,0,0,0,"Atención @CynthiaViteri6 gracias por su oportuna y rápida solución para estas personas #Guayaquil #Covid_19 #Ecuador",,@CynthiaViteri6,#Guayaquil #Covid_19 #Ecuador,1240780496570912768,https://twitter.com/taninarte/status/1240780496570912768
2020-03-19 23:20:59,WilsonMerinoR,,0,18,36,"Para ser fuertes contra el #Covid_19 tenemos que estar juntos. Inscríbete como #VoluntarioVirtual y colabora desde tu casa. http://bit.ly/2WgTdqp #QuédateEnLaCasa",,,#Covid_19 #VoluntarioVirtual #Qu,1240780336080044037,https://twitter.com/WilsonMerinoR/status/1240780336080044037
2020-03-19 22:43:21,Salud_CZ9,,0,6,9,"#Quito| Personal del centro de salud Llano Chico Distrito 17D02 atiende a la Comunidad con síntomas respiratorios, cumpliendo con medidas de Bioseguridad y prevención, reforzando el correcto #LavadoDeManos para prevenir el #COVID19 #PrevencionEsSalud #QuedateEnCasa",,,#Quito #LavadoDeManos #COVID19 #PrevencionEsSalud #QuedateEnCasa,1240770864443994114,https://twitter.com/Salud_CZ9/status/1240770864443994114
2020-03-19 22:41:44,ChecheCamp,,0,3,3,"#NoMeBotesNoContagio Le pedimos a los medios de comunicación que sean más responsables con los contenidos. No necesitamos abandonos, necesitamos que nos ayuden a protegerlos. La @opsoms dice que no hay evidencia alguna que perros y gatos se contagien de #Covid_19 y lo transmitan. ",,@opsoms,#NoMeBotesNoContagio #Covid_19,1240770459408490497,https://twitter.com/ChecheCamp/status/1240770459408490497
2020-03-19 22:40:27,Salud_CZ9,,0,8,10,"#Quito|| En el centro de salud Colinas del Norte Distrito 17D03 se brinda atención oportuna para pacientes con síntomas respiratorios y se mantienen activas las charlas educativas y preventiva en base al #COVID19 y el correcto #LavadoDeManos #QuédateEnCasa #SaludParaTodos",,,#Quito #COVID19 #LavadoDeManos #Qu #SaludParaTodos,1240770136845549568,https://twitter.com/Salud_CZ9/status/1240770136845549568
2020-03-19 22:40:15,ChecheCamp,,0,1,0,"#NoMeBotesNoContagio Le pedimos a los medios de comunicación que sean más responsables con los contenidos. No necesitamos abandonos, necesitamos que nos ayuden a protegerlos. La @opsoms dice que no hay evidencia alguna que perros y gatos se contagien de #Covid_19 y lo transmitan. ",,@opsoms,#NoMeBotesNoContagio #Covid_19,1240770087063347202,https://twitter.com/ChecheCamp/status/1240770087063347202
2020-03-19 22:39:28,ChecheCamp,,0,2,1,"#NoMeBotesNoContagio Le pedimos a los medios de comunicación que sean más responsables con los contenidos. No necesitamos abandonos, necesitamos que nos ayuden a protegerlos. La @opsoms dice que no hay evidencia alguna que perros y gatos se contagien de #Covid_19 y lo transmitan. ",,@opsoms,#NoMeBotesNoContagio #Covid_19,1240769889037664258,https://twitter.com/ChecheCamp/status/1240769889037664258
2020-03-19 22:38:43,ChecheCamp,,0,3,2,"#NoMeBotesNoContagio Le pedimos a los medios de comunicación que sean más responsables con los contenidos. No necesitamos abandonos, necesitamos que nos ayuden a protegerlos. La @opsoms dice que no hay evidencia alguna que perros y gatos se contagien de #Covid_19 ",,@opsoms,#NoMeBotesNoContagio #Covid_19,1240769698326818816,https://twitter.com/ChecheCamp/status/1240769698326818816
2020-03-19 22:37:38,ChecheCamp,,0,5,3,"#NoMeBotesNoContagio La OMS indica que no hay evidencias científicas de que los animales padezcan el Covid-19 ni que lo puedan transmitir. #NoMeBotesNoContagio",,,#NoMeBotesNoContagio #NoMeBotesNoContagio,1240769426221383681,https://twitter.com/ChecheCamp/status/1240769426221383681
2020-03-19 22:36:43,ChecheCamp,,0,6,3,"#NoMeBotesNoContagio La OMS indica que no hay evidencias científicas de que los animales padezcan el Covid-19 ni que lo puedan transmitir. #NoMeBotesNoContagio @LoroHomero @PanasJorgeYunda @AnimalGuar @MartaEstebanM",,@LoroHomero @PanasJorgeYunda @AnimalGuar @MartaEstebanM,#NoMeBotesNoContagio #NoMeBotesNoContagio,1240769196738392066,https://twitter.com/ChecheCamp/status/1240769196738392066
2020-03-19 22:34:10,ursureyesgiler,,0,2,1,"#NoMeBotesNoContagio No abandones a tus perros y gatos, ellos NO transmiten el #Covid_19 Aprovecha este tiempo en casa para pasar tiempo de calidad con ellos. #COVID19Ecuador",,,#NoMeBotesNoContagio #Covid_19 #COVID19Ecuador,1240768554091380740,https://twitter.com/ursureyesgiler/status/1240768554091380740
2020-03-19 22:28:08,topicster,topicster,0,0,1," Infografía EN AUSENCIA DE UNA VACUNA PARA EL CORONAVIRUS, ¿QUÉ PASARÍA EN UN FUTURO NO TAN LEJANO? Basado en el último reporte #COVID19 de @imperialcollege que forzó a EEUU y a UK a tomar acciones. Por @paolasaenzc, @ZulmaCucunuba, y @Latamsoc.",,@imperialcollege @paolasaenzc @ZulmaCucunuba @Latamsoc,#COVID19,1240767038420914176,https://twitter.com/topicster/status/1240767038420914176
2020-03-19 22:28:03,ursureyesgiler,,0,3,1,"#NoMeBotesNoContagio No abandones a tus perros y gatos, ellos NO transmiten el #Covid_19 Aprovecha este tiempo en casa para pasar tiempo de calidad con ellos. #COVID19Ecuador",,,#NoMeBotesNoContagio #Covid_19 #COVID19Ecuador,1240767016904069123,https://twitter.com/ursureyesgiler/status/1240767016904069123
2020-03-19 22:24:58,soycarlosguia,,0,0,1,"Quién iba a pensar que un pequeño aletear de un murciélago en China, traería tanto dolor y sufrimiento a la humanidad. #covid_19 #HoyQueTienesTiempo #COVID2019ec #QuedateEnCasa #URGENTE #YoMeQuedoEnCasa #Covid_19 #covid19peru #CuarentenaTotal #quedateEnTuCasa",,,#covid_19 #HoyQueTienesTiempo #COVID2019ec #QuedateEnCasa #URGENTE #YoMeQuedoEnCasa #Covid_19 #covid19peru #CuarentenaTotal #quedateEnTuCasa,1240766241100398592,https://twitter.com/soycarlosguia/status/1240766241100398592
2020-03-19 22:21:11,ursureyesgiler,teleSURtv,0,0,0,"En #Colombia es más restrictiva la justicia constitucional. #Covid_19 ",,,#Colombia #Covid_19,1240765285738729472,https://twitter.com/ursureyesgiler/status/1240765285738729472
2020-03-19 22:19:04,MunicipioQuito,,2,14,41,"2800 efectivos del Municipio de Quito vigilan el cumplimiento de las medidas dispuestas por el Alcalde Jorge Yunda respecto a la limitación de movilidad en la capital para prevenir contagios de #COVID19. #ConMedidasSalvamosVidas #QuédateEnCasa",,,#COVID19 #ConMedidasSalvamosVidas #Qu,1240764756555894785,https://twitter.com/MunicipioQuito/status/1240764756555894785
2020-03-19 22:07:47,amapolanaranjo,,1,3,7," Estamos en Vivo Sigue el #FacebookLive de Radio Los Chillos Online para escuchar un programa nuevo #ArteYCulturaConAmapola #QuedateEnLaCasa y disfruta de la música nuestra en esta crítica época con la llegada del #COVID19 a nuestro #Ecuador ",,,#FacebookLive #ArteYCulturaConAmapola #QuedateEnLaCasa #COVID19 #Ecuador,1240761915074383874,https://twitter.com/amapolanaranjo/status/1240761915074383874
2020-03-19 22:01:34,favio_almeida,,0,56,42,"#NoMeBotesNoContagio los animales domésticos no son transmisores del #Covid_19 ",,,#NoMeBotesNoContagio #Covid_19,1240760352465399808,https://twitter.com/favio_almeida/status/1240760352465399808
2020-03-19 22:01:25,Salud_CZ9,,0,3,6,"#Quito|| Dar información y educar a nuestros usuarios es parte importante en la prevención del #COVID19, en el centro de salud Atahualpa Distrito 17D03 se preparó la cartelera con información importante y se mantienen las charlas educativas. #PrevenciónEsSalud #QuédateEnCasa",,,#Quito #COVID19 #Prevenci #Qu,1240760313181605888,https://twitter.com/Salud_CZ9/status/1240760313181605888
2020-03-19 21:56:56,patriciovimos88,,1,0,0,"Hay que morir como los del Titanic @Juampaordonez #Covid_19 #COVID19ON #COVID19ec",,@Juampaordonez,#Covid_19 #COVID19ON #COVID19ec,1240759184855109633,https://twitter.com/patriciovimos88/status/1240759184855109633
2020-03-19 21:48:32,AnaBelenHerrera,,0,1,0,"#ACTUALIZACION | situación actual en nuestro país #Covid_19 #COVID19ec #QuedateEnCasa",,,#ACTUALIZACION #Covid_19 #COVID19ec #QuedateEnCasa,1240757070753906691,https://twitter.com/AnaBelenHerrera/status/1240757070753906691
2020-03-19 21:45:29,cucomitae73,,0,1,2,"¡¡¡Los Ecuatorianos somos responsables!!! #QuédateEnTuCasa y cierra la puerta al #Covid_19, por ti y tus seres queridos. No lo olvides. ¡¡¡Unidad del Pueblo para defender la Vida!!! #CuarentenaYA",,,#Qu #Covid_19 #CuarentenaYA,1240756304987258881,https://twitter.com/cucomitae73/status/1240756304987258881
2020-03-19 21:40:55,EcosdeRuminahui,,1,0,0,"Jueves 19 marzo 2020 - 16:30 | Informe actualizado de la emergencia sanitaria provocada por el #COVID19 en Ecuador ",,,#COVID19,1240755152392458244,https://twitter.com/EcosdeRuminahui/status/1240755152392458244
2020-03-19 21:37:34,AndreGrijalvaV,,0,9,13,"Casos #covid19 USA 13,304 Canada 804 Brazil 621 Chile 346 Ecuador 260 Perú 234 México 118 Panamá 109 Colombia 108 Argentina 97 Costa Rica 87 Uruguay 79 Venezuela 42 ",,,#covid19,1240754309928812544,https://twitter.com/AndreGrijalvaV/status/1240754309928812544
2020-03-19 21:36:12,Rogelioecheve,JocBermeo17,0,1,7,"En muchos países lo hacen gratis. Ahora más q nunca se necesita q los recursos sean utilizados en el sistema de salud. Preocupémonos por asegurar que el personal sanitario tenga a su alcance los implementos para el protocolo de atención ante el #Covid_19 @Lenin @juanfervelasco",,@Lenin @juanfervelasco,#Covid_19,1240753965916135424,https://twitter.com/Rogelioecheve/status/1240753965916135424
2020-03-19 21:33:22,IESSPensiones,,0,0,0,"Recuerda, cuidar en casa de los más pequeños; enseñándoles normas prevención del COVID -19, como el adecuado lavado de manos. @PaulGranda #QuédateEnCasa",,@PaulGranda,#Qu,1240753254633480194,https://twitter.com/IESSPensiones/status/1240753254633480194
2020-03-19 21:33:17,DavidGarcia9287,Ma_AleCevallos,0,0,1,"Con ese dinero podrian cubrir tantas cosas de primera necesidad ejemplo: pruebas del covid-19, mascarillas, medicinas y alimentos para los mas necesitados... ",,,,1240753234697994242,https://twitter.com/DavidGarcia9287/status/1240753234697994242
2020-03-19 21:31:59,maitemontalvog,,0,1,3,"Aumentan las cifras de infectados de #Covid_19 en #Ecuador. Se confirman 260 casos, 4 personas fallecidas y 3 personas se han recuperado. La provincia que registra más contagiados es Guayas con 187 casos. Por favor infórmense en canales oficiales #QuedateEnCasa",,,#Covid_19 #Ecuador #QuedateEnCasa,1240752905516392453,https://twitter.com/maitemontalvog/status/1240752905516392453
2020-03-19 21:30:56,taninarte,MunicipioQuito,0,1,4,"Qué bella es mi ciudad y sin tráfico mucho mejor... mi lindo #Quito #Quédateencasa #Guayaquil #Covid_19 #Ecuador",,,#Quito #Qu #Guayaquil #Covid_19 #Ecuador,1240752642558775298,https://twitter.com/taninarte/status/1240752642558775298
2020-03-19 21:29:18,dlfc1314,COVID19_TIME,0,0,0,"Mil disculpas a nuestros hermanos españoles. La alcaldesa cometió una imprudencia que de ninguna manera representa el sentir de todos los ecuatorianos.",,,,1240752230116085761,https://twitter.com/dlfc1314/status/1240752230116085761
2020-03-19 21:28:51,yali_loaiza,,4,3,2," En la provincia de #Loja hay un total de 4 casos confirmados de #Covid_19: - 1 en Calvas - 1 en Macará - 2 en Loja Guayas es el lugar con mayor contagios: 187 hasta esta tarde ",,,#Loja #Covid_19,1240752118006525954,https://twitter.com/yali_loaiza/status/1240752118006525954
2020-03-19 21:27:22,carozuritalagos,Riesgos_Ec,0,0,0,"Es fundamental que nos quedemos en casa . En Guayas la situación está difícil, debemos hacer caso de las recomendaciones. Yo me cuido y te cuido a ti y a todxs. #QuedateEnCasa #URGENTE #19Mar #CuarentenaObligatoria #Covid_19 ",,,#QuedateEnCasa #URGENTE #19Mar #CuarentenaObligatoria #Covid_19,1240751745749471234,https://twitter.com/carozuritalagos/status/1240751745749471234
2020-03-19 21:24:29,MariaBelenArro1,,0,4,1,"Reporte oficial registra #Covid_19 en Imbabura, 4 fallecidos, 260 casos confirmados @revistavistazo https://twitter.com/MariaBelenArro1/status/1240742797189296128",,@revistavistazo,#Covid_19,1240751018582978560,https://twitter.com/MariaBelenArro1/status/1240751018582978560
2020-03-19 21:21:31,marioyela,GuillaumeLong,0,0,0,"Ya vería si opinas lo mismo si estuvieras contagiado por el virus #Covid_19 Eres un completo idiota!!! ",,,#Covid_19,1240750271346749442,https://twitter.com/marioyela/status/1240750271346749442
2020-03-19 21:19:41,JuanPaBurbanoS,,0,7,19,"Continúamos con los Operativos de Control de las medidas de prevención y protección, de los establecimientos y la ciudadanía, ante la emergencia sanitaria, por el #CoVid19. ¡Por ti, por tu familia, por un #QuitoSaludableOtraVez!",,,#CoVid19 #QuitoSaludableOtraVez,1240749811554451459,https://twitter.com/JuanPaBurbanoS/status/1240749811554451459
2020-03-19 21:13:45,merhaymar,LoroHomero,0,1,1,"Sr.Alcalde. Por favor,no permita el ingreso de nadie (peor contaminados) por ninguna vía ni aérea ni terrestre La aparición del COVID-19 es desde el mes de diciembre 2019.Por lo tanto es una insensatez haber viajado al exterior por motivo d turismo Debieron posponer los viajes ",,,,1240748316427722753,https://twitter.com/merhaymar/status/1240748316427722753
2020-03-19 21:11:52,csolorzano3,,1,5,13,"Nos encontramos en la sesión virtual con los miembros del #CAL, a fin de tratar los procedimientos para la implementación de las sesiones virtuales y el teletrabajo emergente en la @AsambleaEcuador ¡Nuestro trabajando continúa, juntos contrarrestaremos al #COVID19! ",,@AsambleaEcuador,#CAL #COVID19,1240747845109665792,https://twitter.com/csolorzano3/status/1240747845109665792
2020-03-19 21:11:52,quezadacoba,elcomerciocom,0,0,0,"260 personas con #Covid_19 Enel Ecuador y sumando. #QuedateEnCasa",,,#Covid_19 #QuedateEnCasa,1240747841972207630,https://twitter.com/quezadacoba/status/1240747841972207630
2020-03-19 21:10:53,RC_MACHADO182,,2,6,25,"Tres personas contagiadas de Covid - 19 en nuestro país ya se recuperaron, ",,,,1240747596072865793,https://twitter.com/RC_MACHADO182/status/1240747596072865793
2020-03-19 21:10:36,David_Milito,CynthiaViteri6,0,0,0,"No hay nada que probar, a una personas se la cree en lo que dice, más aún con el delicado tema de contraer una enfermedad(covid-19) deseo su pronta recuperación fuera lo político primero está la caridad humana.Fuerza para usted @CynthiaViteri6 y su esposo. #Animo",,@CynthiaViteri6,#Animo,1240747522622205952,https://twitter.com/David_Milito/status/1240747522622205952
2020-03-19 21:10:29,DanielAcostag,,0,4,3," 260 casos de #Covid_19 en #Ecuador , la cifra sigue en aumento. @ucsg_tv",,@ucsg_tv,#Covid_19 #Ecuador,1240747496407695361,https://twitter.com/DanielAcostag/status/1240747496407695361
2020-03-19 21:10:11,Victorvergara7,,0,1,0,"Además, las cifras de casos positivos por #Covid_19 aumentan a 260 y se confirma la muerte de una cuarta persona, que residía en Manabí, una adulta mayor, sin relación con el caso primario. #QuedateEnCasa",,,#Covid_19 #QuedateEnCasa,1240747419123490817,https://twitter.com/Victorvergara7/status/1240747419123490817
2020-03-19 21:09:42,Juano_Rodriguez,,1,0,0,"#ACTUALIZACION Directora del Servicio Nacional de Gestión de Riesgos @alexocles acaba de anunciar que son 260 casos confirmados por covid-19 en el país. Además 4 personas fallecidas y 3 recuperados.",,@alexocles,#ACTUALIZACION,1240747298935758854,https://twitter.com/Juano_Rodriguez/status/1240747298935758854
2020-03-19 21:09:29,Sebas_Machado,,0,0,2,"260 casos confirmado, 4 fallecidos. Los últimos datos en Ecuador #Covid_19",,,#Covid_19,1240747245147996160,https://twitter.com/Sebas_Machado/status/1240747245147996160
2020-03-19 21:08:03,Victorvergara7,,2,1,1,"#Ahora Ecuador reporta a las primeras tres personas recuperadas del #Covid_19. Ellos pertenecían al círculo primario del primer caso detectado. ""Van a permanecer todavía en cuidados"", dijo @alexocles en cadena nacional #QuedateEnCasa",,@alexocles,#Ahora #Covid_19 #QuedateEnCasa,1240746881665425411,https://twitter.com/Victorvergara7/status/1240746881665425411
2020-03-19 21:05:15,vhugosanta,,0,0,0,"#URGENTE | Confirmado el primer caso de #COVID19 en Ibarra ,el paciente llegó procedente de Guayaquil. Trabaja en el aeropuerto José Joaquin de Olmedo. &gt;&gt;&gt; http://bit.ly/2xNYSKl Fuente : Hoy en Imbabura",,,#URGENTE #COVID19,1240746179182366728,https://twitter.com/vhugosanta/status/1240746179182366728
2020-03-19 21:03:36,pachafmquito,,0,0,1,"Aprovecha el tiempo con tu perro en casa, el está acompañándote en tu cuarentena, recuerda que los perros no transmiten Covid-19 a humanos. #QuédateEnCasa",,,#Qu,1240745762692239361,https://twitter.com/pachafmquito/status/1240745762692239361
2020-03-19 21:02:43,ModelsCamCoach,,9,4,8,"Chi@s los q quieran unirse a mi grupo de WhatsApp o Snapchat digan yo Fotos vídeo diarios chat calientes hot xxx y derecho a una videollamada x suscripción escriban al MD está libre los leo No Te Aburras en esta cuarentena suscríbete #Covid_19 #QuedateEnCasa",,,#Covid_19 #QuedateEnCasa,1240745542394753039,https://twitter.com/ModelsCamCoach/status/1240745542394753039
2020-03-19 21:01:22,UNFPAecuador,,0,1,7," Conoce y toma acción para prevenir el #covid19 Conócelo Prepárate Actúa . . . . . . . #ops #salud #prevención #coronavirus #onu #unfpa #who #un #vida #health",,,#covid19 #ops #salud #prevenci #coronavirus #onu #unfpa #who #un #vida #health,1240745200307318790,https://twitter.com/UNFPAecuador/status/1240745200307318790
2020-03-19 20:42:52,Salud_CZ9,,0,5,8,"#Quito|| El personal del Centro de Salud Corazón de Jesús Distrito 17D03 trabajando al 100% en atención a la población con síntomas respiratorios, y reforzando las charlas educativas contra el #COVID19 #QuédateEnCasa #SaludParaTodos #PrevenciónEsSalud",,,#Quito #COVID19 #Qu #SaludParaTodos #Prevenci,1240740544336277520,https://twitter.com/Salud_CZ9/status/1240740544336277520
2020-03-19 20:31:07,amapolanaranjo,,0,16,19,"He solicitado a @SoberaniaAN participar en su Sesión 36 por videoconferencia. Me preocupa las relaciones diplomáticas y planes de contingencia que nuestro país posee para pracutelar la salud de compatriotas en otros países, ante la crisis mundial producida por el #Covid_19. ",,@SoberaniaAN,#Covid_19,1240737586936774658,https://twitter.com/amapolanaranjo/status/1240737586936774658
2020-03-19 20:26:47,IAENUniversidad,,0,3,5,"El docente de la Escuela de Economía Pública del #NuevoIAEN, @pochunlee, analizó el tema del #Covid19 y su afectación en la economía mundial.Escuche la entrevista completa en Radio Visión en el siguiente link https://bit.ly/3bbjmuY #coronavirus #IAENUniversidad #CovidEconomía",,@pochunlee,#NuevoIAEN #Covid19 #coronavirus #IAENUniversidad #CovidEconom,1240736497667584001,https://twitter.com/IAENUniversidad/status/1240736497667584001
2020-03-19 20:21:55,hmi_Ec,GuillaumeLong,0,0,0,"Lamentable lo que está ocurriendo con la salud de la alcaldesa de #Guayaquil -lamentablemente queda en tela de duda sí ha contraído el #Covid_19- sin embargo, deberá responder ante la justicia por lo ocurrido en el aeropuerto. #QuedateEnCasa #COVID2019ec",,,#Guayaquil #Covid_19 #QuedateEnCasa #COVID2019ec,1240735274302427136,https://twitter.com/hmi_Ec/status/1240735274302427136
2020-03-19 20:03:39,VSylva,luisevivanco,0,0,0,"Es puro cuento que tiene Covid19 nadie a demostrado clínicamente positivo, se cree intocable como tiene todo el respaldo del TRAIDOR DE MORENO no hay autoridades que estén sobre está mujer prepotente, pronto saldrá a informar fue un error los resultados y todo queda en el olvido ",,,,1240730675810009088,https://twitter.com/VSylva/status/1240730675810009088
2020-03-19 20:02:58,hmi_Ec,MashiRafael,0,0,1,"Lamentable lo que está ocurriendo con la salud de la alcaldesa de #Guayaquil -lamentablemente queda en tela de duda sí ha contraído el #Covid_19- sin embargo, deberá responder ante la justicia por lo ocurrido en el aeropuerto. #QuedateEnCasa #COVID2019ec",,,#Guayaquil #Covid_19 #QuedateEnCasa #COVID2019ec,1240730502195281921,https://twitter.com/hmi_Ec/status/1240730502195281921
2020-03-19 19:52:20,csolorzano3,,1,2,12,"Hacemos uso de las herramientas tecnológicas para mantenernos informados y seguir trabajando en equipo. El teletrabajo es una medida responsable para evitar la propagación del #COVID19 ¡Por ti, por mi y por el país #YoMeQuedoEnCasa!",,,#COVID19 #YoMeQuedoEnCasa,1240727826455805953,https://twitter.com/csolorzano3/status/1240727826455805953
2020-03-19 19:50:20,soynorris,,0,0,0,"Tesla y Ferrari-Fiat se unen a la fabricación de ventiladores #Covid_19 #YoMeQuedoEnCasa #coronavirus",,,#Covid_19 #YoMeQuedoEnCasa #coronavirus,1240727323336478727,https://twitter.com/soynorris/status/1240727323336478727
2020-03-19 19:50:02,hmi_Ec,,0,1,5,"Lamentable lo que está ocurriendo con la salud de la alcaldesa de #Guayaquil - lamentablemente queda en tela de duda sí ha contraído el #Covid_19- sin embargo, deberá responder ante la justicia por lo ocurrido en el aeropuerto. #QuedateEnCasa #COVID2019ec",,,#Guayaquil #Covid_19 #QuedateEnCasa #COVID2019ec,1240727250267488256,https://twitter.com/hmi_Ec/status/1240727250267488256
2020-03-19 19:36:58,MunicipioQuito,,2,5,15,"¡La prevención es la clave en el #COVID19! Cada 3 horas es importante que te hidrates, de preferencia con agua. #EstáEnTusManos",,,#COVID19 #Est,1240723960154730497,https://twitter.com/MunicipioQuito/status/1240723960154730497
2020-03-19 19:30:42,xicasanovac,,0,2,4,"Deberíamos preguntarnos si las políticas de austeridad han contribuido a la propagación del #Covid_19. La crisis que hoy afrontamos, favorece al análisis profundo de la necesidad de incrementar las políticas sociales por sobre la agresiva desregularizacion de los mercados. ",,,#Covid_19,1240722382031138816,https://twitter.com/xicasanovac/status/1240722382031138816
2020-03-19 19:19:59,EnriqueRoseroC,augustotandazo,0,0,0,"Las pretensiones neoliberales no cesan ni por el #Covid_19 ",,,#Covid_19,1240719685592780806,https://twitter.com/EnriqueRoseroC/status/1240719685592780806
2020-03-19 19:18:22,vhugosanta,,0,0,0,"Se espera un pronunciamiento a las 15:00 del COE cantonal para hablar sobre el caso sospechoso de #COVID19 en la provincia de Imbabura. #COVID2019ec",,,#COVID19 #COVID2019ec,1240719281404272641,https://twitter.com/vhugosanta/status/1240719281404272641
2020-03-19 19:16:05,EnriqueRoseroC,LOTHBROK777,0,0,0,"Hasta que el #Covid_19 los contagie los encontrará muertos y bien muertos... ",,,#Covid_19,1240718705077760001,https://twitter.com/EnriqueRoseroC/status/1240718705077760001
2020-03-19 19:13:39,MunicipioQuito,,1,9,10,"Con nuestro aislamiento evitamos la propagación del #COVID19. Si en tu hogar existe alguna persona vulnerable, cuida su salud y mantente atento a sus necesidades. #ConMedidasSalvamosVidas",,,#COVID19 #ConMedidasSalvamosVidas,1240718093023956997,https://twitter.com/MunicipioQuito/status/1240718093023956997
2020-03-19 19:12:52,SanderMcx,,0,0,0,"Guambra alhaja, quédate en tu casa y dentro de mi poncho. #QuedateEnCasa #Covid_19 #YoMeQuedoEnCasa",,,#QuedateEnCasa #Covid_19 #YoMeQuedoEnCasa,1240717897376333824,https://twitter.com/SanderMcx/status/1240717897376333824
2020-03-19 19:09:46,EnriqueRoseroC,,0,0,1,"La presidenta transitoria de Bolivia rechaza ayuda sobre #Covid19 de Cuba https://republicadelbanano.com/2020/03/19/la-presidenta-transitoria-de-bolivia-rechaza-ayuda-sobre-covid19-de-cuba/ vía @PrensaDelBanano",,@PrensaDelBanano,#Covid19,1240717115516227586,https://twitter.com/EnriqueRoseroC/status/1240717115516227586
2020-03-19 19:09:02,MundoDeporEC,,0,1,0,"Iván Vallejo. ""Hoy tenemos que trabajar para poder llegar a la meta y vencer a ese #Covid_19"" #QuedateEnCasa",,,#Covid_19 #QuedateEnCasa,1240716932786974720,https://twitter.com/MundoDeporEC/status/1240716932786974720
2020-03-19 19:06:58,MundoDeporEC,,0,1,2,"Iván Vallejo. ""Este es un proyecto de país y queremos frenar al #Covid_19.. Todos queremos un fin común"" #QuedateEnCasa #Covid_19",,,#Covid_19 #QuedateEnCasa #Covid_19,1240716411988631554,https://twitter.com/MundoDeporEC/status/1240716411988631554
