date,username,to,replies,retweets,favorites,text,geo,mentions,hashtags,id,permalink
2020-03-16 04:17:46,otrejo28,,0,0,0,"Para el COVID-19 aún no hay tratamientos, vacunas o curas. Varios países e institutos especializados están estudiando este virus y han realizado algunos avances. Por ahora, la prevención es la clave. #CoronavirusEnVenezuela",,,#CoronavirusEnVenezuela,1239405474627362817,https://twitter.com/otrejo28/status/1239405474627362817
2020-03-16 04:17:34,otrejo28,,0,0,0,"El COVID-19 es un virus cuyo contagio es sumamente rápido y tiene un período de incubación de 7 a 15 días en promedio y luego sus síntomas empiezan a aparecer: la fiebre, la tos seca y los problemas respiratorios. #CoronavirusEnVenezuela",,,#CoronavirusEnVenezuela,1239405424794886144,https://twitter.com/otrejo28/status/1239405424794886144
2020-03-16 04:17:05,otrejo28,,0,0,0,"Los síntomas de la enfermedad asociada al coronavirus, denominada COVID-19, son: infección de vías respiratorias, tos seca, fiebre y puede empeorar hacia una insuficiencia respiratoria aguda y/o neumonías potencialmente mortales. #CoronavirusEnVenezuela",,,#CoronavirusEnVenezuela,1239405300567998464,https://twitter.com/otrejo28/status/1239405300567998464
2020-03-16 04:16:51,otrejo28,,0,0,0,"Mantener al menos 1,5 metros de distancia con respecto a las demás personas, evitar tocarte ojos, nariz y boca. Evitar ingerir productos animales crudos o poco cocinados. Si observas alguno de los síntomas del COVID-19, consulta inmediatamente a tu médico. #CoronavirusEnVenezuela",,,#CoronavirusEnVenezuela,1239405244116860928,https://twitter.com/otrejo28/status/1239405244116860928
2020-03-16 03:56:52,zona925fm,,0,1,0,"#radiolazona te invita a seguir recomendaciones #nosalirdetucasa Sintonizanos a través de http://www.grupozonafm.com.ve en estos momentos estamos presentando falla en un equipos de trasmisión, ya el personal técnico está trabajando para reactivar nuestra señal 92.5 FM, #covid19 #SAA",,,#radiolazona #nosalirdetucasa #covid19 #SAA,1239400212944302083,https://twitter.com/zona925fm/status/1239400212944302083
2020-03-16 03:51:45,lorenag76,,0,0,1,"Mi Mamá y mi Papá están en ese grupo en altísimo riesgo por el COVID-19. Si yo me contagio seguramente no me pasará nada pero si los contagio ellos podrían morir. No saldré cuidaré de mi familia.",,,,1239398926479958016,https://twitter.com/lorenag76/status/1239398926479958016
2020-03-16 03:03:55,PrensaFANB,,0,68,54," || GJ @vladimirpadrino: ""Siete estados van a ser objeto de una cuarentena colectiva, para un estricto control ejercido por la #FANB en conjunto con la @0800POLINAC, dando cumplimiento a lo ordenado por el CJ @NicolasMaduro, y tomando acciones contundentes contra el Covid-19"" ",,@vladimirpadrino @0800POLINAC @NicolasMaduro,#FANB,1239386887615381504,https://twitter.com/PrensaFANB/status/1239386887615381504
2020-03-16 02:40:24,Nenascre,,0,0,0,"Sanidad afirma que no hay ningún dato que vincule el ibuprofeno a los casos graves de COVID-19 via @el_pais #quédateEnCasa",,@el_pais,#qu,1239380971071422466,https://twitter.com/Nenascre/status/1239380971071422466
2020-03-16 02:01:50,Novohotelexpres,,0,0,1,"Con casos confirmados de #Covid19 en nuestro país, es importante conocer la diferencia de síntomas. - En caso de presentar alguno de estos síntomas debes comunicarte con las autoridades competentes. - ""POR TI, POR TU FAMILIA, TOMA PREVENCIONES"" – at Novo Hotel Express",,,#Covid19,1239371264927707136,https://twitter.com/Novohotelexpres/status/1239371264927707136
2020-03-16 02:00:38,MylDisenos,,0,0,0,"#Repost @DrJoselitTorres (with report.for.insta) ... Si tienes alguna pregunta estoy a tu orden. #coronavirus #covid19 #pandemia #OMS #prevencion en Caracas https://www.instagram.com/p/B9xuhTbBoSo/?igshid=o8ekygbgbylc",,@DrJoselitTorres,#Repost #coronavirus #covid19 #pandemia #OMS #prevencion,1239370963445219333,https://twitter.com/MylDisenos/status/1239370963445219333
2020-03-16 01:54:36,gmartinezmolina,,0,0,0,"RT @Econ_Vzla: No. dias en alcanzar más de 15 casos confirmados de COVID19 desde el primer caso: Francia: 35 días España: 28 días UK: 28 días Italia: 24 días Alemania: 16 días EE.UU.: 15 días Venezuela: 3 días",,@Econ_Vzla,,1239369443358187523,https://twitter.com/gmartinezmolina/status/1239369443358187523
2020-03-16 01:53:09,somosducolsa,,0,0,0,"Como parte del trabajo que lleva a cabo la Comisión Presidencial para el abordaje del Covid-19 arriba a Venezuela delegación técnica especializada procedente de la hermana República de Cuba, y el creador del medicamento Interferón. – at Centro Residencial Bucare",,,,1239369080131457028,https://twitter.com/somosducolsa/status/1239369080131457028
2020-03-16 01:52:35,MylDisenos,,0,0,0,"#Repost @DrJoselitTorres (with report.for.insta) ... Si tienes alguna pregunta estoy a tu orden. #coronavirus #covid19 #pandemia #OMS #prevencion en Caracas https://www.instagram.com/p/B9xtmOahMav/?igshid=1c9hcuwbfhb7s",,@DrJoselitTorres,#Repost #coronavirus #covid19 #pandemia #OMS #prevencion,1239368937114042368,https://twitter.com/MylDisenos/status/1239368937114042368
2020-03-16 01:45:50,yosoypacheco_,,0,3,3,"Como parte del trabajo que lleva a cabo la Comisión Presidencial para el abordaje del Covid-19 arriba a Venezuela delegación técnica especializada procedente de la hermana República de Cuba, y el creador del… https://www.instagram.com/p/B9xs06rhFDB/?igshid=n04wa1extwgf",,,,1239367236642463744,https://twitter.com/yosoypacheco_/status/1239367236642463744
2020-03-16 01:38:16,SomosMovilnet_,,31,50,47,"#Movilnet se suma a la lucha contra el #Covid-19. Nuestras Oficinas Comerciales estarán cerradas temporalmente, para proteger la salud de clientes, trabajadores y población en general.Invitamos a los clientes a usar los canales de atención no presencial #CuarentenaCoronavirus",,,#Movilnet #Covid #CuarentenaCoronavirus,1239365335758843904,https://twitter.com/SomosMovilnet_/status/1239365335758843904
2020-03-16 01:37:40,elrecreocc,,0,0,1,"COMUNICADO . Estimados Aliados Comerciales y Visitantes, en virtud de la responsabilidad que nos corresponde y ante la contingencia generada por el coronavirus COVID - 19, consideramos conveniente anunciar que a… https://www.instagram.com/p/B9xr5NBH9Er/?igshid=1ptakhltys5xb",,,,1239365183191093248,https://twitter.com/elrecreocc/status/1239365183191093248
2020-03-16 01:35:10,JosueMadriz,,0,0,0,"Gobierno comunitario del cuadrante P-16 del municipio Zamora realizó jornada de salud para evaluar y descartar posibles casos de Covid-19 en las comunidades, todos los diagnósticos dieron negativo. #QuedateEnLaCasa #YoMeQuedoEnCasa #CoronavirusEnVenezuela @NicolasMaduro",,@NicolasMaduro,#QuedateEnLaCasa #YoMeQuedoEnCasa #CoronavirusEnVenezuela,1239364554913714179,https://twitter.com/JosueMadriz/status/1239364554913714179
2020-03-16 01:30:12,dj_cesar,,0,0,0,"Ojalá pase rápido en #Caracas el tema del #Covid_19 #covid19venezuela Para que en #Baruta se aboquen y reparen el semáforo en el #PaseoEnriqueEraso frente a la torre #LaNoria es muy importante y tiene mucho tiempo dañado; los conductores en ambos sentidos son irresponsables.",,,#Caracas #Covid_19 #covid19venezuela #Baruta #PaseoEnriqueEraso #LaNoria,1239363302867771393,https://twitter.com/dj_cesar/status/1239363302867771393
2020-03-16 00:56:30,Irisdefranca,,1,9,5,"Señores, debemos quedarnos en casa. Es por nosotros, por nuestra familia, por nuestros hijos. Por favor! Seamos conscientes, aprendamos de la experiencia de Italia y España. Entendamos que aquí sería mucho más grave que suban exponencialmente los casos de COVID-19 #quedatenecasa",,,#quedatenecasa,1239354820760199168,https://twitter.com/Irisdefranca/status/1239354820760199168
2020-03-16 00:56:08,BelistRamirez,,0,0,0,"Evitemos salir de casa para reducir la propagación del virus #covid_19 Las citas serán reprogramadas una vez salgamos de está contingencia. Prudencia y calma, tome todas las medidas de higiene recomendadas… https://www.instagram.com/p/B9xnI51p37M/?igshid=gtx2w2c5zs7q",,,#covid_19,1239354729114861568,https://twitter.com/BelistRamirez/status/1239354729114861568
2020-03-16 00:40:06,mtereperez,,0,0,1,"Perdón es Covid 19",,,,1239350697134604289,https://twitter.com/mtereperez/status/1239350697134604289
2020-03-16 00:38:02,Rodolfo_Javier_,ReporteYa,0,0,0,"Déjenlo tranquilo que de sus misas. Lo único es que a esa edad el COVID-19 no lo va a pelar. #CoronavirusEnVenezuela #CuarentenaCoronavirus #COVIDー19",,,#CoronavirusEnVenezuela #CuarentenaCoronavirus #COVID,1239350174914416641,https://twitter.com/Rodolfo_Javier_/status/1239350174914416641
2020-03-16 00:28:33,Irisdefranca,victoramaya,0,0,0,"Es momento como dices, de atender la emergencia... Después volvamos a nuestra lucha, pero hoy la lucha es vencer el COVID-19, esa es la única prioridad... Y debe hacerse al costo que sea. Se trata de la humanidad!",,,,1239347788435148800,https://twitter.com/Irisdefranca/status/1239347788435148800
2020-03-16 00:27:03,jdacostae,,0,0,0,"""14 días de cuarentena ayuda a reducir la propagación del covid-19 | El Comercio"" ",,,,1239347412180832256,https://twitter.com/jdacostae/status/1239347412180832256
2020-03-15 23:54:37,PanaNoticias,,0,0,0,"#15MAR || Confirman siete nuevos casos de #Coronavirus en #Venezuela - El presidente de la República, Nicolás Maduro, informó sobre la detección de siete nuevos casos de Coronavirus (COVID-19) en Venezuela,… https://www.instagram.com/p/B9xgGfYHZeb/?igshid=7i95rpau541d",,,#15MAR #Coronavirus #Venezuela,1239339250476371968,https://twitter.com/PanaNoticias/status/1239339250476371968
2020-03-15 23:46:47,Irisdefranca,alexagomez2000,0,0,1,"El coronavirus es el nombre de la familia de virus, que pueden causar varias enfermedades. Este, la sepa actual se denomina COVID-19 el cual es el nombre correcto para identificarlo. Por eso consigues ese nombre en productos, películas, etc.",,,,1239337277374910464,https://twitter.com/Irisdefranca/status/1239337277374910464
2020-03-15 23:39:33,UVOriental,,0,14,25," Aprende con Glendy, nuestra youtuber, a realizar tapabocas casero. ¡Con o sin máquina de coser! #UVOriental #Coronavirus #CoronavirusEnVzla #Covid-19 https://youtu.be/3WYXkvESyoA",,,#UVOriental #Coronavirus #CoronavirusEnVzla #Covid,1239335456019484677,https://twitter.com/UVOriental/status/1239335456019484677
2020-03-15 23:15:16,Ems09dg,,0,0,0,"Es arrecho mi mamá cree más en guaido que en el Covid-19 jajajaja",,,,1239329347108044806,https://twitter.com/Ems09dg/status/1239329347108044806
2020-03-15 23:00:26,AiSawaka,,3,15,8,"El centro evangélico ubicado en la av.principal de Naiguatá Edo. la Guaira, en estos momentos full de gente, todos debemos cumplir las órdenes de nuestro presi @NicolasMaduro estamos en cuarentena por el #COVID-19 alerta @CarneiroPSUV y @Jateranoficial ",,@NicolasMaduro @CarneiroPSUV @Jateranoficial,#COVID,1239325611593814016,https://twitter.com/AiSawaka/status/1239325611593814016
2020-03-15 22:53:57,AiSawaka,,6,46,18,"En Naiguatá Edo. La Guaira en este momento, un centro de Evangélico full de gente caldo de cultivo para el#COVID-19 @CarneiroPSUV @@jateranoficial y la cuarentena qué??? ",,@CarneiroPSUV @Jateranoficial,,1239323983369158656,https://twitter.com/AiSawaka/status/1239323983369158656
2020-03-15 22:45:09,Dra_Guaripete,,0,0,0,"#COVID19 #QuédateEnCasa #CuarentenaEnVenezuela suspendidas temporalmente las consultas de control y las de 1era vez. Algunas quimioterapias también serán temporalmente suspendidas si los casos lo permiten. Sólo… https://www.instagram.com/p/B9xYJy5HGFS/?igshid=1nda6fhlvtxml",,,#COVID19 #Qu #CuarentenaEnVenezuela,1239321769514799104,https://twitter.com/Dra_Guaripete/status/1239321769514799104
2020-03-15 22:43:10,Ermandril1,,0,0,0,"Mucha parafernalia mediatica en China ,por el control del covid 19,pero acaban de decretar nuevamente el cierre de #xiaogan y #Tianmen .@reporte_naranja",,@reporte_naranja,#xiaogan #Tianmen,1239321270069706761,https://twitter.com/Ermandril1/status/1239321270069706761
2020-03-15 22:41:50,Dra_Guaripete,,0,2,1,"#COVID19 #QuédateEnCasa #CuarentenaEnVenezuela suspendidas temporalmente las consultas de control y las de 1era vez. Algunas quimioterapias también serán temporalmente suspendidas si los casos lo permiten. Sólo… https://www.instagram.com/p/B9xXxXej3nR/?igshid=1r1x5tw3832xh",,,#COVID19 #Qu #CuarentenaEnVenezuela,1239320933002813441,https://twitter.com/Dra_Guaripete/status/1239320933002813441
2020-03-15 22:31:23,VeroCostaM,,0,0,0,"A los que compran 30 jabones y potes de antibacterial y vacían los estantes: ¿Sabían que para protegerse del #coronavirus necesitan que las demás personas también se laven las manos? Igualmente, ¿qué tiene que ver el papel higiénico (toalet) con el #Covid_19? #LaGenteYSusCosas",,,#coronavirus #Covid_19 #LaGenteYSusCosas,1239318301785849858,https://twitter.com/VeroCostaM/status/1239318301785849858
2020-03-15 22:26:18,rebelde8a,,0,10,6,"ROMPE LA CADENA DEL VIRUS... ¡QUÉDATE EN TU CASA! @NicolasMaduro @DrodriguezVen @rebelde8a #quedateencasa #quedateEnTuCasa #COVID19 #CoronavirusVzla #CoronavirusEnVenezuela",,@NicolasMaduro @DrodriguezVen @rebelde8a,#quedateencasa #quedateEnTuCasa #COVID19 #CoronavirusVzla #CoronavirusEnVenezuela,1239317023139803144,https://twitter.com/rebelde8a/status/1239317023139803144
2020-03-15 22:25:44,rebelde8a,SoyAranguibel,0,3,0,"ROMPE LA CADENA DEL VIRUS... ¡QUÉDATE EN TU CASA! #quedateencasa #quedateEnTuCasa #COVID19 #CoronavirusVzla #CoronavirusEnVenezuela",,,#quedateencasa #quedateEnTuCasa #COVID19 #CoronavirusVzla #CoronavirusEnVenezuela,1239316879010865154,https://twitter.com/rebelde8a/status/1239316879010865154
2020-03-15 22:23:25,RedOrgBaruta,,1,18,10,"#15DeMarzo ¿cómo cumplir con la norma mínima de higiene del lavado de manos? ¿Si no garantizan el #agua ? ¿Cómo garantizarán la atención de salud ante el #Covid_19 ? Encierro colectivo @HIDROCAPITALca @MPPAAguas @MirandaGob",,@HIDROCAPITALca @MPPAAguas @MirandaGob,#15DeMarzo #agua #Covid_19,1239316300083666944,https://twitter.com/RedOrgBaruta/status/1239316300083666944
2020-03-15 22:13:48,fvbillar,,0,0,0,"Controlar el Coronavirus depende en primera instancia de nosotros mismos. #yomequedoencasa #covid19 en Caracas, D.F., Venezuela https://www.instagram.com/p/B9xURYblaER/?igshid=18lb9jkrr110q",,,#yomequedoencasa #covid19,1239313877600362496,https://twitter.com/fvbillar/status/1239313877600362496
2020-03-15 21:49:47,lisibb,,1,0,0,"Dios nos cuide en cada guardia a todos los profesionales de la salud que nos toca salir y trabajar en esta pandemia #covıd19 en Caracas https://www.instagram.com/p/B9xR0LCjA3Tb048ilSGEELnEoJuOL3d5b91jL00/?igshid=1xav6dwknm1tl",,,#cov,1239307835713953792,https://twitter.com/lisibb/status/1239307835713953792
2020-03-15 21:47:32,lisibb,,0,0,0,"Entiendan coño #covıd19 en Caracas https://www.instagram.com/p/B9xRjhVDMJk-bOHOYYxkNdWXww0L1uHfmfBYac0/?igshid=jq5w728q2mly",,,#cov,1239307268396584965,https://twitter.com/lisibb/status/1239307268396584965
2020-03-15 21:29:04,gomezalvaro,,0,1,0,"Recomendaciones para pacientes Oncologicos crónicos o bajo tratamiento. #covid_19 #oncologia #cancer @gomezalvaro@saludenplay @LHGVenezuela sociedadvenezolanadeoncologia en Caracas https://www.instagram.com/p/B9xPcUiD3pFx9e3g-5_6WTg0FsXdIRSe_fHGa80/?igshid=ej66nw10d83a",,@LHGVenezuela,#covid_19 #oncologia #cancer,1239302619245543430,https://twitter.com/gomezalvaro/status/1239302619245543430
2020-03-15 20:16:35,oleyram,,0,0,1,"Suponíamos q en Vzla se había propagado el covid-19,lo q me arrecha es q el gbno haya ocultado algo tan delicado jugado cn la salud d los Vzlanos.Un día antes d q NM hablara en cadena nac ya ellos tenían conocimiento hace días d + d 200 casos d contagio. Les vale mierda la gente",,,,1239284378955649027,https://twitter.com/oleyram/status/1239284378955649027
2020-03-15 20:00:47,JosueMadriz,,0,1,0,"Para prevenir la transmisión del Covid-19 las mujeres de los gobiernos comunitarios del municipio Zamora se organizan en la producción de tapabocas. #MeQuedoEnCasa #CoronavirusEnVenezuela #GobiernoComunitario @NicolasMaduro @HectoRodriguez",,@NicolasMaduro @HectoRodriguez,#MeQuedoEnCasa #CoronavirusEnVenezuela #GobiernoComunitario,1239280404005298177,https://twitter.com/JosueMadriz/status/1239280404005298177
2020-03-15 19:59:50,RubenRubmyr,,0,0,0,"La clave es la Prevención Reitero el llamado a cumplir con disciplina social las medidas preventivas sanitarias implementadas a nivel nacional para enfrentar el COVID-19. En unidad, con conciencia y en coordinación con la OMS lograremos evitar la propagación de esta Pandemia",,,,1239280164674158592,https://twitter.com/RubenRubmyr/status/1239280164674158592
2020-03-15 19:49:28,BoleitaCenter,,0,0,0,"#BoleitaInforma A partir de este lunes 16 de marzo estaremos cerrados hasta nuevo aviso, cómo medida de prevención del COVID-19. Se mantendrán abiertos solo los comercios de bienes de primera necesidad, en… https://www.instagram.com/p/B9xEC-tHFYM/?igshid=1o3szrkboozzd",,,#BoleitaInforma,1239277555271663616,https://twitter.com/BoleitaCenter/status/1239277555271663616
2020-03-15 19:46:14,suarezjennifer,,0,0,0,"Comunicado oficial de la cancelación (temporal) del concierto de @jerry_rivera en #Caracas. Al resolverse la situación de salud que nos afecta, se dará a conocer nueva fecha #prevencion #covid_19 #yomequedoencasa en… https://www.instagram.com/p/B9xDrLzH3dB/?igshid=1t6g41hpsi8m3",,@jerry_rivera,#Caracas #prevencion #covid_19 #yomequedoencasa,1239276740909969409,https://twitter.com/suarezjennifer/status/1239276740909969409
2020-03-15 19:34:23,Inpsasel_vzla,,1,2,2," INFORMACIÓN DE INTERÉS / La higiene es herramienta fundamental en la prevención y lucha contra el Covid-19, lava tus manos con agua y jabón peridicamente. La Prevención es Tarea de Todos. #InpsaselPrevencionCovid19 @geovannireuma @Gerenciasalud1 @prensaminci",,@geovannireuma @Gerenciasalud1 @prensaminci,#InpsaselPrevencionCovid19,1239273759648989189,https://twitter.com/Inpsasel_vzla/status/1239273759648989189
2020-03-15 19:11:19,DraJennyRomero,,0,0,0,"#pandemia #covid_19 #medicos #coronavirusvenezuela en Caracas, D.F., Venezuela https://www.instagram.com/p/B9w_reIDRFu/?igshid=8yh3f2s7abfd",,,#pandemia #covid_19 #medicos #coronavirusvenezuela,1239267955080298496,https://twitter.com/DraJennyRomero/status/1239267955080298496
2020-03-15 18:59:03,oleyram,,0,0,0,"Bien pendejos son aquellos q siguen creyendo en cuentos d camino.Maduro: hay 46 hosp listos para atender el covid-19, pronto llega la ayuda humanitaria d Cuba y China incluyendo médicos. El gbno no está preparado para emergencias. Cuidemonos nosotros mismos, tomemos precauciones",,,,1239264867619606531,https://twitter.com/oleyram/status/1239264867619606531
2020-03-15 18:46:21,UVOriental,adventistchurch,0,9,28,"La Sede Mundial de la Iglesia Adventista del Séptimo Día pidió a sus empleados que trabajen de forma remota hasta el 30 de marzo como respuesta a la pandemia de COVID-19. ",,,,1239261669647437825,https://twitter.com/UVOriental/status/1239261669647437825
2020-03-15 18:25:24,GoriElsi,beatrizbecerrab,0,0,0,"Me encanta tu comentario, del tiro se les olvidó que habían impuesto ese vocabulario, gracias al Covid 19, que bueno que tú se los estás recordando porque ni ellos mismos se lo creen, solo inventaron ese vacilón para joder y me perdonas la palabra ",,,,1239256399487676416,https://twitter.com/GoriElsi/status/1239256399487676416
2020-03-15 18:25:21,Info_LaGuaira,,0,4,1,"El Pueblo Venezolano debe asumir con mucha conciencia y responsabilidad. Las orientaciónes de prevención es el arma para derrotar el COVID_19 @JuntosPod3mos #EscudoBolivarianoIII2020 @Gabrielasjr @l_larosave @InfoOficialVe @brigadacomuni18",,@JuntosPod3mos @Gabrielasjr @l_larosave @InfoOficialVe @brigadacomuni18,#EscudoBolivarianoIII2020,1239256388179595264,https://twitter.com/Info_LaGuaira/status/1239256388179595264
2020-03-15 18:25:07,lesbiarojita,HeLeNaBuckarct,0,0,0,"Que le den esa porquería de mierda contaminada a los colombianos de allá trajeron el COVID_19 a VENEZUELA!No pasarán nojoda! ",,,,1239256326880079874,https://twitter.com/lesbiarojita/status/1239256326880079874
2020-03-15 18:08:24,aotxotorena,,16,106,96,"Cuándo eres esbirro de Guaidog y el cerebro lo tienes en el C.U.L.O. Los únicos países que están prestando ""ayuda internacional"" frente al COVID-19 son China y Cuba, países aliados de Venezuela y el chavismo. Que alguien le haga un dibujo y se lo explique al infeliz. #Guaidiotas",,,#Guaidiotas,1239252119011635200,https://twitter.com/aotxotorena/status/1239252119011635200
2020-03-15 17:31:24,guasipati9,,0,0,3,"Debido a la pandemia del Covid-19,Nuestras actividades docentes en Bogota,Colombia y Oaxaca,Mexico programadas para este mes de marzo han sido diferidas hasta nuevo aviso! ",,,,1239242809900744705,https://twitter.com/guasipati9/status/1239242809900744705
2020-03-15 17:20:59,fundacionmuseos,,0,0,0,"*Lo que madres, padres y educadores deben saber sobre el coronavirus Covid-19: Cómo proteger a hijas, hijos y alumnos (+PDF)* ",,,,1239240190323023872,https://twitter.com/fundacionmuseos/status/1239240190323023872
2020-03-15 17:11:30,adrianconductor,,0,0,0,"Aún hay gente que pregunta el por qué de la suspensión de un Concierto .⁣ ⁣ Y es que actualmente con todo esto del #covid_19 #coronavirus lo mejor es resguardarse en casa .⁣ ⁣ Hay que mantener la calma, estar… https://www.instagram.com/p/B9wxwZ7ANaa/?igshid=1i7t5xr2i77n4",,,#covid_19 #coronavirus,1239237803269148672,https://twitter.com/adrianconductor/status/1239237803269148672
2020-03-15 17:01:26,anavescobar,,2,10,11,"15/3/20 Mercado de San Martín - Caracas. . Exigen el uso de mascarillas para poder entrar y hacer las compras. Quien no la tenga, no entra. . #coronavirus #covid19 #Venezuela #Caracas #MercadoSanMartin… https://www.instagram.com/p/B9wwz6ap4kI/?igshid=kj1kyu2hh2x1",,,#coronavirus #covid19 #Venezuela #Caracas #MercadoSanMartin,1239235268655407110,https://twitter.com/anavescobar/status/1239235268655407110
2020-03-15 16:56:06,OdLuisMarcano,,0,3,1,"""La gran mayoría se recupera de esta infección, y se recuperan completamente"" Palabras del Dr. William Schaffner respecto al #coronavirus COVID-19 ",,,#coronavirus,1239233926771736576,https://twitter.com/OdLuisMarcano/status/1239233926771736576
2020-03-15 16:53:13,alvaro140261,,0,0,0,"#covid_19 #coronavirusvenezuela en Caracas, D.F., Venezuela https://www.instagram.com/p/B9wv4CSn7nk/?igshid=syhh0eno6klv",,,#covid_19 #coronavirusvenezuela,1239233201249202176,https://twitter.com/alvaro140261/status/1239233201249202176
2020-03-15 16:44:29,AndresCPisani,,0,0,0,"Los virus de ARES eran peores que el COVID-19. Tengo pruebas y 0 dudas.",,,,1239231003706765312,https://twitter.com/AndresCPisani/status/1239231003706765312
2020-03-15 16:29:57,rebelde8a,NicolasMaduro,0,1,1,"Reitero el llamado a cumplir con disciplina social las medidas preventivas sanitarias implementadas a nivel nacional para enfrentar el COVID-19. En unidad, con conciencia y en coordinación con la OMS lograremos evitar la propagación de esta Pandemia que amenaza a la humanidad.",,,,1239227343316692992,https://twitter.com/rebelde8a/status/1239227343316692992
2020-03-15 16:18:27,JuanChitty,,1,0,0,"Ahora voy a la parte de la protección que las clínicas no han comprado y aparentemente no piensan comprar: cuando se trata a un paciente con covid19 a menos de 2m de distancia se recomienda máscara FFP2 (no hay en las clínicas) y sigo ",,,,1239224452942102529,https://twitter.com/JuanChitty/status/1239224452942102529
2020-03-15 16:12:19,avilabike,MisterBarranca,0,0,0,"Mejor reúne 1 millón de likes y Diosito curará y elimina el covid-19. &lt; Sub normal a la vista..... &gt;",,,,1239222905642323974,https://twitter.com/avilabike/status/1239222905642323974
2020-03-15 15:48:55,DPDPrevencion,,0,11,8,"ENTÉRATE Una de las mejores formas de reducir el riesgo de contagio del Covid-19, es lavarse muy bien las manos antes y después de hacer diferentes actividades. #LaPrevencionEstaEnTusManos",,,#LaPrevencionEstaEnTusManos,1239217020274724864,https://twitter.com/DPDPrevencion/status/1239217020274724864
2020-03-15 15:43:55,SamdicaCaracas,,0,0,1,"Recuerden que la #higiene es muy importante, contra el #Coronavirus o #covid19 lavarnos las manos correctamente por 20 segundos con algún #detergente o #jabónliquido ayuda a evitar la propagación o contagio.… https://www.instagram.com/p/B9wn8OeBWWk/?igshid=1epns144j3k5r",,,#higiene #Coronavirus #covid19 #detergente #jab,1239215762059022339,https://twitter.com/SamdicaCaracas/status/1239215762059022339
2020-03-15 15:31:09,NadalDiplo,AAzoulay,0,4,5,"Lugares culturales se están cerrando en todo el mundo frente a #COVID19 Apoyemos a los artistas, profesionales del teatro, libreros y todos aquellos que dan vida a la cultura en todas partes en China, Italia, Francia ... La cultura debe vivir y propagarse más rápido que el virus. ",,,#COVID19,1239212546869145609,https://twitter.com/NadalDiplo/status/1239212546869145609
2020-03-15 15:28:03,figueraedgar,,0,8,3,"La Dirección de Vigilancia Epidemiologica en Venezuela pone a la orden el número *0800COVID19 (08002684319)* por si usted presenta algún síntoma sobre la Covid-19 para que se ponga en contacto y pueda ser atendido. @jaarreaza @AlvaradoC_MPPS @planwac @WalterDossier @dcabellor",,@jaarreaza @AlvaradoC_MPPS @planwac @WalterDossier @dcabellor,,1239211768771207171,https://twitter.com/figueraedgar/status/1239211768771207171
2020-03-15 15:17:32,guasipati9,,0,8,15,"Manejo Covid-19 del Hospital Ramon y Cajal. Nótese que el manejo de imágenes en el tórax se hace prioritariamente con Ultrasonido observándose afectación intersticial con múltiples líneas B. La TC más sensible que la Rx pero significa problemas de traslado para el paciente ! ",,,,1239209119682383877,https://twitter.com/guasipati9/status/1239209119682383877
