date,username,to,replies,retweets,favorites,text,geo,mentions,hashtags,id,permalink
2020-03-17 17:34:50,JosueMadriz,,0,3,1,"Para prevenir la transmisión del Covid-19 las mujeres de los gobiernos comunitarios del municipio Zamora se organizan en la producción de tapabocas. #PrevenciónEsSalud #QuedateEnLaCasa #CoronavirusEnVenezuela #CuarentenaCoronavirus #VenezuelaUnidaContraElCoronavirus",,,#Prevenci #QuedateEnLaCasa #CoronavirusEnVenezuela #CuarentenaCoronavirus #VenezuelaUnidaContraElCoronavirus,1239968449406717952,https://twitter.com/JosueMadriz/status/1239968449406717952
2020-03-17 17:33:09,Intrepido221BX,lromerob,2,1,1,"Así se llamó al principio Leo @lromerob cuando no se tenía claro a que grupo pertenecía el virus, también lo llamaron ""neumonía de Wuhan"", y también“nCoV-2019”. Ahora que se ha estudiado desde el punto de vista microbiológico, cambiaron el nombre a COVID-19 y SARS -CoV-2. ",,@lromerob,,1239968024527953920,https://twitter.com/Intrepido221BX/status/1239968024527953920
2020-03-17 17:15:18,CirculoMilFANB,,0,1,3,"#TenemosEstirpeDeGuerreros es el momento de demostrar nuestra fortaleza, los venezolanos estamos hechos de una madera muy fuerte, la cual nos dará la fortaleza para salir adelante en esta pandemia. La #Prevención es la clave, juntos derrotaremos al #Covid_19 ",,,#TenemosEstirpeDeGuerreros #Prevenci #Covid_19,1239963533091041280,https://twitter.com/CirculoMilFANB/status/1239963533091041280
2020-03-17 16:56:10,franzisGTN,,1,0,0,"Los casos confirmados de coronavirus en Ecuador se elevan a 111 (dos de ellos fallecidos), así informó este martes la titular del Servicio Nacional de Gestión de Riesgos y Emergencias (SNGRE), Alexandra Ocles. #noticias #covid19 #coronavirus",,,#noticias #covid19 #coronavirus,1239958717447225345,https://twitter.com/franzisGTN/status/1239958717447225345
2020-03-17 16:53:51,franzisGTN,,0,0,0,"Ministerio de Salud de Colombia confirmó ocho nuevos casos de coronavirus en la nación. Con estos, el país llega a 65 casos de COVID-19.#coronavirus #covid19",,,#coronavirus #covid19,1239958134149361664,https://twitter.com/franzisGTN/status/1239958134149361664
2020-03-17 16:51:16,LachinaPSUV,,0,21,12,"|| Así están a esta hora las principales plaza de #Caracas La prevención es la clave para evitar más contagios de #coronavirus COVID-19 . . . . #QuedateEnTuCasa #ccs #yomequedoencasa",,,#Caracas #coronavirus #QuedateEnTuCasa #ccs #yomequedoencasa,1239957484107976705,https://twitter.com/LachinaPSUV/status/1239957484107976705
2020-03-17 16:50:34,Ermandril1,,0,0,0,"Deberia conformarse, un grupo elite/inmortal q combata el covid19 con: https://twitter.com/DictadordeCorea/status/1239955630648987654",,,,1239957308731461634,https://twitter.com/Ermandril1/status/1239957308731461634
2020-03-17 16:44:38,cortezyelitze,,1,2,7,"En mi #condominio ya nos ofrecimos para hacer las compras que necesiten los adultos mayores, ellos son más vulnerables, cuadramos para apoyar en la comida de los vigilantes que por contingencia dormirán aquí unos días. Organización y cooperación. #Covid_19",,,#condominio #Covid_19,1239955815940980736,https://twitter.com/cortezyelitze/status/1239955815940980736
2020-03-17 16:44:10,djleobarrios,,0,0,0,"La vida es como un Fader , sube y baja donde más o menos acción a tu rutina . . . . . #vida #fader #cuarentena #coronavirus #covid_19 #dj #djlife #ccs #venezuela en Universidad Metropolitana https://www.instagram.com/p/B914bZLpinP/?igshid=p2y517hu102",,,#vida #fader #cuarentena #coronavirus #covid_19 #dj #djlife #ccs #venezuela,1239955700115296261,https://twitter.com/djleobarrios/status/1239955700115296261
2020-03-17 16:33:50,UVOriental,,0,29,56,"Atención | Invitamos a la iglesia a unirnos en oración permanente a las horas señaladas. Hoy pedimos el poder de Dios al detener la propagación del #Covid_19 Comparte para que se unan muchos más. #UVOriental #Oración #Coronavirus",,,#Covid_19 #UVOriental #Oraci #Coronavirus,1239953099030134784,https://twitter.com/UVOriental/status/1239953099030134784
2020-03-17 16:32:06,NayarbGarcia,,1,0,0,"Estamos sin agua, en estas condiciones es imposible guardar cuarentena. Necesitamos el vital líquido. (Barrio Canaima, Parroquia Carlos Soublette, Edo.Vargas) #CuarentenaNacional #QuedateEnLaCasa @CarneiroPSUV @Brandoarte #Covid_19 #CoronavirusEnVenezuela",,@CarneiroPSUV @Brandoarte,#CuarentenaNacional #QuedateEnLaCasa #Covid_19 #CoronavirusEnVenezuela,1239952663367880704,https://twitter.com/NayarbGarcia/status/1239952663367880704
2020-03-17 16:31:41,cbetancourtod,,0,0,0,"Dr. @juliocastrom para usted: ¿cuáles son los 5 puntos más importantes de la situación del covid-19 en Venezuela? #17MARZO",,@juliocastrom,#17MARZO,1239952557100982275,https://twitter.com/cbetancourtod/status/1239952557100982275
2020-03-17 16:30:20,cutrille,,5,0,0,"@Guscabeza63 Saludos mi pana como está todo, qtal uds allá en Deutshland con el Covid19?",,@Guscabeza63,,1239952218612170752,https://twitter.com/cutrille/status/1239952218612170752
2020-03-17 16:21:55,jrbrachon,,0,1,2,"#Coronavirus: el atardecer lunes de cuarentena en Caracas, ya prohibido los viajes entre ciudades, ya en Barquisimeto y demás ciudades debemos tomar conciencia y estar unidos en estos momentos difíciles para todos #QuedateEnLaCasa #NoSonVacaciones #17Mar #Venezuela #Covid_19 ",,,#Coronavirus #QuedateEnLaCasa #NoSonVacaciones #17Mar #Venezuela #Covid_19,1239950099867893760,https://twitter.com/jrbrachon/status/1239950099867893760
2020-03-17 16:14:11,quinjls28,elianabonita,0,0,1,"Desde hoy me referiré al COVID-19 como VIRUS CHINO. ",,,,1239948151584325632,https://twitter.com/quinjls28/status/1239948151584325632
2020-03-17 16:13:26,davidrguillena,,0,0,0,"Repost 3crevival by in.grabber: ANTÍDOTOS EN TIEMPOS DE COVID-19. Si no quieres contagiarte, te invitamos a tomar las precauciones correspondientes y aplicar estos tres antídotos. Te… https://www.instagram.com/p/B9106Qcniq2A12eL0gTGLEwIji_TFs5BADlqT80/?igshid=1ozs2nfznyqdo",,,,1239947966443425792,https://twitter.com/davidrguillena/status/1239947966443425792
2020-03-17 16:11:20,dra_navasdavila,,0,2,2,"Para luchar contra el COVID-19 es fundamental el papel activo de todos los ciudadanos. El objetivo de la campaña #QuédateEnCasa no tiene el objetivo de eliminar la propagación del virus, sino de reducir la velocidad… https://www.instagram.com/p/B910q-EjbdE/?igshid=1y2j9kirbc67j",,,#Qu,1239947435784495105,https://twitter.com/dra_navasdavila/status/1239947435784495105
2020-03-17 16:06:24,esteramve9948,,0,0,0,"Está es una de las medidas para combatir el covid-19 q propuso bobolongo. Vienen mas medidas pendientes. Jajajaja. ",,,,1239946196082479111,https://twitter.com/esteramve9948/status/1239946196082479111
2020-03-17 16:05:11,juanfreites,,0,1,1,"#CoVid19 Estamos ante una Pandemia de proporciones épicas, pero eso no es motivo para perder la calma y la cordura. Estemos atentos a los síntomas, y seguir las recomendaciones de aislamiento. Sobreviviremos al virus chino. #17Mar",,,#CoVid19 #17Mar,1239945888052785159,https://twitter.com/juanfreites/status/1239945888052785159
2020-03-17 16:04:25,esteramve9948,,0,0,0,"Está es una de las medidas para combatir el covid-19 q propuso bobolongo Guaidon. Vendran nuevas medidas. Pendientes jajaja. ",,,,1239945696117227526,https://twitter.com/esteramve9948/status/1239945696117227526
2020-03-17 16:02:56,elidjos,,0,2,5,"Ojala aprendamos de esta lección! No importa religión, nivel económico, preferencia política! Todos somos vulnerables, todos somos frágiles, todos dependemos de los demás para cuidarnos y detener esto! #SARS_COV_2 #Covid_19",,,#SARS_COV_2 #Covid_19,1239945320122978304,https://twitter.com/elidjos/status/1239945320122978304
2020-03-17 15:50:35,royery,,0,0,0,"Después de revisar varios links, aquí es donde se muestran las cifras relacionadas al Covid-19 más actualizadas. ",,,,1239942212127002626,https://twitter.com/royery/status/1239942212127002626
2020-03-17 15:45:57,mobilesse,,0,0,0,"En Mobilesse, como empresa responsable y comprometida con la salud de nuestro equipo y clientes, promovemos: #QuédateEnCasa #TrabajoRemoto #CuarentenaNacional #Covid_19 ",,,#Qu #TrabajoRemoto #CuarentenaNacional #Covid_19,1239941049684025349,https://twitter.com/mobilesse/status/1239941049684025349
2020-03-17 15:39:35,perezvalery,,0,7,3,"#COVID19| Refuerzan control de tráfico en la autopista Francisco Fajardo, la principal vía de #Caracas #Venezuela. Hay mayor control policial en la calle en comparación con el lunes. Solo ingresan a la autopista servicios esenciales de transporte y personas con justificación.",,,#COVID19 #Caracas #Venezuela,1239939445970927616,https://twitter.com/perezvalery/status/1239939445970927616
2020-03-17 15:39:21,maviihorn,,0,0,0,"@SudebanInforma @sundde_ve Con esa situación con respecto del COVID 19 en nuestro país más del 85% de los negocios están cerrados y de igual manera las empresas @totalpagoplus siguen cobrando semanalmente 13$al cambio del BCV, como vamos a hacer la pequeño comerciantes?",,@SudebanInforma @sundde_ve @totalpagoplus,,1239939386290176001,https://twitter.com/maviihorn/status/1239939386290176001
2020-03-17 15:34:05,Intrepido221BX,Intrepido221BX,1,0,0,"Leo @lromerob 2) una parte importante de la población, en estado de malnutrición, substitución, desnutrición. ¿Cómo generan los anticuerpos, la defensa ante la infección? ¿La Disponibilidad de alimentos, la producción internacional y nacional está afectada por el COVID-19? ",,@lromerob,,1239938059900268545,https://twitter.com/Intrepido221BX/status/1239938059900268545
2020-03-17 15:26:31,Incret_Oficial,,0,8,2,"El @Incret_Oficial se une a la Campaña #QuedateEnLaCasa y de esta manera evitamos la propagación del #Covid_19. ",,@Incret_Oficial,#QuedateEnLaCasa #Covid_19,1239936156516704256,https://twitter.com/Incret_Oficial/status/1239936156516704256
2020-03-17 15:25:08,Intrepido221BX,Intrepido221BX,2,0,1,"Leo @lromerob Los nodos críticos, para mi, en Venezuela son 3: 1) una epidemia de COVID-19, en paralelo con 2 epidemias más (una de tuberculosis, y otra de (gripe) influenza) en Venezuela ahora, hoy ya. ",,@lromerob,,1239935810092351495,https://twitter.com/Intrepido221BX/status/1239935810092351495
2020-03-17 15:13:33,trivaler,mileblan,1,0,1,"Se sabe que el Covid-19 se originó en China,con el agravante perverso que ocultaron la información.",,,,1239932895634100225,https://twitter.com/trivaler/status/1239932895634100225
2020-03-17 15:09:14,elrecreocc,,0,0,1,"#Repost @goldsgymve • • • • • • Uno de los puntos a seguir durante el Distanciamiento Social en la cuarenta por el Coronavirus Covid-19 es seguir dentro de lo que se pueda un patrón de nuestras actividades diarias… https://www.instagram.com/p/B91tkSAn7Mh/?igshid=13zxamtx1pzi5",,@GoldsGymVe,#Repost,1239931808990584838,https://twitter.com/elrecreocc/status/1239931808990584838
2020-03-17 15:09:08,trivaler,CATERINAV,0,1,1,"Todo el mundo sabe que el coronavirus Covid-19 se inició en China,y su acultamiento evitó que se hubiera atajado a tiempo su propagación como pandemia;eso es calificable como delito de lesa humanidad por parte del régimen de China. ",,,,1239931781001949184,https://twitter.com/trivaler/status/1239931781001949184
2020-03-17 14:45:18,escrross,,0,0,0,"Todavia hay gente que se preocupa por el fucking footbal??#Covid_19",,,#Covid_19,1239925783180857345,https://twitter.com/escrross/status/1239925783180857345
2020-03-17 14:42:20,FotoPoseV,,0,0,0,"Déjanos aquí en los COMENTARIOS Cuáles series y películas recomiendas ver durante estos días! Los leemos . Quedarnos en casa es la medida recomendada para evitar la propagación y el contagio del #covıd19… https://www.instagram.com/p/B91qfKtlc15/?igshid=gwvger9fdzyc",,,#cov,1239925036573581312,https://twitter.com/FotoPoseV/status/1239925036573581312
2020-03-17 14:02:48,EmbamexVen,,0,5,6," Mexicanxs en #Venezuela : Ante la pandemia de Covid-19, se ha impuesto una cuarentena social y colectiva en todo el país, lo cual nos ha obligado a cerrar nuestras oficinas al público. Seguimos atendiéndoles de manera telefónica 24/7 04122524675 y 04127288292 ",,,#Venezuela,1239915090490658818,https://twitter.com/EmbamexVen/status/1239915090490658818
2020-03-17 14:02:19,galomolinamolin,,0,0,0,"42 personas más ingresaron al cerco epidemiológico por covid-19 en Ecuador, hay 58 casos confirmados ",,,,1239914968298016768,https://twitter.com/galomolinamolin/status/1239914968298016768
2020-03-17 13:56:50,HumbertoNavas_1,,0,0,0,"Con o sin #Coronavirus #COVID_19 , aquí seguimos trabajando ft @SocialWebSEO1 . . . #marketing #marketingdigital #marketingtips #marketingonline #marketingstrategy #socialmediamarketing #digitalmarketing… https://www.instagram.com/p/B91lRjtJXxv/?igshid=7ps37n8a9huz",,@SocialWebSEO1,#Coronavirus #COVID_19 #marketing #marketingdigital #marketingtips #marketingonline #marketingstrategy #socialmediamarketing #digitalmarketing,1239913586853584899,https://twitter.com/HumbertoNavas_1/status/1239913586853584899
2020-03-17 13:51:17,soyluisconza,,0,0,0,"Esta es Caracas en días de cuarentena por el Covid-19 ... Y ni les hablo de Venecia que tan solo con pocos días los canales Jan aclarado sus aguas.... El mundo nos pide que no sigamos dañandolo. QUEDATE EN CASA. no… https://www.instagram.com/p/B91kBbAHgC8/?igshid=1snf2mbrwxrgh",,,,1239912192557883395,https://twitter.com/soyluisconza/status/1239912192557883395
2020-03-17 13:35:16,SoyAndrea025,,0,1,0,"#Ahora | Mercado Municipal de Guaicaipuro este #17Mar abrió sus puertas, exigiendo a los comerciantes y compradores utilizar tapabocas. Solo están abierto los negocios de venta de comida, acatando el llamado a #Cuarentena #Caracas #Coronavirus #COVID19 ",,,#Ahora #17Mar #Cuarentena #Caracas #Coronavirus #COVID19,1239908162372882432,https://twitter.com/SoyAndrea025/status/1239908162372882432
2020-03-17 13:27:16,avdt11,,1,77,75,"Pronunciamiento de AVDT en relación con el COVID-19, las medidas adoptadas por el Ejecutivo, y sus implicaciones tributarias ",,,,1239906146103803905,https://twitter.com/avdt11/status/1239906146103803905
2020-03-17 12:33:40,biskiskaren,,0,1,2,"Una buena razón para lavarse las manos. #Covid_19 #Coronavirus #CuarentenaCoronavirus #CuarentenaNacional #QuedateEnTuCasaCarajo #QuedateEnLaCasa #Venezuela #Caracas #Petare #LavadoDeManos #WashYourHands",,,#Covid_19 #Coronavirus #CuarentenaCoronavirus #CuarentenaNacional #QuedateEnTuCasaCarajo #QuedateEnLaCasa #Venezuela #Caracas #Petare #LavadoDeManos #WashYourHands #WashYourHands,1239892658920861697,https://twitter.com/biskiskaren/status/1239892658920861697
2020-03-17 12:25:32,kerwinghg,,0,0,0,"COVID-19 Cuarentena Día 1 . . . Caracas, Venezuela . . . #caracas #caracastagram #caminandocaracas #caracastequiero #caracaswalk #instalovenezuela #ig_caracas_ #elnacionalweb #igersvenezuela #ig_grancaracas… https://www.instagram.com/p/B91a1FGnjWo/?igshid=10tmyi1oyv860",,,#caracas #caracastagram #caminandocaracas #caracastequiero #caracaswalk #instalovenezuela #ig_caracas_ #elnacionalweb #igersvenezuela #ig_grancaracas,1239890611118931969,https://twitter.com/kerwinghg/status/1239890611118931969
2020-03-17 12:23:41,NadalDiplo,EmmanuelMacron,0,3,4,"Hasta hace poco, la epidemia de #Covid_19 pudo haber sido una idea distante para algunos de nosotros pero se ha convertido en una realidad inmediata y apremiante en casi todos los países del mundo. #SolidaridadCOVID19",,,#Covid_19 #SolidaridadCOVID19,1239890144745984000,https://twitter.com/NadalDiplo/status/1239890144745984000
2020-03-17 12:17:39,NadalDiplo,florence_parly,0,8,10,"El presidente de la República @EmmanuelMacron anunció la movilización del servicio de salud militar para crear un hospital de campaña en Alsacia: una estructura médica en una carpa con 30 camas de cuidados intensivos dedicados al cuidado de pacientes con #Covid_19 ",,@EmmanuelMacron,#Covid_19,1239888625812361217,https://twitter.com/NadalDiplo/status/1239888625812361217
2020-03-17 12:08:41,CronicaUno,,1,9,3,"#17Marzo | Freddy Bernal anuncia que se hará un aislamiento de los municipios fronterizos Pedro María Ureña y Bolívar que colindan con la vecina población de #Cúcuta. Agregó que esta medida se toma para evitar una posible propagación del #Covid_19 #Tachira. Vía @anabarr84",,@anabarr84,#17Marzo #C #Covid_19 #Tachira,1239886370044329985,https://twitter.com/CronicaUno/status/1239886370044329985
2020-03-17 12:06:58,SoyAndrea025,,0,1,1,"#Coronavirus Gracias a esta aplicación de Google Maps puedes estar informado sobre los casos del #Covid_19 (confirmados y sospechosos) ",,,#Coronavirus #Covid_19,1239885939440148480,https://twitter.com/SoyAndrea025/status/1239885939440148480
2020-03-17 12:01:27,DALLR_CFC,,0,0,0,"Existe una diferencia entre los casos confirmados y los casos reales. La transparencia y credibilidad de los gobiernos son los que hacen que ese número sea lo más pequeño posible #COVIDー19 #Covid_19 #COVID2019",,,#COVID #Covid_19 #COVID2019,1239884549385003009,https://twitter.com/DALLR_CFC/status/1239884549385003009
2020-03-17 11:54:28,rosaelenamora,,0,0,0,"Posted withregram • opspaho ¿Puede sobrevivir el nuevo coronavirus #COVID19 en los climas cálidos y húmedos SI. INFO sobre #COVID19 en el enlace en la BIO de opspaho en Clinica La Floresta https://www.instagram.com/p/B91XRiXjx7s/?igshid=2opon2aqgdq5",,,#COVID19 #COVID19,1239882792890228736,https://twitter.com/rosaelenamora/status/1239882792890228736
2020-03-17 11:53:20,lusmaryudith13,PrensaFANB,0,0,0,"Buenossss díasssss.... Estoy de acuerdo con las medidas preventivas que se están tomando para evitar la propagación del COVID 19.... Más existimos personas que nos encontrábamos fuera de Nuestros hogares al momento del Declararse la Cuarentena y necesitamos regresar a nuestro hog",,,,1239882509221007360,https://twitter.com/lusmaryudith13/status/1239882509221007360
2020-03-17 11:37:54,HopeMediaVE,,1,13,35,"Hoy amanecimos en #CuarentenaColectiva en toda Venezuela Y tú, ¿desde qué ciudad o país cumples esta medida de prevención? Quédate en casa preservando tu salud y la de toda la familia #HopeMediaVe #TodosSomosHope #Covid_19 #Prevención #HopeChannelInteramerica",,,#CuarentenaColectiva #HopeMediaVe #TodosSomosHope #Covid_19 #Prevenci #HopeChannelInteramerica,1239878625190645760,https://twitter.com/HopeMediaVE/status/1239878625190645760
2020-03-17 11:36:00,Cuecos,,0,0,0,"Coronavirus, Covid_19, Virus Chino o Bat flu. No importa como lo llamen, pero lo que sí es importante es que debemos frenar su propagación YA! #quedateEnTuCasa",,,#quedateEnTuCasa,1239878148000538626,https://twitter.com/Cuecos/status/1239878148000538626
2020-03-17 11:25:42,jwemff,,0,0,0,"#proactivo y #productivo #día. - Ayudemos los que arriesgan su vida por nosotros atendiendo y motivando el Covid-19 Queda en tu casa . Ayudas a muchos. Y recuerda que ser Proactivo le agrega valor a la vida. en… https://www.instagram.com/p/B91T-5Vpc6S/?igshid=13v1kcapobgto",,,#proactivo #productivo #d,1239875553303449600,https://twitter.com/jwemff/status/1239875553303449600
2020-03-17 11:22:02,esojegetro,,0,0,0,"EN VIVO | Doctor Manuel Figuera: «Nadie tiene inmunidad contra el COVID-19, pero no significa que nos vamos a morir» ",,,,1239874629268799489,https://twitter.com/esojegetro/status/1239874629268799489
2020-03-17 11:13:05,scamaran,,1,0,7,"Increíble es que hoy sea #Covid_19 y marzo del año pasado fue un gran apagón;pero hasta ahora no hay planificación educativa a distancia,para imprevistos como este donde se suspenden escuelas y todo queda a Merced... Un caos educativo!",,,#Covid_19,1239872377149894656,https://twitter.com/scamaran/status/1239872377149894656
2020-03-17 11:04:25,esteramve9948,zhorro4,0,0,0,"Cuba está dando una clase magistral en ayuda humanitaria mundial contra el covid-19. VIVA CUBA ",,,,1239870199664386050,https://twitter.com/esteramve9948/status/1239870199664386050
2020-03-17 10:55:44,yodeylis,,0,0,2,"Señores aquí no se puede hablar de #gobierno y #oposición , por dios unámonos en esta #EmergenciaSanitaria #Mundial #Covid_19 ,seamos más sensatos y coherentes , esto afecta a todos los sectores",,,#gobierno #oposici #EmergenciaSanitaria #Mundial #Covid_19,1239868013156892673,https://twitter.com/yodeylis/status/1239868013156892673
2020-03-17 10:53:50,Pablomorag,,0,2,3,"El COVID-19 no puede matarme. Ya estoy muerto desde este día ",,,,1239867533177630721,https://twitter.com/Pablomorag/status/1239867533177630721
2020-03-17 10:37:13,Karlayem,Edurodriguezg,0,1,11,"#BuenosDias Eduardo, un gran #saludoplanetario desde mi #Guaira querida. Acatando #YoMeQuedoEnCasa por la no expansión, ni contagio del #Covid_19 Muchas bendiciones para ti y todo tu equipo que hacen posible este programa cada mañana. #ATiempo #FelizMartes #17Marzo @Karlayem",,@Karlayem,#BuenosDias #saludoplanetario #Guaira #YoMeQuedoEnCasa #Covid_19 #ATiempo #FelizMartes #17Marzo,1239863354149277696,https://twitter.com/Karlayem/status/1239863354149277696
2020-03-17 10:08:57,carlojulio89,Gatubela_C,0,0,1,"¿De la inflación? En el banco central más nunca publicaron... ¿Te van a decir cuántos infectados por covid-19?. ",,,,1239856239279996928,https://twitter.com/carlojulio89/status/1239856239279996928
2020-03-17 09:36:41,Anafuerza1,JackRussellVzla,0,0,1,"No al maltrato animal y ojo no transmiten el covid - 19",,,,1239848118763630599,https://twitter.com/Anafuerza1/status/1239848118763630599
2020-03-17 08:54:44,estephannekarel,,0,0,0,"Si al menos tuviéramos lo básico al menos agua otro gallo cantara pero ni eso han podido controlar y pretenden controlar el covid19 que bomba acepten que por estar pendiente del cuanto me va a quedar de los negocios abandonaron al pueblo y lo han maltratado tanto y se olvidaron",,,,1239837563164164096,https://twitter.com/estephannekarel/status/1239837563164164096
2020-03-17 06:08:18,Nenascre,,0,0,0,"Alertan que 150 millones de personas contraerán COVID-19 en EEUU #quédateEnCasa",,,#qu,1239795675895906306,https://twitter.com/Nenascre/status/1239795675895906306
2020-03-17 06:01:19,Richardjsp02,,0,0,1,"Ha esta hora 1:59am en el silencio de mi urbanización lo que escucho es gente tosiendo #Venezuela #Covid_19 #ToqueDeQueda",,,#Venezuela #Covid_19 #ToqueDeQueda,1239793920265064448,https://twitter.com/Richardjsp02/status/1239793920265064448
2020-03-17 06:00:57,Nenascre,,0,0,0,"La Armada de Estados Unidos anuncia el primer caso de contagio del COVID-19 en uno de sus buques de guerra en California. #quédateEnCasa",,,#qu,1239793827428347904,https://twitter.com/Nenascre/status/1239793827428347904
2020-03-17 05:48:59,Mag_gpoleo,,0,0,1,"Si, estamos todos juntos en esto Solo como colectivo organizado, prudente y prevenido seremos capaces de vencer al #COVID-19 #GuadaTIC apoyando la campaña #quédateencasa #Venezuela #17mar en Caracas https://www.instagram.com/p/B90tcxjBQtP/?igshid=13lry06jq4aut",,,#COVID #GuadaTIC #qu #Venezuela #17mar,1239790817943879680,https://twitter.com/Mag_gpoleo/status/1239790817943879680
2020-03-17 05:43:02,Mag_gpoleo,,0,0,0,"Si, estamos todos juntos en esto Solo como colectivo organizado, prudente y prevenido seremos capaces de vencer al #COVID-19 #GuadaTIC apoyando la campaña #quédateencasa #Venezuela #17mar en Caracas https://www.instagram.com/p/B90sxMWBDWp/?igshid=1am5jg9txykbl",,,#COVID #GuadaTIC #qu #Venezuela #17mar,1239789320644550656,https://twitter.com/Mag_gpoleo/status/1239789320644550656
2020-03-17 05:42:01,Nenascre,,0,0,0,"“Eso a mí no me va a pasar”: El error que te puede resultar fatal… incluso aunque no te infectes de COVID-19 por coronavirus #quédateEnCasa https://www.semfyc.es/eso-a-mi-no-me-va-a-pasar-el-error-que-te-puede-resultar-fatal-incluso-aunque-no-te-infectes-de-covid-19-por-coronavirus/",,,#qu,1239789065073025024,https://twitter.com/Nenascre/status/1239789065073025024
2020-03-17 04:51:47,Intrepido221BX,,0,0,1,"Leo @lromerob un artículo que explica mucho mejor que yo tu duda sobre el tiempo de curación Coronavirus: qué significa exactamente estar curado después de haber padecido covid-19 ",,@lromerob,,1239776423272943618,https://twitter.com/Intrepido221BX/status/1239776423272943618
2020-03-17 04:33:52,ddmendezdd,,0,0,1,"Tantos lugares que visitar y miranos, aquí estamos en #cuarentena gracias al #coronavirus ¿Cuál será tu primera ruta al superar el #covid_19 ?. . . . #MochilasVenezuela #mochileros #venezuela #camping #campismo… https://www.instagram.com/p/B90k2Y_j5ZY/?igshid=11ccca1txbl6x",,,#cuarentena #coronavirus #covid_19 #MochilasVenezuela #mochileros #venezuela #camping #campismo,1239771914773704705,https://twitter.com/ddmendezdd/status/1239771914773704705
2020-03-17 04:15:41,oleyram,,0,0,0,"El Covid-19 es un virus q hay q tomarlo con seriedad y el Vzlano es testarudo, no entiende d lógicas ni d razones ",,,,1239767336195960833,https://twitter.com/oleyram/status/1239767336195960833
2020-03-17 04:11:26,rosaelenamora,,0,0,0,"Posted withregram • @UPILafloresta Es muy importante limitar la diseminación del COVID-19. En vista de esto la Unidad de Pediatra Integral La Floresta sugiere a sus pacientes consultar en caso estrictamente… https://www.instagram.com/p/B90iSEjDfLf/?igshid=8glmzujjgzpm",,@UPILafloresta,,1239766265423712257,https://twitter.com/rosaelenamora/status/1239766265423712257
2020-03-17 03:55:19,UPILafloresta,,0,0,0,"Es muy importante limitar la diseminación del COVID-19. En vista de esto la Unidad de Pediatra Integral La Floresta sugiere a sus pacientes consultar en caso estrictamente necesario. Para no poner en riesgo al… https://www.instagram.com/p/B90gcKJDj7D/?igshid=1rsccqe7674sj",,,,1239762210991325185,https://twitter.com/UPILafloresta/status/1239762210991325185
