date,username,to,replies,retweets,favorites,text,geo,mentions,hashtags,id,permalink
2020-03-13 18:36:26,eltecnicoluis,,0,0,0,"Epa pero al menos denuncia! Entra en #MercadoLibre @ML_Venezuela y busca #Alcohol gel antibacterial #Mascarillas etc y #Denuncialos (No sin antes decirle sus vainas) tu ayuda, es ayuda para todos #Venezuela #Covid_19 #COVIDー19 #CoronaVirus #coronavirusenvzla @sundde_ve – at Caracas",,@ML_Venezuela @sundde_ve,#MercadoLibre #Alcohol #Mascarillas #Denuncialos #Venezuela #Covid_19 #COVID #CoronaVirus #coronavirusenvzla,1238534398263406592,https://twitter.com/eltecnicoluis/status/1238534398263406592
2020-03-13 18:30:08,VeroCostaM,,0,0,0,"Infórmate del #covid_19 a través de las fuentes confiables como la Organización Mundial de la Salud y UNICEF, sigue sus intrucciones, resguardate y protégete del #Coronavirus ya que está declarado como pandemia mundial y requiere de responsabilidad, seriedad y esfuerzo de todos",,,#covid_19 #Coronavirus,1238532815639248896,https://twitter.com/VeroCostaM/status/1238532815639248896
2020-03-13 18:30:00,HaslerIglesias,,33,200,169,"Lavarse las manos es una de las medidas más efectivas para prevenir contagios de #COVID19. Ante los problemas de agua y la escasez y alto costo de geles antibacteriales, comparto con ustedes esta fórmula recomendada por la #OMS para preparar #GelAntibacterial casero.",,,#COVID19 #OMS #GelAntibacterial,1238532781401047041,https://twitter.com/HaslerIglesias/status/1238532781401047041
2020-03-13 18:25:38,JOSEANTONIOVELA,,0,1,1,"#SinLuz La Loira, El Paraíso Caracas #Covid_19 #coronavirusenvzla",,,#SinLuz #Covid_19 #coronavirusenvzla,1238531683588214786,https://twitter.com/JOSEANTONIOVELA/status/1238531683588214786
2020-03-13 18:14:11,gregoriopriv,,0,0,0,"Se les acabó la puteria, nada de besos y abrazos ni estar encima de uno! #Covid_19 #coronavirusenvzla",,,#Covid_19 #coronavirusenvzla,1238528800608182272,https://twitter.com/gregoriopriv/status/1238528800608182272
2020-03-13 18:12:26,eacda,,0,0,0,"Mientras más lo pienso, más se parece la ficción a la realidad... se parece demasiado a la crisis del covid19... ¿lo han leído? ¿Qué les pareció? Ensayo sobre la ceguera (original en portugués, Ensaio sobre a… https://www.instagram.com/p/B9rvWQUBpgM/?igshid=1c4mfmv44kpco",,,,1238528360122286082,https://twitter.com/eacda/status/1238528360122286082
2020-03-13 18:10:24,ContactoCantv,,3,10,5,"#13Mar Es importante saber que el #Covid_19 se transmite por toser, estornudar y contacto cercano con una persona infectada. Lo más recomendable si tienes gripe común es beber abundante líquido y si tienes dificultad para respirar acudir al centro médico más cercano ",,,#13Mar #Covid_19,1238527850178842624,https://twitter.com/ContactoCantv/status/1238527850178842624
2020-03-13 18:08:23,UVOriental,,0,11,24,"Segundo comunicado. Pandemia de COVID-19 y eventos juveniles. Fuente: ",,,,1238527342072520704,https://twitter.com/UVOriental/status/1238527342072520704
2020-03-13 18:02:26,Carlos_Ancheta,sanidadgob,0,0,0,"recomendaciones para evitar que se propague Y contener el #COVID19 es necesaria la colaboración de todos y todas. ",,,#COVID19,1238525842831167488,https://twitter.com/Carlos_Ancheta/status/1238525842831167488
2020-03-13 18:00:53,VladimirSQ,,0,0,1,"Deberíamos desde ya sentirnos con la libertad de hacer cualquier llamado de atención a cualquier persona en la calle que esté incumpliendo con las medidas y recomendaciones. Dígase cuando esté tosiendo o estornudando, etc. El respeto por delante, claro. No es juego. #Covid_19",,,#Covid_19,1238525454719635461,https://twitter.com/VladimirSQ/status/1238525454719635461
2020-03-13 18:00:37,Akin_Publicista,,0,0,0,"Ya el #Covid_19 vino a saludar nuestro país ",,,#Covid_19,1238525385475751941,https://twitter.com/Akin_Publicista/status/1238525385475751941
2020-03-13 18:00:03,josyfernandez,,0,29,19,"#ATENCIÓN | #13Mar | #Covid_19 Se le pide a las personas mayores, que permanezcan en sus casas. Éste virus afecta mayormente a las personas de 3ra Edad. • Recomendamos mantenerse en casa, y salir solo en caso de que sea necesario.",,,#ATENCI #13Mar #Covid_19,1238525243301527553,https://twitter.com/josyfernandez/status/1238525243301527553
2020-03-13 17:57:34,masqueuncoach,,2,1,1,"¿A dónde se deben dirigir los pasajeros de los vuelos de #Iberia? #Covid_19",,,#Iberia #Covid_19,1238524620359249921,https://twitter.com/masqueuncoach/status/1238524620359249921
2020-03-13 17:57:00,DPDPrevencion,,0,16,13,"#Dato | La COVID-19 es una enfermedad infecciosa que no había sido detectado en humanos hasta la fecha. Causa una enfermedad respiratoria como la gripe (influenza) con diversos síntomas (tos, fiebre, etc.) que, en casos graves, puede producir una neumonía. ",,,#Dato,1238524476146450432,https://twitter.com/DPDPrevencion/status/1238524476146450432
2020-03-13 17:54:32,LabMiSaludIdeal,,0,0,0,"Estaremos ATENTOS #coronavirusenvzla #Covid_19 #CoronavirusPrevencionYAccion",,,#coronavirusenvzla #Covid_19 #CoronavirusPrevencionYAccion,1238523854508752897,https://twitter.com/LabMiSaludIdeal/status/1238523854508752897
2020-03-13 17:44:13,Nasich_Malakh,TeLoCuentoNews,0,0,0,"Lo que es ética y moralmente inaceptable es que continúen usurpando el poder, en medio de una crisis humanitaria compleja agravada por una pandemia de #Covid_19 #SinVergüenza",,,#Covid_19 #SinVerg,1238521259266396160,https://twitter.com/Nasich_Malakh/status/1238521259266396160
2020-03-13 17:41:16,TiarIts,,0,0,0,"Todo el mundo está generando un caos sobre el covid- 19 no es un juego pero se sabía que esto vendría incrédulos los que no creían.",,,,1238520517583347712,https://twitter.com/TiarIts/status/1238520517583347712
2020-03-13 17:27:29,JoseManuell_R,,0,1,1,"Cómo el régimen no puede seguir ocultando que en Venezuela desde hace rato habían personas con el síntoma del #Covid_19 #coronavirusenvzla ya hacen público la suspensión de clases en todos los niveles. #13Mar",,,#Covid_19 #coronavirusenvzla #13Mar,1238517047329542149,https://twitter.com/JoseManuell_R/status/1238517047329542149
2020-03-13 17:25:27,MayeDelCastillo,,0,1,0,"Cuidado: las malas noticias debilitan tu sistema inmunológico. Cómo controlarlo #Covid_19 #coronavirusenvzla #Viernes13 #coronavirusvenezuela #13Mar #EmergenciaSanitaria #Venezuela #DatosYTips #SoyMAYE",,,#Covid_19 #coronavirusenvzla #Viernes13 #coronavirusvenezuela #13Mar #EmergenciaSanitaria #Venezuela #DatosYTips #SoyMAYE,1238516535850938369,https://twitter.com/MayeDelCastillo/status/1238516535850938369
2020-03-13 17:04:31,somossaludsma,,0,0,0,"Recomendaciones para la prevención de #Coronavirus. . Fuente: Organización Mundial de la Salud (WHO) . #Repost who (@get_repost) ・・・ These are 7 simple steps to protect yourself and others from #COVID19.… https://www.instagram.com/p/B9rnhlln7Lv/?igshid=13ycc23mukkjs",,@get_repost,#Coronavirus #Repost #COVID19,1238511270246088707,https://twitter.com/somossaludsma/status/1238511270246088707
2020-03-13 16:53:17,ABSSurth,,0,0,0,"Con la confirmación de dos casos en #Venezuela, ubicados en el Edo. Miranda; lo que menos se puede hacer, es caer en crisis. Si se mantiene una higiene personal constante NO se propaga el Coronavirus COVID-19. ¡Comparte y difunde! Prevenir es salud. #13Mar #CoronavirusEnVzla",,,#Venezuela #13Mar #CoronavirusEnVzla,1238508440894529536,https://twitter.com/ABSSurth/status/1238508440894529536
2020-03-13 16:42:48,ThonyBarreraQ,,0,0,1,"Lo hemos hecho mal. Las campañas de concientización sobre el covid-19 debieron de comenzar desde hace semanas. Ahora el pánico supera a la razón, y esto no está bien.",,,,1238505803058995200,https://twitter.com/ThonyBarreraQ/status/1238505803058995200
2020-03-13 16:37:39,alejandracake,,0,0,2,"Tengan vergüenza y por lo menos limpien el metro que bien asqueroso lo tienen. #coronavirusenvzla #coronavirusvenezuela #Covid_19",,,#coronavirusenvzla #coronavirusvenezuela #Covid_19,1238504507925037057,https://twitter.com/alejandracake/status/1238504507925037057
2020-03-13 16:37:00,aotxotorena,elcitizen,12,50,43,"Esta gente está enferma. Verdaderamente enferma. Eso sí, a ver si la vaina le va a dar a él y nos echamos unas risas, que el ""Matacuras"" está en pleno grupo de alto riesgo. No caerá esa breva. #COVID19 #Guaidonavirus",,,#COVID19 #Guaidonavirus,1238504343315202048,https://twitter.com/aotxotorena/status/1238504343315202048
2020-03-13 16:34:54,Ernesto141917JU,,0,0,0,"#Prevención: La clave en la Lucha contra el COVID-19 es la #Prevencion desde el hogar u Oficina",,,#Prevenci #Prevencion,1238503817223778306,https://twitter.com/Ernesto141917JU/status/1238503817223778306
2020-03-13 16:33:12,Ernesto141917JU,,0,0,0,"#Prevención: El COVID-19 Es una enfermedad Respiratoria. Los síntomas pueden aparecer de 01 a 12 días despues de la exposición al #Virus",,,#Prevenci #Virus,1238503389463535622,https://twitter.com/Ernesto141917JU/status/1238503389463535622
2020-03-13 16:32:29,ContactoCantv,,21,50,17,"#13Mar El #Covid_19 es una enfermedad respiratoria que se identificó por primera vez en Whuan, China. Su propagación se da principalmente de persona a persona. Aquí te dejamos los síntomas más comunes. @Gabrielasjr @MPPSalud #ConectateConLaPrevención",,@Gabrielasjr @MPPSalud,#13Mar #Covid_19 #ConectateConLaPrevenci,1238503205593649153,https://twitter.com/ContactoCantv/status/1238503205593649153
2020-03-13 16:32:20,Kati_Lop,,0,1,4,"Y bueno, ya se confirmó lo que era inminente, 2 casos de #COVID19 en #Venezuela. Lo importante: 1. Mantener la calma 2. Tomar todas las medidas Higiénicas personales (Lavarse las manos, usar antibacterial, evitar aglomeraciones) 3. Las personas mayores de 70 años quedarse en casa",,,#COVID19 #Venezuela,1238503170239868931,https://twitter.com/Kati_Lop/status/1238503170239868931
2020-03-13 16:22:14,DAVIDCACERESD,,0,0,0,"Prevención y Protección !!! @NicolasMaduro #Viernes13 #Covid_19 #coronavirusenvzla",,@NicolasMaduro,#Viernes13 #Covid_19 #coronavirusenvzla,1238500625828188163,https://twitter.com/DAVIDCACERESD/status/1238500625828188163
2020-03-13 16:19:58,juanfreites,,0,7,13,"#13Mar Ante la confirmación de casos de #Covid_19 y entendiendo la la crisis humanitaria, los ciudadanos debemos entender que la solidaridad, la calma, y la paciencia son vitales para sobrevivir. Al mundo y nuestros aliados, estén atentos. Sabemos lo que el régimen es capaz.",,,#13Mar #Covid_19,1238500058510823424,https://twitter.com/juanfreites/status/1238500058510823424
2020-03-13 16:17:12,ElLeoGomez,,0,0,0,"#13Mar La vice. @DrodriguezVen confirma dos casos positivos de #Covid_19 en #Venezuela",,@DrodriguezVen,#13Mar #Covid_19 #Venezuela,1238499359660093441,https://twitter.com/ElLeoGomez/status/1238499359660093441
2020-03-13 16:05:03,_Jasr,,0,2,0,"Panitas, ¿de casualidad han visto el indice de mortalidad del coronavirus? Es mas mortal el panico que el COVID19.",,,,1238496303451160579,https://twitter.com/_Jasr/status/1238496303451160579
2020-03-13 15:44:26,adrianojesus31,,0,0,0,"Parece que hay gente que esperába la noticia como para celebrar!!! Ya se confirman dos casos de #Covid_19 en #Venezuela Dios nos demostrará su poder! Y como guarda a esta nación que ama! – at Fuerte Tiuna",,,#Covid_19 #Venezuela,1238491114321129478,https://twitter.com/adrianojesus31/status/1238491114321129478
2020-03-13 15:39:26,FaroComunitario,,0,4,2,"#13Mar confirman dos casos de #Covid_19 en #Venezuela. No entremos en pánico, ocupemonos por tomar las medidas de prevención y estar Informados de las noticias al día.",,,#13Mar #Covid_19 #Venezuela,1238489854767435776,https://twitter.com/FaroComunitario/status/1238489854767435776
2020-03-13 15:37:54,aclidevenezuela,,0,0,2,"#Covid_19 Acaban de informar de 2 casos en Caracas. Tenemos que mantener medidas igienicas y amigos del municipio sucre nos avisan que amanecieron sin Agua. Por favor",,,#Covid_19,1238489471286480896,https://twitter.com/aclidevenezuela/status/1238489471286480896
2020-03-13 15:35:13,ehernandezvv,,0,0,0,"En Venezuela se conforman dos casos de #Covid_19 y se suspenden a partir del próximo lunes 16 de Marzo las actividades escolares en todos sus niveles.",,,#Covid_19,1238488797047853057,https://twitter.com/ehernandezvv/status/1238488797047853057
2020-03-13 15:31:40,IvanCarrasquel,,0,10,16,"Ya está aquí el Coronavirus #coronavirusvenezuela #covid19 #covid19venezuela Vídeo original de Zorman https://youtu.be/-FqundCKB_M (sin el obelisco de Altamira ni la bandera)",,,#coronavirusvenezuela #covid19 #covid19venezuela,1238487900754456577,https://twitter.com/IvanCarrasquel/status/1238487900754456577
2020-03-13 15:30:47,RaiserSuena,,4,19,19,"Venezuela confirma los dos primeros casos de Covid-19. #coronavirusvenezuela",,,#coronavirusvenezuela,1238487678624116742,https://twitter.com/RaiserSuena/status/1238487678624116742
2020-03-13 15:28:12,alejandracake,,0,0,0,"Ahí tienen confirmados dos casos de #coronavirusenvzla y lo peor es que las medidas sanitarias en este país no funciona. #Covid_19 #Viernes13 #URGENTE #coronavirus",,,#coronavirusenvzla #Covid_19 #Viernes13 #URGENTE #coronavirus,1238487027584323584,https://twitter.com/alejandracake/status/1238487027584323584
2020-03-13 15:26:35,FaniaRodrigues,,1,4,0,"1/1 Coronavírus en Venezuela Según la Vicepresidenta Delcy Rodríguez se confirma que la madrugada de este #13Mar fueron detectados dos casos de #Coronavirus en territorio venezolano. #Covid_19 #Venezuela",,,#13Mar #Coronavirus #Covid_19 #Venezuela,1238486621357473797,https://twitter.com/FaniaRodrigues/status/1238486621357473797
2020-03-13 15:25:53,superjonas,,0,1,0,"Que Venezuela esté tan golpeada en todo sentido, y se confirmen los primeros casos de #COVID-19 pues simplemente en mano de Dios. A orar ",,,#COVID,1238486447705018368,https://twitter.com/superjonas/status/1238486447705018368
2020-03-13 15:10:49,Andialecm,,0,2,1,"#13Mar | #UltimaHora | Delcys Rodríguez, confirma dos casos de Coronavirus en Venezuela. De vuelos procedentes de la línea Iberia. #Covid_19 #Coronavirusvenezuela",,,#13Mar #UltimaHora #Covid_19 #Coronavirusvenezuela,1238482656247066625,https://twitter.com/Andialecm/status/1238482656247066625
2020-03-13 15:04:31,UVOriental,,0,15,19,"Comunicado Oficial de la Unión Venezolana Oriental sobre el COVID19. #UVOriental #Coronavirus @mivellacen1 @AVCSur @asovecen @avcoriental @AVSOriental @comunicacionavo @adventistasnor Fuente oficial:",,@mivellacen1 @AVCSur @asovecen @avcoriental @AVSOriental @comunicacionavo @adventistasnor,#UVOriental #Coronavirus,1238481068803657729,https://twitter.com/UVOriental/status/1238481068803657729
2020-03-13 14:45:27,rebelde8a,Mippcivzla,0,2,0,"#EnVideo | Pdte. @NicolasMaduro: Tomaremos medidas especiales para la prevención y le pido a las organizaciones sociales y comunales del país ponerse al frente de la pandemia del #Covid_19 para proteger al pueblo. #SomosGarantíaAlimentaria",,@NicolasMaduro,#EnVideo #Covid_19 #SomosGarant,1238476270113038336,https://twitter.com/rebelde8a/status/1238476270113038336
2020-03-13 14:26:20,andresdchavez7,,1,0,0,"Que mensaje oculto habrá tras el Covid-19?",,,,1238471461704261632,https://twitter.com/andresdchavez7/status/1238471461704261632
2020-03-13 13:52:43,rebelde8a,,0,4,1,"#SomosGarantiaAlimentaria #Covid_19 El lavado de manos, principal medida de prevención para evitar el contagio, debe durar lo que se demora el canto del Himno de la Federación. ",,,#SomosGarantiaAlimentaria #Covid_19,1238463000715165697,https://twitter.com/rebelde8a/status/1238463000715165697
2020-03-13 13:51:29,vane_prieto,,2,30,15,"Ante la amenaza del Coronavirus COVID-19 es importante no tener contacto físico para evitar contagio. Para ello, existen diferentes formas de saludar a nivel mundial que podemos implementar sin dejar de ser cortes. #13Mar #COVID19 ",,,#13Mar #COVID19,1238462690370224132,https://twitter.com/vane_prieto/status/1238462690370224132
2020-03-13 13:49:34,BettyyajairaAc1,,0,0,1,"#cs.13 mar .9.41 am en caso que tuvieran un paciente contaminado covid 19 aislamiento de pacientes y del personal que los atiendes como se haría en los hospitales venezolanos que no tienes comidas pacientes que van a comer el personal",,,,1238462209639972865,https://twitter.com/BettyyajairaAc1/status/1238462209639972865
2020-03-13 13:46:14,INJuventudVE,,0,3,3,"¡SIGUES LAS INSTRUCCIONES! Aquí te dejamos algunas recomendaciones como parte del Plan de Prevención y Contención de COVID-19. Es necesario que sigas las indicaciones correctamente para resguardar tu salud. #PrevenciónYProtecciónDelPueblo @pinfantea @NicolasMaduro",,@pinfantea @NicolasMaduro,#Prevenci,1238461369655136258,https://twitter.com/INJuventudVE/status/1238461369655136258
2020-03-13 13:22:56,Luislui28166573,,0,0,0,"@NicolasMaduro como le dije el covid_19 si se puede contra restar y asta curar en sus primeros síntomas",,@NicolasMaduro,,1238455506483773440,https://twitter.com/Luislui28166573/status/1238455506483773440
2020-03-13 13:22:24,figueraedgar,ekolecua,1,1,0,"El mata cura, @elcitizen aún no sabe que el COVID-19 es intapable, indesviable mediáticamente?El desvío lo hizo USA según el propio director del C.D.C, Roberto Riefeld quien dio estas cifras: en USA hay 34MM Infectados por influenza y 20000 han muerto que cree son de coronavirus",,@elcitizen,,1238455369900396544,https://twitter.com/figueraedgar/status/1238455369900396544
2020-03-13 13:14:55,Ermandril1,,0,0,0,"Otra optica a la teoria conspirativa China, del covid 19, como arma biologica norteamericana. @OrlvndoA",,@OrlvndoA,,1238453486381080577,https://twitter.com/Ermandril1/status/1238453486381080577
2020-03-13 13:07:30,aotxotorena,,0,3,4,"España siglo XXI. No voy a decir lo que pienso de los curas, por respeto a los que son religiosos, pero seguro que todos lo sabéis. Fgjjiimhgfdcgtilmbgdx nnnvfdtykkll!!!! #Covid_19 ",,,#Covid_19,1238451620175904770,https://twitter.com/aotxotorena/status/1238451620175904770
2020-03-13 12:49:16,aotxotorena,,1,101,82,"Inyectan 1.500.000.000.000. dólares en el sistema financiero para paliar la crisis por el #COVID19 , pero responden que no tienen plata para pagar las pruebas o tratamientos a sus ciudadanos. Insisto, en EEUU va a reventar está mierda y su sistema medieval. De todos, el peor. ",,,#COVID19,1238447032022364161,https://twitter.com/aotxotorena/status/1238447032022364161
2020-03-13 12:32:04,FigueroaCarmen9,,0,0,1,"Quisiera quedarme en casa x cuidar mi salud y la de mi familia #Covid_19 , pero no puedo xq tengo q trabajar y trabajo en salud privada , q terror de verdad",,,#Covid_19,1238442703488274433,https://twitter.com/FigueroaCarmen9/status/1238442703488274433
2020-03-13 12:18:27,boafestasamba,,0,0,0,"A tomar precauciones , pero sin generar frustraciones. #Covid_19",,,#Covid_19,1238439276842377216,https://twitter.com/boafestasamba/status/1238439276842377216
2020-03-13 12:03:12,masqueuncoach,,1,1,0,"¿Cuál será el protocolo con los fallecidos por el #Covid_19?",,,#Covid_19,1238435440706936832,https://twitter.com/masqueuncoach/status/1238435440706936832
2020-03-13 11:50:59,aotxotorena,planwac,1,51,26,"De todos los países del primer mundo, destaca uno que no tiene sanidad pública, en el que las pruebas para el #Covid_19 cuestan 2 o 3000 dólares, no hay baja laboral, y no hay un control y registro fiable de la enfermedad, ya que la gente trabaja hasta reventar: EEUU. ",,,#Covid_19,1238432364012769280,https://twitter.com/aotxotorena/status/1238432364012769280
2020-03-13 11:45:31,Yovavasquez96,porquetendencia,0,1,0,"Y con tanto COVID-19 en Brasil ",,,,1238430991422816256,https://twitter.com/Yovavasquez96/status/1238430991422816256
2020-03-13 11:25:44,Cuecos,,1,0,3,"Buenos días y feliz viernes. Si pueden hacerlo, trabajen desde sus casas. #quedateencasa #Covid_19",,,#quedateencasa #Covid_19,1238426012263886849,https://twitter.com/Cuecos/status/1238426012263886849
2020-03-13 11:00:35,esojegetro,,0,0,0,"Coronavirus :España, el segundo país con más casos. Los Reyes dan negativo en la prueba del Covid-19 ",,,,1238419683138822144,https://twitter.com/esojegetro/status/1238419683138822144
2020-03-13 10:35:16,elidjos,,0,0,2,"Mes de mi cumpleaños : Marzo 2019 ""apagones a nivel nacional, crisis con el suministro de agua, protestas, etc""! Marzo 2020 ""pandemia mundial #Covid_19, ahora guaido quiere elecciones, marchas, suspenden todo los juego de la #Juventus""",,,#Covid_19 #Juventus,1238413310913019904,https://twitter.com/elidjos/status/1238413310913019904
2020-03-13 08:20:50,gregoriopriv,,0,1,1,"Es importante difundir éstas imágenes, mucho más que los memes! #Covid_19 #prevencion #venezuela",,,#Covid_19 #prevencion #venezuela,1238379478436524032,https://twitter.com/gregoriopriv/status/1238379478436524032
2020-03-13 05:28:08,apitopapa31,WalterDossier,1,3,5,"Cuando río suena es xq piedras trae y hoy en China habló un funcionario chino y dijo q covid19 fue creado en los EEUU y en keiser report un analista internacional dijo lo mismo",,,,1238336017788211200,https://twitter.com/apitopapa31/status/1238336017788211200
2020-03-13 05:22:02,J9David,NicolasMaduro,0,0,0,"#Covid_19 Brasil (25) casos confirmados, Argentina (19) Perú (17), Chile (17), Ecuador (17), y usted ordena en Suramérica únicamente la suspensión de los vuelos provenientes de Colombia que tiene (3). ¿Lógica o resentimiento? ¡Gobierno de transición! @NicolasMaduro",,@NicolasMaduro,#Covid_19,1238334483587305472,https://twitter.com/J9David/status/1238334483587305472
2020-03-13 04:46:30,DarthWalter,LaDivinaDiva,0,0,0,"?? Ellos lo fabricaron !!! El Covid-19!!! Y no dijeron Nadaaa!!!! Mintiendole a la WHO.....!!",,,,1238325538902736896,https://twitter.com/DarthWalter/status/1238325538902736896
2020-03-13 04:30:39,sutrabunearte,,0,1,3,"#ULTIMAHORA Antes la pandemia d #COVID19 declarada por la #OMS Suspensión d actos académic Preparar a su comunidad #universitaria pa la protección d estudiantes y trabajadores Mantenerse atentos y en comunicación con #MPPEU #MPPS #JuntosTodoEsPosible #PrevenirEsLaClave",,,#ULTIMAHORA #COVID19 #OMS #universitaria #MPPEU #MPPS #JuntosTodoEsPosible #PrevenirEsLaClave,1238321552246149120,https://twitter.com/sutrabunearte/status/1238321552246149120
2020-03-13 04:03:52,dgeimppe,,0,6,1,"#12Marzo Atención: trabajadores y trabajadoras del @MPPEDUCACION por Instrucciones del presidente @NicolasMaduro se deben compartir y difundir las orientaciones y medidas preventivas contra El #COVID19 #PrevencionYProteccionDelPueblo @psuvaristobulo @MPPE_VCEUP @JorgePerezVZLA",,@MPPEDUCACION @NicolasMaduro @psuvaristobulo @MPPE_VCEUP @JorgePerezVZLA,#12Marzo #COVID19 #PrevencionYProteccionDelPueblo,1238314813522141184,https://twitter.com/dgeimppe/status/1238314813522141184
2020-03-13 03:07:13,NadalDiplo,OuestFrance,0,7,3,"#Covid_19 Un primer diplomático contaminado en la sede de las Naciones Unidas en Nueva York. @ONU_es @franceonu",,@ONU_es @franceonu,#Covid_19,1238300553832214530,https://twitter.com/NadalDiplo/status/1238300553832214530
2020-03-13 02:55:12,Richardomz18,,0,0,0,"Información, serenidad y prevención #Covid_19 ",,,#Covid_19,1238297530741460998,https://twitter.com/Richardomz18/status/1238297530741460998
2020-03-13 02:39:01,Marifredvzla,,0,0,1,"Desde la Juventud del PSUV #Portuguesa nos unimos a la campaña de prevención del Covid-19 en Venezuela. Convocamos a todas las organizaciones y movimientos juveniles a formar parte de ésta lucha por preservar la salud de nuestro pueblo. @NicolasMaduro https://www.instagram.com/p/B9p-DCjpx5-/?igshid=1n9sppb7raabm",,@NicolasMaduro,#Portuguesa,1238293459984924672,https://twitter.com/Marifredvzla/status/1238293459984924672
2020-03-13 02:31:24,JeanC_Dacosta,MailOnline,0,0,0,"La Guerra de los Simios también es consecuencia del Coronavirus. #Covid_19 #SARSCoV2",,,#Covid_19 #SARSCoV2,1238291540058963972,https://twitter.com/JeanC_Dacosta/status/1238291540058963972
2020-03-13 02:08:29,vane_prieto,,2,88,47,"El Coronavirus o #COVID_19 fue declarado por la Organización Mundial de la Salud como pandemia, siendo una infección respiratoria, de contagio de persona a persona. Te invito a seguir las recomendaciones que te presento a continuación. #PrevenciónYProtecciónDelPueblo",,,#COVID_19 #Prevenci,1238285772438024193,https://twitter.com/vane_prieto/status/1238285772438024193
2020-03-13 01:47:26,vane_prieto,,2,73,46,"Mantengámonos alertas ante los principales síntomas del Coronavirus #Covid_19. Recordemos que la clave es la prevención para la protección de nuestra salud y de quienes nos rodean. #PrevenciónYProtecciónDelPueblo @NicolasMaduro @psuvaristobulo",,@NicolasMaduro @psuvaristobulo,#Covid_19 #Prevenci,1238280478198726658,https://twitter.com/vane_prieto/status/1238280478198726658
2020-03-13 01:35:53,Eelbaelba,,0,0,0,"Ay, si me pude reír cuando todos muy serios y preocupados pendientes de la charla del Covid-19, y dice el profe Luis, ay, si esa virus salió porque una culebra de puso a tirar con un murciélago. Jajaja",,,,1238277569033707520,https://twitter.com/Eelbaelba/status/1238277569033707520
2020-03-13 01:24:00,INAMEH,,1,35,20,"#12Mar #INAMEHInforma || La tarea con el #Covid_19 es la Prevención. ¿Quieres saber de qué se trata? ¿Qué medidas tomar? @tutiempopereira @NestorLReverol",,@tutiempopereira @NestorLReverol,#12Mar #INAMEHInforma #Covid_19,1238274580365664256,https://twitter.com/INAMEH/status/1238274580365664256
2020-03-13 01:21:08,Eelbaelba,,0,0,1,"Vaya, el COVID19 ha servido para algo, por fin los tarupidos de mis vecinos apagaron su aire acondicionado. Ese ruido todas las noches. Jeje jeje Gracias Covid. Cabrones ",,,,1238273856420433923,https://twitter.com/Eelbaelba/status/1238273856420433923
